author,quote
Gilbert Arenas,"Some of them seem happy and some are still kind of in a state of shock over everything they've been through, ... I think they are just happy to be on solid ground. Get a meal. Take a shower. Just catch their breath after what they've been through the past few days. I just wanted to be here to say: 'Welcome to D.C. We're here to help you however we can.'"
Gilbert Arenas,Eddie does a good job of not pounding us in practice and giving us days off where we can recover.
Gilbert Arenas,You think you're funny until you meet somebody like Tom Tolbert.
Gilbert Arenas,"It didn't seem possible, but they've found a way to improve. They have so much more freedom with the ball, and they still make it tough on teams with their defense."
Gilbert Arenas,We've got to realize that these people lost everything they had. For some people they didn't have food or water for days. I'm just trying to do my part and help out as much as I can.
Gilbert Arenas,"Brendan is coming out and playing hard, blocking shots, getting rebounds. He's actually fighting in there."
Gilbert Arenas,We dug down deep. We got stops early in the fourth quarter and from there they were just fighting to get back.
Gilbert Arenas,"It was just one of those night where we used a lot of energy trying to get to this spot. You know, it is just one game, one game out of a seven-game series. We lost the first one. We'll be ready for the next."
Gilbert Arenas,"He has something I don't have. He has two rings. That's what every player dreams of, and he has two of them."
Gilbert Arenas,I was the one who was helping him out. But I guess he heard from somebody that I told Coach not to play him in Game 3. It wasn't like that.
Gilbert Arenas,"As well as they played in Game 1, we thought we destroyed ourselves. We didn't play our kind of basketball. We didn't do anything we preached. We decided to come out here (last night) and play our brand of basketball."
Pietro Aretino,"A high heart ought to bear calamities and not flee them, since in bearing them appears the grandeur of the mind and in fleeing them the cowardice of the heart."
Pietro Aretino,"I keep my friends as misers do their treasure, because, of all the things granted us by wisdom, none is greater or better than friendship."
Pietro Aretino,"I am, indeed, a king, because I know how to rule myself."
Micky Arison,It's not easy to take three ships out of service.
Micky Arison,"Pat told me what had happened before practice Friday, and I stayed to watch. It looked like any other practice I've ever seen him run."
Micky Arison,We have every intention of relaunching cruise service from the great city of New Orleans as soon as the infrastructure is in place so that our ships may contribute to the economic recovery of the area.
Micky Arison,"Pier is a highly talented international executive and his years in Asia, combined with his vast experience overseeing Europe's leading cruise company, bring a unique insight and perspective into our new Asian cruise initiative."
Micky Arison,"Given the significant decline in our stock price over the last few weeks, the company believes that the purchase of its stock represents a very attractive investment."
Micky Arison,"It is a testament to the resilience of our cruise business that despite an approximate 50 percent increase in fuel costs for the quarter and the worst hurricane season in our history, we were still able to grow earnings by 20 percent to achieve record fourth quarter results."
Micky Arison,"We continue to believe that our offer is a superior proposal to the Royal Caribbean proposal and is a credible, deliverable and more valuable transaction for your shareholders,"
Jean-Bertrand Aristide,Aristide and the Endless Revolution
Jean-Bertrand Aristide,"Blood has flowed in Hinche, ... It may be that the police cannot cope with this kind of attack."
Jean-Bertrand Aristide,"chopped down the tree of peace, but it will grow again."
Jean-Bertrand Aristide,"If wars are expensive, peace can be even more expensive,"
Jean-Bertrand Aristide,"If we wish to maintain peace, then we cannot accept that impunity be provided to these international criminals and drug dealers."
Jean-Bertrand Aristide,"We must all make peace so that we can all live in peace,"
Jean-Bertrand Aristide,"Far from home, I am living here, but always in deep communion with my people."
Jean-Bertrand Aristide,"Before the elections of the year 2000 which led me for the second time to the National Palace in Haiti, I had talked about peace, ... And throughout in the National Palace, throughout my tenure, I talked about peace. And today I continue to talk about peace."
Jean-Bertrand Aristide,I do believe I will be back as soon as possible and I will continue to invest in education.
Jean-Bertrand Aristide,"I am ready to give my life if that is what it takes to defend my country,"
Jean-Bertrand Aristide,He is the president-elect of the country.
Jean-Bertrand Aristide,I am still the only elected president of the country.
Aristotle,"Quality is not an act, it is a habit."
Aristotle,"They [Young People] have exalted notions, because they have not been humbled by life or learned its necessary limitations; moreover, their hopeful disposition makes them think themselves equal to great things -- and that means having exalted notions. They would always rather do noble deeds than useful ones: Their lives are regulated more by moral feeling than by reasoning -- all their mistakes are in the direction of doing things excessively and vehemently. They overdo everything -- they love too much, hate too much, and the same with everything else."
Aristotle,"To write well, express yourself like common people, but think like a wise man. Or, think as wise men do, but speak as the common people do."
Aristotle,"To the query, ''What is a friend?'' his reply was ''A single soul dwelling in two bodies.''"
Aristotle,In revolutions the occasions may be trifling but great interest are at stake.
Aristotle,No one will dare maintain that it is better to do injustice than to bear it.
Aristotle,Praise invariably implies a reference to a higher standard.
Aristotle,Poverty is the parent of revolution and crime.
Aristotle,All proofs rest on premises
Aristotle,Philosophy is the science which considers truth
Aristotle,all he would have needed to do to verify or refute this theory was to ask a number of men and women to open their mouths so he could count their teeth.
Aristotle,Memory is the scribe of the soul.
Aristotle,"Madness is badness of spirit, when one seeks profit from all sources"
Aristotle,Learning is not child's play; we cannot learn without pain
Aristotle,The law is reason free from passion
Aristotle,It is in justice that the ordering of society is centered.
Aristotle,To be conscious that we are perceiving or thinking is to be conscious of out own existence.
Aristotle,Either a beast or a god.
Aristotle,"Poetry is something more philosophic and of graver import than history, since its statements are of nature of universals, whereas those of history are of singulars"
Aristotle,"Since the things we do determine the character of life, no blessed person can become unhappy. For he will never do those things which are hateful and petty."
Aristotle,Happiness seems to require a modicum of external prosperity
Aristotle,Happiness is a sort of action.
Aristotle,"If happiness is activity in accordance with excellence, it is reasonable that it should be in accordance with the highest excellence."
Aristotle,"The moral virtues, then, are produced in us, neither by nature nor against nature. Nature, indeed, prepares in us the ground for their reception, but their complete formation is the product of habit."
Aristotle,"It is well to be up before daybreak, for such habits contribute to health, wealth, and wisdom."
Aristotle,"Young people are in a condition like permanent intoxication, because youth is sweet and they are growing."
Aristotle,"Inferiors revolt in order that they may be equal, and equals that they may be superior. Such is the state of mind which creates revolutions."
Aristotle,Nature does nothing in vain.
Aristotle,Character may almost be called the most effective means of persuasion.
Aristotle,The whole is more than the sum of its parts.
Aristotle,"The wise man does not expose himself needlessly to danger, since there are few things for which he cares sufficiently; but he is willing, in great crises, to give even his life - knowing that under certain conditions it is not worthwhile to live."
Aristotle,Nature does nothing uselessly.
Aristotle,My best friend is the man who in wishing me well wishes it for my sake.
Aristotle,"Jealousy is both reasonable and belongs to reasonable men, while envy is base and belongs to the base, for the one makes himself get good things by jealousy, while the other does not allow his neighbour to have them through envy."
Aristotle,"In making a speech one must study three points: first, the means of producing persuasion; second, the language; third the proper arrangement of the various parts of the speech."
Aristotle,"Hence poetry is something more philosophic and of graver import than history, since its statements are rather of the nature of universals, whereas those of history are singulars."
Aristotle,"For though we love both the truth and our friends, piety requires us to honor the truth first."
Aristotle,"For one swallow does not make a summer, nor does one day; and so too one day, or a short time, does not make a man blessed and happy."
Aristotle,"Excellence is an art won by training and habituation. We do not act rightly because we have virtue or excellence, but we rather have those because we have acted rightly. We are what we repeatedly do. Excellence, then, is not an act but a habit."
Aristotle,Courage is a mean with regard to fear and confidence.
Aristotle,"Every art and every inquiry, and similarly every action and choice, is thought to aim at some good; and for this reason the good has rightly been declared to be that at which all things aim."
Aristotle,"Without friends no one would choose to live, though he had all other goods."
Aristotle,"Perfect friendship is the friendship of men who are good, and alike in excellence; for these wish well alike to each other qua good, and they are good in themselves."
Aristotle,"The moral virtues, then, are produced in us neither by nature nor against nature. Nature, indeed, prepares in us the ground for their reception, but their complete formation is the product of habit."
Aristotle,"It is best to rise from life as from a banquet, neither thirsty nor drunken."
Aristotle,The greatest virtues are those which are most useful to other persons.
Aristotle,Whosoever is delighted in solitude is either a wild beast or a god.
Aristotle,This is the reason why mothers are more devoted to their children than fathers: it is that they suffer more in giving them birth and are more certain that they are their own.
Aristotle,"Those that know, do. Those that understand, teach."
Aristotle,"It is clearly better that property should be private, but the use of it common; and the special business of the legislator is to create in men this benevolent disposition."
Aristotle,"We become just by performing just action, temperate by performing temperate actions, brave by performing brave action."
Aristotle,"Excellence, then, is a state concerned with choice, lying in a mean, relative to us, this being determined by reason and in the way in which the man of practical wisdom would determine it."
Aristotle,"At his best, man is the noblest of all animals; separated from law and justice he is the worst."
Aristotle,"The law is reason, free from passion."
Aristotle,No one loves the man whom he fears.
Aristotle,"A sense is what has the power of receiving into itself the sensible forms of things without the matter, in the way in which a piece of wax takes on the impress of a signet-ring without the iron or gold."
Aristotle,All men by nature desire knowledge.
Aristotle,All men by nature desire to know.
Aristotle,Hope is the dream of a waking man.
Aristotle,"The aim of the wise is not to secure pleasure, but to avoid pain."
Aristotle,All virtue is summed up in dealing justly.
Aristotle,"Men create gods after their own image, not only with regard to their form but with regard to their mode of life."
Aristotle,The soul never thinks without a picture.
Aristotle,Bring your desires down to your present means. Increase them only when your increased means permit.
Aristotle,"What the statesman is most anxious to produce is a certain moral character in his fellow citizens, namely a disposition to virtue and the performance of virtuous actions."
Aristotle,"Different men seek after happiness in different ways and by different means, and so make for themselves different modes of life and forms of government."
Aristotle,Well begun is half done.
Aristotle,Bad men are full of repentance.
Aristotle,"Those who excel in virtue have the best right of all to rebel, but then they are of all men the least inclined to do so."
Aristotle,"He who is unable to live in society, or who has no need because he is sufficient for himself, must be either a beast or a god."
Aristotle,A true friend is one soul in two bodies.
Aristotle,Homer has taught all other poets the art of telling lies skillfully.
Aristotle,We must no more ask whether the soul and body are one than ask whether the wax and the figure impressed on it are one.
Aristotle,"Those who educate children well are more to be honored than they who produce them; for these only gave them life, those the art of living well."
Aristotle,Men acquire a particular quality by constantly acting in a particular way.
Aristotle,"The beginning of reform is not so much to equalize property as to train the noble sort of natures not to desire more, and to prevent the lower from getting more."
Aristotle,It is unbecoming for young men to utter maxims.
Aristotle,"Plato is dear to me, but dearer still is truth."
Aristotle,He who is to be a good ruler must have first been ruled.
Aristotle,All paid jobs absorb and degrade the mind.
Aristotle,The one exclusive sign of thorough knowledge is the power of teaching.
Aristotle,The worst form of inequality is to try to make unequal things equal.
Aristotle,No excellent soul is exempt from a mixture of madness.
Aristotle,Misfortune shows those who are not really friends.
Aristotle,The young are permanently in a state resembling intoxication.
Aristotle,"All human actions have one or more of these seven causes: chance, nature, compulsions, habit, reason, passion, desire."
Aristotle,A tragedy is a representation of an action that is whole and complete and of a certain magnitude. A whole is what has a beginning and middle and end.
Aristotle,A constitution is the arrangement of magistracies in a state.
Aristotle,"He who can be, and therefore is, another's, and he who participates in reason enough to apprehend, but not to have, is a slave by nature."
Aristotle,It is Homer who has chiefly taught other poets the art of telling lies skillfully.
Aristotle,"For as the eyes of bats are to the blaze of day, so is the reason in our soul to the things which are by nature most evident of all."
Aristotle,The end of labor is to gain leisure.
Aristotle,He who hath many friends hath none.
Aristotle,Temperance is a mean with regard to pleasures.
Aristotle,"No notice is taken of a little evil, but when it increases it strikes the eye."
Aristotle,"The generality of men are naturally apt to be swayed by fear rather than reverence, and to refrain from evil rather because of the punishment that it brings than because of its own foulness."
Aristotle,The least initial deviation from the truth is multiplied later a thousandfold.
Aristotle,Good habits formed at youth make all the difference.
Aristotle,Youth is easily deceived because it is quick to hope.
Aristotle,The educated differ from the uneducated as much as the living from the dead.
Aristotle,The gods too are fond of a joke.
Aristotle,What is a friend? A single soul dwelling in two bodies.
Aristotle,"It is just that we should be grateful, not only to those with whose views we may agree, but also to those who have expressed more superficial views; for these also contributed something, by developing before us the powers of thought."
Aristotle,"The virtue of justice consists in moderation, as regulated by wisdom."
Aristotle,"Suffering becomes beautiful when anyone bears great calamities with cheerfulness, not through insensibility but through greatness of mind."
Aristotle,Friendship is essentially a partnership.
Aristotle,Thou wilt find rest from vain fancies if thou doest every act in life as though it were thy last.
Aristotle,A great city is not to be confounded with a populous one.
Aristotle,Pleasure in the job puts perfection in the work.
Aristotle,I have gained this from philosophy: that I do without being commanded what others do only from fear of the law.
Aristotle,Probable impossibilities are to be preferred to improbable possibilities.
Aristotle,"Dignity does not consist in possessing honors, but in deserving them."
Aristotle,"Even when laws have been written down, they ought not always to remain unaltered."
Aristotle,"We are what we repeatedly do. Excellence, then, is not an act, but a habit."
Aristotle,"Of all the varieties of virtues, liberalism is the most beloved."
Aristotle,Great men are always of a nature originally melancholy.
Aristotle,Man is a goal seeking animal. His life only has meaning if he is reaching out and striving for his goals.
Aristotle,There was never a genius without a tincture of madness.
Aristotle,"In poverty and other misfortunes of life, true friends are a sure refuge. The young they keep out of mischief; to the old they are a comfort and aid in their weakness, and those in the prime of life they incite to noble deeds."
Aristotle,"In poverty and other misfortunes of life, true friends are a sure refuge."
Aristotle,Hippocrates is an excellent geometer but a complete fool in everyday affairs.
Aristotle,"So it is naturally with the male and the female; the one is superior, the other inferior; the one governs, the other is governed; and the same rule must necessarily hold good with respect to all mankind."
Aristotle,Men are swayed more by fear than by reverence.
Aristotle,"Wicked men obey out of fear; good men, out of love."
Aristotle,"Wicked men obey for fear, but the good for love."
Aristotle,It is possible to fail in many ways...while to succeed is possible only in one way.
Aristotle,"Poetry is finer and more philosophical than history; for poetry expresses the universal, and history only the particular."
Aristotle,It is the mark of an instructed mind to rest satisfied with the degree of precision which the nature of the subject admits and not to seek exactness when only an approximation of the truth is possible.
Aristotle,"And it is characteristic of man that he alone has any sense of good and evil, of just and unjust, and the like, and the association of living beings who have this sense makes family and a state."
Aristotle,"Men regard it as their right to return evil for evil and, if they cannot, feel they have lost their liberty"
Aristotle,"for the lesser evil is reckoned a good in comparison with the greater evil, since the lesser evil is rather to be chosen than the greater"
Aristotle,"No notice is taken of a little evil, but when it increases it strikes the eye"
Aristotle,Equality consists in the same treatment of similar persons.
Aristotle,The energy of the mind is the essence of life.
Aristotle,Men cling to life even at the cost of enduring great misfortune
Aristotle,It is the mark of an instructed mind to rest satisfied with the degree of precision to which the nature of the subject admits and not to seek exactness when only an approximation of the truth is possible.
Aristotle,Teaching is the highest form of understanding.
Aristotle,It is the mark of an educated mind to rest satisfied with the degree of precision which the nature of the subject admits and not to seek exactness where only an approximation is possible.
Aristotle,Educating the mind without educating the heart is no education at all
Aristotle,"Those that know, do.  Those that understand, teach."
Aristotle,"Both oligarch and tyrant mistrust the people, and therefore deprive them of their arms."
Aristotle,"It is the nature of desire not to be satisfied, and most men live only for the gratification of it."
Aristotle,Wonder implies the desire to learn
Aristotle,"Democracy arises out of the notion that those who are equal in any respect are equal in all respects; because men are equally free, they claim to be absolutely equal."
Aristotle,"Democracy arose from men's thinking that if they are equal in any respect, they are equal absolutely."
Aristotle,"Where some people are very wealthy and others have nothing, the result will be either extreme democracy or absolute oligarchy, or despotism will come from either of those excesses."
Aristotle,"In a democracy the poor will have more power than the rich, because there are more of them, and the will of the majority is supreme."
Aristotle,"Wicked men obey from fear; good men, from love."
Aristotle,Wit is cultured insolence.
Aristotle,"The wise man does not expose himself needlessly to danger, since there are few things for which he cares sufficiently; but he is willing, in great crises, to give even his life - knowing that under certain conditions it is not worth-while to live"
Aristotle,"Every rascal is not a thief, but every thief is a rascal."
Aristotle,"The beauty of the soul shines out when a man bears with composure one heavy mischance after another, not because he does not feel them, but because he is a man of high and heroic temper."
Aristotle,"It is easy to fly into a passion... anybody can do that, but to be angry with the right person to the right extent and at the right time and in the right way that is not easy."
Aristotle,You will never do anything in this world without courage. It is the greatest quality of the mind next to honor.
Aristotle,Quite often good things have hurtful consequences. There are instances of men who have been ruined by their money or killed by their courage.
Aristotle,"Dignity consists not in possessing honors, but in the consciousness that we deserve them."
Aristotle,"The Good of man is the active exercise of his soul's faculties in conformity with excellence or virtue, or if there be several human excellences or virtues, in conformity with the best and most perfect among them"
Aristotle,"This communicating of a man's self to his friend works two contrary effects; for it redoubleth joys, and cutteth griefs in half."
Aristotle,It is not always the same thing to be a good man and a good citizen.
Aristotle,No one would choose a friendless existence on condition of having all the other things in the world.
Aristotle,"Character is that which reveals moral purpose, exposing the class of things a man chooses or avoids"
Aristotle,"Music has a power of forming the character, and should therefore be introduced into the education of the young."
Aristotle,"Character is that which reveals moral purpose, exposing the class of things a man chooses or avoids."
Aristotle,"To enjoy the things we ought, and to hate the things we ought, has the greatest bearing on excellence of character."
Aristotle,"I say that habit's but a long practice, friend, And this becomes men's nature in the end"
Aristotle,"One must learn by doing the thing, for though you think you know it, you have no certainty until you try"
Aristotle,"Moral excellence comes about as a result of habit. We become just by doing just acts, temperate by doing temperate acts, brave by doing brave acts."
Aristotle,"The coward calls the brave man rash, the rash man calls him a coward."
Aristotle,I count him braver who overcomes his desires than him who conquers his enemies; for the hardest victory is over self.
Aristotle,"A democracy is a government in the hands of men of low birth, no property, and vulgar employment"
Aristotle,"Teachers who educate children deserve more honor than parents who merely gave birth; for bare life is furnished by the one, the other ensures a good life"
Aristotle,The best friend is the man who in wishing me well wishes it for my sake.
Aristotle,"All that one gains by falsehood is, not to be believed when he speaks the truth"
Aristotle,We should behave to our friends as we would wish our friends to behave to us
Aristotle,Beauty is the gift of God.
Aristotle,"The chief forms of beauty are order and symmetry and definiteness, which the mathematical sciences demonstrate in a special degree."
Aristotle,"The beauty of the soul shines out when a man bears with composure one heavy mischance after another, not because he does not feel them, but because he is a man of high and heroic temper"
Aristotle,"Beauty depends on size as well as symmetry. No very small animal can be beautiful, for looking at it takes so small a portion of time that the impression of it will be confused. Nor can any very large one, for a whole view of it cannot be had at once, and so there will be no unity and completeness."
Aristotle,"The mathematical sciences particularly exhibit order, symmetry, and limitation; and these are the greatest forms of the beautiful."
Aristotle,"Beauty depends on size as well as symmetry. No very small animal can be beautiful, for looking at it takes so small a portion of time that the impression of it will be confused. Nor can any very large one, for a whole view of it cannot be had at once"
Aristotle,Personal beauty is a greater recommendation than any letter of introduction
Aristotle,The ultimate value of life depends upon awareness and the power of contemplation rather than upon mere survival.
Aristotle,It is simplicity that makes the uneducated more effective than the educated when addressing popular audiences.
Aristotle,"It's been approved and gone to the board,"
