author,quote
Herb Alpert,"We were like a trial for the digital process, and I found that in that particular timeframe, there were too many problems with it."
Herb Alpert,We finally got our big break when Ed Sullivan put us on his show.
Herb Alpert,"We always felt that if you do something with quality and integrity, then it's going to come back to you."
Herb Alpert,This was during a period when I was producing Brazil '66 records and got infected by Brazilian music.
Herb Alpert,"There's something interesting about playing live; you're in the moment, and I think it would be beneficial."
Herb Alpert,The trumpet was not a lyrical singing instrument.
Herb Alpert,The reaction to this album has just been fabulous around the world... and I've had offers to perform from around the world and I'm tempted to do it. I've got itchy lips.
Herb Alpert,The Japanese seem to be a loyal audience.
Herb Alpert,"Selfishly, I make music for me. I like to make music. I like looking for songs. I like working with interesting musicians. I like producing records. It's something I will always do."
Herb Alpert,Mexican Shuffle was a turning point of the Brass.
Herb Alpert,"It's very clean. With tape, you get noise."
Herb Alpert,"It's - as opposed to tape where you have a magnetic tape that's excited by frequencies that you hit, digital was a process where musical sounds are transferred to numbers and stored as numbers."
Herb Alpert,Instrumental music can spread the international language.
Herb Alpert,"If you look at a record under a microscope, the high frequencies are short jagged edges... and the low frequencies are long swinging ones are deep bass sounds. When it cut it at half speed, you're getting more of those on the record."
Herb Alpert,I'm sure I'll go back again and record in the digital process.
Herb Alpert,"I'm an old-timer in the business from the sense that when you do something that you feel good about there might be another person out there who feels the same way, or a hundred or a couple million."
Herb Alpert,"I was taken in by the bravado and the sounds of Mexico... not so much the music, but the spirit."
Herb Alpert,"I was obligated to do a bunch of concerts and a television show, but something in my stomach was telling me this wasn't what I wanted to do."
Herb Alpert,I practice every day. I've been doing it since I was eight.
Herb Alpert,I never thought of myself as a trumpet player in the traditional sense: I never played in a big band... I didn't struggle the normal way.
Herb Alpert,I like to listen to classical music... I like mainline jazz.
Herb Alpert,"I like to listed to the adventurous guys - the Coltranes, Miles Davis, the guys who just let it loose."
Herb Alpert,I find that it's nice to work with somebody and spin off on someone else's feelings. You get a little jaded by yourself.
Herb Alpert,"I don't think radio is selling records like they used to. They'd hawk the song and hawk the artist and you'd get so excited, you'd stop your car and go into the nearest record store."
Herb Alpert,I confess that I listen to my own music for my own pleasure.
Herb Alpert,"Although there was a point with the Tijuana Brass where we were playing for such huge crowds that I kind of lost contact. At one point, the only connection I had with the audience was with people out there lighting cigarettes."
Herb Alpert,"He has a method that likens the musician to an athlete, so I do physical exercises designed to keep a musician in shape in order to perform the function, which is to play music."
Herb Alpert,Clifford Brown was in the jazz circles considered to be probably the greatest trumpet player who ever lived.
Herb Alpert,"I wake up in the morning, I do a little stretching exercises, pick up the horn and play."
Philip Alston,An independent investigation is essential because these killings have huge implications for efforts to establish the rule of law in Iraq.
Philip Alston,"Under international law, widespread or systematic attacks against the civilian population are crimes against humanity."
Philip Alston,"When defense lawyers are murdered, the rule of law is doubly at stake. Human rights law requires that all murders be investigated in a credible manner. Moreover, defense attorneys are critical to a fair trial, and their systematic assassination threatens the entire process."
Philip Alston,The dangerous escalation of the conflict in recent days is a direct consequence of killings being allowed to run unchecked.
Dana Altman,He misses playing. He prepared really hard for his senior year. It has been tough on him.
Dana Altman,"I talk to the players all the time about not making excuses. I'm probably the worst at making excuses. You've just got to keep going. The players have shown a lot of resiliency, and I appreciate that."
Dana Altman,"The guys played with some energy tonight. We got a few shots down, which helped us get going. This time of year, when you don't play for 13 days, that's really a long time."
Barry Alvarez,That's two weeks in a row we've had to come back. Finally getting rewarded with a victory helps morale.
Barry Alvarez,"Coach Mason could have taken a safety, but that's his call and I'm not going to second-guess him."
Barry Alvarez,"(Hampton) isn't the most gifted athlete that we have, yet he takes so much pride in how he plays, he's on every special team and I just thought it would send a strong message to our special-team guys that we appreciate them and that's the type of effort and that's the type of play that we're looking for."
Barry Alvarez,"When we win big games, our running backs play well."
Barry Alvarez,We always talk about being a spark and swinging the momentum of the game and that swung it.
Barry Alvarez,"They all recruit hard, they play solid football, they all have a good plan. It's not just someone trying to out-formation you, they know what it's all about. I think the coaching in this league is very strong."
Barry Alvarez,"I feel pretty good about (the retirement) because frankly there are not too many guys in my business who can do it. I feel grateful the university has been so good to me and my family. I have a chancellor that has been very supportive of me, and his cooperation on what I wanted to do and how I wanted to do it. I think that is very unique to have a situation like that."
Barry Alvarez,"They came in and took my blood pressure about 10 minutes after the game, and it was off the charts,"
Barry Alvarez,I'm going to take the blame on that one ... because I called the swift kick. We should have just kicked it deeper. We flat out gave them three points. It's my fault for calling it.
Barry Alvarez,Matt was probably 205 pounds when we recruited him. But we could see what kind of athlete he is. He has a big frame (6-foot-6). He'll get on the field. He's very athletic. He's really going to be something some day.
R. Ambedkar,The relationship between husband and wife should be one of closest friends.
R. Ambedkar,"So long as you do not achieve social liberty, whatever freedom is provided by the law is of no avail to you."
R. Ambedkar,"Justice has always evoked ideas of equality, of proportion of compensation. Equity signifies equality. Rules and regulations, right and righteousness are concerned with equality in value. If all men are equal, then all men are of the same essence, and the common essence entitles them of the same fundamental rights and equal liberty... In short justice is another name of liberty, equality and fraternity."
R. Ambedkar,My definition of democracy is - A form and a method of Government whereby revolutionary changes in the social life are brought about without bloodshed. That is the real test. It is perhaps the severest test. But when you are judging the quality of the material you must put it to the severest test.
R. Ambedkar,"If I find the constitution being misused, I shall be the first to burn it."
R. Ambedkar,"I feel that the constitution is workable, it is flexible and it is strong enough to hold the country together both in peacetime and in wartime. Indeed, if I may say so, if things go wrong under the new Constitution, the reason will not be that we had a bad Constitution. What we will have to say is that Man was vile."
R. Ambedkar,"History shows that where ethics and economics come in conflict, victory is always with economics. Vested interests have never been known to have willingly divested themselves unless there was sufficient force to compel them."
R. Ambedkar,I measure the progress of a community by the degree of progress which women have achieved.
R. Ambedkar,"Given the time and circumstances, nothing under the sun shall stop this country from becoming a super power.Being grateful has limitations, no man can be grateful at the cost of his dignity, no woman at the cost of her chastity and no country at the cost of its freedom.I hope that Mr. Gandhi will not drive me to the necessity of making a choice between his life and rights of my people, for I shall never consent to deliver my people bound hand and foot to the orthodox for generations to come."
R. Ambedkar,"Law and order are the medicine of the body politic and when the body politic gets sick, medicine must be administered."
R. Ambedkar,"Why does a human body become deceased? The reason is that as long as the human body is not free from suffering, mind cannot be happy. If a man lacks enthusiasm, either his body or mind is in a deceased condition.... Now what saps the enthusiasm in man? If there is no enthusiasm, life becomes drudgery - a mere burden to be dragged. Nothing can be achieved if there is no enthusiasm. The main reason for this lack of enthusiasm on the part of a man is that an individual looses the hope of getting an opportunity to elevate himself. Hopelessness leads to lack of enthusiasm. The mind in such cases becomes deceased.... When is enthusiasm created? When one breaths an atmosphere where one is sure of getting the legitimate reward for one's labor, only then one feels enriched by enthusiasm and inspiration."
Mark Amdahl,"I'm going to play man-to-man, I think. If we play zone, she'll have 50 (points)."
Mark Amdahl,"If we get out in the open court, there's some unbelievable things the girls have done this year."
Mark Amdahl,The girls are ready to start open gym already.
Mark Amdahl,"A coach is only as good as his players are, I think. They had a goal and they really have stuck with it. They deserve to be here."
Mark Amdahl,"Shooting 34 percent in the state basketball tournament, I don't think you're going to win a lot of games."
Gil Amelio,"While the operating results are disappointing, we made significant progress toward executing our strategic plans during the quarter,"
Gil Amelio,"(The earnings) represent real progress, ... The key is growth margins went in the right direction, unit volume increased quarter on quarter, and expenses came down. We threw off over $300 million in cash. All of those were in the right direction. So I think we're on our way."
Gil Amelio,"While the operating results are disappointing, we made significant progress toward executing our strategic plans during the quarter."
Gil Amelio,"The key is growth margins went in the right direction, unit volume increased quarter on quarter, and expenses came down. We threw off over $300 million in cash. All of those were in the right direction. So I think we're on our way."
Gil Amelio,The hardest part of this job is that you have to be more than a manager. You have to be a rock star. And I'm not that good a rock star.
Gil Amelio,"People have said that NeXT is 5 to 7 years ahead of the competition... Candidly, we made the same assessment. That's why I made the acquisition."
Stephen Ames,"It's just another tournament, just another major."
Stephen Ames,"I guess overall you've got to believe that you have a great golf swing and it's working. If you start worrying about if your golf swing is there or not, you're going to fall."
Stephen Ames,"It's always been a special place ... for golf. There's a lot of mystique behind the place. Like Arnold (Palmer) and Jack (Nicklaus) are saying, they're slowly destroying the golf course. It's not the same golf course that it used to be."
Stephen Ames,It's not the same golf course that it used to be.
Stephen Ames,It's been a big burden trying to play golf. Other things play on your mind. I'm happy to be in this position again. It's been a long battle.
Stephen Ames,"When you live in Calgary and take 10 weeks off from golf, you're just trying to get back to basics."
Stephen Ames,It's always been a good golf course to my eyes.
Stephen Ames,the best golf course I've played in Canada.
William Ames,"Although the whole man partakes of this grace, it is first and most appropriately in the soul and later progresses to the body, inasmuch as the body of the man is capable of the same obedience to the will of God as the soul."
William Ames,The ordinary ministry is that which receives all of its direction from the will of God revealed in the Scriptures and from those means which God has appointed in the church for its continual edification.
William Ames,"Nothing exists from eternity but God, and God is not the matter or a part of any creature, but only the maker."
William Ames,"Faith is the virtue by which, clinging-to the faithfulness of God, we lean upon him, so that we may obtain what he gives to us."
William Ames,"Active creation is conceived as a transitive action in which there is always presupposed an object about which the agent is concerned; it is virtually but not formally transitive because it makes, not presupposes, an object."
William Ames,"This subsistence, or manner of being of God is his one essence so far as it has personal properties."
William Ames,"Therefore, the church is not absolutely necessary as an object of faith, not even for us today, for then Abraham and the other prophets would not have given assent to those things which were revealed to them from God without any intervening help of the church."
William Ames,"The worship which directs itself toward God as our good regards him either as he is ours at present, in faith, or as he is to be ours, in hope."
William Ames,The world has not been in existence from eternity nor could it have been according to the present dispensation and ordering of things.
William Ames,The will of God is single and totally one in Him.
William Ames,"The will of God is eternal because He does not begin to will what He did not will before, nor cease to will what He willed before."
William Ames,"The starting point of sanctification is the filthiness, corruption, or stain of sin."
William Ames,"The relative property of the Son is to be begotten, that is, so to proceed from the Father as to be a participant of the same essence and perfectly carry on the Father's nature."
William Ames,The goodness of a thing created is the perfection of its fitness for the use which it serves. Now that use is either particular or universal.
William Ames,The good pleasure of God is an act of the divine will freely and effectively determining all things.
William Ames,The efficiency of God may be understood as either creation or providence.
William Ames,"The counsel of God is, as it were, his deliberation over the best manner of accomplishing anything already approved by the understanding and the will."
William Ames,The attributes of God tell us what He is and who He is.
William Ames,Sanctification is the real change in man from the sordidness of sin to the purity of God's image.
William Ames,"Sanctification is not to be understood here as a separation from ordinary use or consecration to some special use, although this meaning is often present in Scripture, sometimes referring to outward and sometimes to inward or effectual separation."
William Ames,"In the exercise of God's efficiency, the decree of God comes first. This manner of working is the most perfect of all and notably agrees with the divine nature."
William Ames,In contentment and joy are found the height and perfection of all love towards our neighbor.
William Ames,Hence the end of the world should be awaited with all longing by all believers.
William Ames,Hearing the word is the devout receiving of the will of God.
William Ames,"Hearing here, therefore, means any receiving of the word of God whether it be communicated to us by preaching, reading, or any other way."
William Ames,For this is our most perfect duty and yet least known to us by nature: Whatever we conceive or will should be joined with the good of our neighbor.
William Ames,"Everyone who understands the nature of God rightly necessarily knows that God is to be believed and hoped in, that he is to be loved and called upon, and to be heard in all things."
William Ames,"But the church cannot confer the necessary gifts for this ministry, and cannot prescribe for God those upon whom he should confer them."
William Ames,"An idea in man is first impressed upon him and afterwards expressed in things, but in God it is only expressed, not impressed, because it does not come from anywhere else."
Henri Frederic Amiel,An error is the more dangerous in proportion to the degree of truth which it contains
Henri Frederic Amiel,Doing easily what others find difficult is talent; doing what is impossible for others is genius.
Henri Frederic Amiel,Work while you have the light. You are responsible for the talent that has been entrusted to you.
Henri Frederic Amiel,The only substance properly so called is the soul.
Henri Frederic Amiel,"Society lives by faith, and develops by science."
Henri Frederic Amiel,"Our true history is scarcely ever deciphered by others. The chief part of the drama is a monologue, or rather an intimate debate between God, our conscience, and ourselves. Tears, grieves, depressions, disappointments, irritations, good and evil thoughts, decisions, uncertainties, deliberations --all these belong to our secret, and are almost all incommunicable and intransmissible, even when we try to speak of them, and even when we write them down."
Henri Frederic Amiel,"Sacrifice still exists everywhere, and everywhere the elect of each generation suffers for the salvation of the rest."
Henri Frederic Amiel,To shun one's cross is to make it heavier.
Henri Frederic Amiel,We are never more discontented with others than when we are discontented with ourselves.
Henri Frederic Amiel,A thousand things advance; nine hundred and ninety-nine retreat: that is progress.
Henri Frederic Amiel,"The philosopher is like a man fasting in the midst of universal intoxication. He alone perceives the illusion of which all creatures are the willing playthings; he is less duped than his neighbor by his own nature. He judges more sanely, he sees things as they are. It is in this that his liberty consists -- in the ability to see clearly and soberly, in the power of mental record."
Henri Frederic Amiel,"The man who insists upon seeing with perfect clearness before he decides, never decides. Accept life, and you must accept regret."
Henri Frederic Amiel,"Without passion man is a mere latent force and possibility, like the flint which awaits the shock of the iron before it can give forth its spark."
Henri Frederic Amiel,The fire which enlightens is the same fire which consumes.
Henri Frederic Amiel,The thirst for truth is not a French passion
Henri Frederic Amiel,"Mozart has the classic purity of light and the blue ocean; Beethoven the romantic grandeur which belongs to the storms of air and sea, and while the soul of Mozart seems to dwell on the ethereal peaks of Olympus, that of Beethoven climbs shuddering the storm-beaten sides of a Sinai. Blessed be they both! Each represents a moment of the ideal life, each does us good. Our love is due to both."
Henri Frederic Amiel,"Thought is a kind of opium; it can intoxicate us, while still broad awake; it can make transparent the mountains and everything that exists."
Henri Frederic Amiel,"Materialism coarsens and petrifies everything, making everything vulgar, and every truth false."
Henri Frederic Amiel,"It is not what he had, or even what he does, which expresses the worth of a man, but what he is."
Henri Frederic Amiel,"Women wish to be loved without a why or a wherefore; not because they are pretty, or good, or well-bred, or graceful, or intelligent, but because they are themselves."
Henri Frederic Amiel,"Sacrifice, which is the passion of great souls, has never been the law of societies."
Henri Frederic Amiel,Clever people will recognize and tolerate nothing but cleverness.
Henri Frederic Amiel,"Every life is a profession of faith, and exercises an inevitable and silent influence."
Henri Frederic Amiel,Self-interest is but the survival of the animal in us. Humanity only begins for man with self-surrender.
Henri Frederic Amiel,"Great men are true men, the men in whom nature has succeeded. They are not extraordinary -- they are in the true order. It is the other species of men who are not what they ought to be."
Henri Frederic Amiel,To do easily what is difficult for others is the mark of talent. To do what is impossible for talent is the mark of genius.
Henri Frederic Amiel,Doing easily what others find difficult is talent; doing what is impossible for talent is genius.
Henri Frederic Amiel,In health there is freedom. Health is the first of all liberties.
Henri Frederic Amiel,"Without passion man is a mere latent force and possibility, like the flint which awaits the shock of the iron before it can give forth its spark"
Henri Frederic Amiel,"Tell me what you feel in your room when the full moon is shining in upon you and your lamp is dying out, and I will tell you how old you are, and I shall know if you are happy"
Henri Frederic Amiel,Truth is not only violated by falsehood; it may be equally outraged by silence
Henri Frederic Amiel,Every life is a profession of faith and exercises an inevitable and silent influence.
Henri Frederic Amiel,"True love is that which ennobles the personality, fortifies the heart, and sanctifies the existence."
Henri Frederic Amiel,To marry unequally is to suffer equally.
Henri Frederic Amiel,"Liberty, equality - bad principles! The only true principle for humanity is justice; and justice to the feeble is protection and kindness."
Henri Frederic Amiel,Tears are the symbol of the inability of the soul to restrain its emotion and retain its self command.
Henri Frederic Amiel,To know how to suggest is the art of teaching.
Henri Frederic Amiel,"Our duty is to be useful, not according to our desires, but according to our powers."
Henri Frederic Amiel,The best path through life is the highway.
Henri Frederic Amiel,Woman is the salvation or the destruction of the family. She carries its destiny in the folds of her mantle.
Henri Frederic Amiel,Destiny has two ways of crushing us -- by refusing our wishes and by fulfilling them.
Henri Frederic Amiel,"Women wish to be loved not because they are pretty, or good, or well bred, or graceful, or intelligent, but because they are themselves."
Henri Frederic Amiel,"In every loving woman there is a priestess of the past -- a pious guardian of some affection, of which the object has disappeared."
Henri Frederic Amiel,We must have the courage to be happy
Henri Frederic Amiel,True humility is contentment.
Henri Frederic Amiel,Pure truth cannot be assimilated by the crowd; it must be communicated by contagion.
Henri Frederic Amiel,Common sense is the measure of the possible; it is composed of experience and prevision; it is calculation applied to life.
Henri Frederic Amiel,Common sense is calculation applied to life.
Henri Frederic Amiel,"Cleverness is serviceable for everything, sufficient for nothing."
Henri Frederic Amiel,"Cleverness is serviceable for everything, sufficient for nothing"
Henri Frederic Amiel,Charm is the quality in others that makes us more satisfied with ourselves.
Henri Frederic Amiel,"Our systems, perhaps, are nothing more than an unconscious apology for our faults --a gigantic scaffolding whose object is to hide from us our favorite sin."
Henri Frederic Amiel,Thankfulness is the beginning of gratitude. Gratitude is the completion of thankfulness. Thankfulness may consist merely of words. Gratitude is shown in acts.
Henri Frederic Amiel,"To know how to grow old is the master work of wisdom, and one of the most difficult chapters in the great art of living."
Henri Frederic Amiel,Life is short. Be swift to love! Make haste to be kind!
Henri Frederic Amiel,"A lively, disinterested, persistent liking for truth is extraordinarily rare. Action and faith enslave thought, both of them in order not to be troubled or inconvenienced by reflection, criticism or doubt."
Henri Frederic Amiel,For purposes of action nothing is more useful than narrowness of thought combined with energy of will.
Henri Frederic Amiel,"Action is coarsened thought; thought becomes concrete, obscure, and unconscious."
Henri Frederic Amiel,"Action and faith enslave thought, both of them in order not be troubled or inconvenienced by reflection, criticism, and doubt."
Henri Frederic Amiel,For purposes of action nothing is more useful than narrowness of thought combined with energy of will
Henri Frederic Amiel,"Man becomes man only by his intelligence, but he is man only by his heart."
Henri Frederic Amiel,I'm not interested in age. People who tell me their age are silly. You're as old as you feel.
Ed Amoroso,It's CNN for security geeks.
Ed Amoroso,My security team monitors just about everything.
Ed Amoroso,"There is no way to actively portray where security problems are coming from because all attacks look the same, and that forces you to assume the worst every time."
Tori Amos,Women must understand that simply attacking or hating men is just another form of disempowerment. A woman has to realize that when she makes a man crawl it doesn't give her power.
