author,quote
Andre Agassi,"Well, I actually tell my son that I don't have any hair because he asked me the same question that I gave it to him when he was born, so he actually still believes that. He's five years old."
Andre Agassi,Tennis was always sort of a - a learning. It was a vehicle for me to discover a lot about myself. And the things that I sort of discovered at times I not only didn't want to see it for myself but I certainly didn't want millions of people to see it.
Andre Agassi,"Sometimes it's just harder to remind yourself about what you're doing and why you're doing it... Other times, you have a great desire for it, but physically you're not responding the way you want. That presents other challenges. Then sometimes it all comes together."
Andre Agassi,"Some moments it feels longer, other moments it feels like it's flown by; you can't believe you've done it all that time... Overall, you have a strong sense for the full spectrum that you've sort of traveled."
Andre Agassi,"My father actually moved out from Chicago just so he could play tennis 365 days a year, so it was - it was a place we played every day. We played before school. We played after school. We woke up. We played tennis. We brushed our teeth in that order."
Andre Agassi,I've been motivated by overcoming challenge and overcoming the hurdles and obstacles that face me. There still is plenty out there to get motivated by.
Andre Agassi,I've been criticized for not having perspective in the past and I thought that of myself many times but not there.
Andre Agassi,I'm going to go down swinging... I'm sure as heck not going to go home and say I had a bad tournament.
Andre Agassi,I think one of the greatest joys I have now in my career and in my profession is to be playing at an age where I can appreciate it more than I used to... It's a whole different lens you look through the older you get.
Andre Agassi,I had my moments for sure but I wasn't confrontational. And sometimes you get on the court and you'd find yourself very confrontational. It was all a discovery.
Andre Agassi,"Having a family was something I always dreamed about and looked forward to, certainly to find somebody that you want to have a family with."
Andre Agassi,"First of all, let me say, 1:15 in the morning, for 20,000 people to still be here, I wasn't the winner, tennis was. That's awesome. I don't know if I've ever felt so good here before."
Andre Agassi,"But, I would say when I was four years old and I was at the Alan King Tennis Tournament and I was hitting with all the pros that would come to town. They would get me on the court or take notice and that stayed with me."
Andre Agassi,"It means a lot to you, to be out there. The highs are pretty high, and the lows are pretty low. You know, it's easy to feel like you let the team down. I mean, at the end of the day we still got to figure out a way to get through the tie."
Andre Agassi,"I question myself every day. That's what I still find motivating about this. I don't have the answers, I don't pretend that I do just because I won the match. Just keep fighting and maybe something good happens."
Andre Agassi,"I had moments of my actions and words not reflecting who it is I am - if that defines a punk, then yes, absolutely."
Andre Agassi,If you don't practice you don't deserve to win.
Andre Agassi,"You don't cheat anybody out of their experience, whatever it is."
Andre Agassi,I'm going to have to pick my shots and play great tennis.
Andre Agassi,"It has meant a lot to me to challenge the best players in the world and to beat them. And it means a lot to me to be out here and fighting for the title and, you know, it hurts not to win it."
Andre Agassi,I feel old when I see mousse in my opponent's hair.
Andre Agassi,Nothing can substitute for just plain hard work. I had to put in the time to get back. And it was a grind. It meant training and sweating every day. But I was completely committed to working out to prove to myself that I still could do it.
Andre Agassi,I got a hundred bucks says my baby beats Pete's baby. I just think genetics are in my favour.
Andre Agassi,Being number two sucks.
Andre Agassi,"What makes something special is not just what you have to gain, but what you feel there is to lose."
Andre Agassi,"Over the last 20 years, I've come full circle, ... To be here at an age where I can take in that sort of love and be at an age where I can embrace it is a tremendous feeling."
Andre Agassi,"He's always been a real dangerous player, ... You never know when somebody comes of age or game. (For) some people, it happens a lot earlier than others. I haven't played him in a while. Certainly watching his wins over the last couple weeks have been great, not only here, but also in New Haven (where Blake won the title). He just looks like he's doing a lot of things well. There's no question he's doing something better than he used to do."
Andre Agassi,He was too good. I would suggest to his next opponent that he doesn't look to me for advice
Shai Agassi,We started our planning by asking our customers what they needed. They needed continuous deployment options and a more strategic CRM... They wanted more than just a sliver of customer information. They wanted a full picture of the customer.
Shai Agassi,We started our planning by asking our customers what they needed. They needed continuous deployment options and a more strategic CRM...They wanted more than just a sliver of customer information. They wanted a full picture of the customer.
Shai Agassi,"It's not about who is buying whom in the industry, it's about process innovation."
Shai Agassi,They needed continuous deployment options and a more strategic CRM.... They wanted more than just a sliver of customer information. They wanted a full picture of the customer.
Shai Agassi,"When we do acquisitions, we do it from the edges of the solutions. It's hard to buy half a heart."
Shai Agassi,It's all about execution now.
Shai Agassi,"Sometimes it was great for the customers, sometimes it wasn't great for the customers."
Shai Agassi,"After the Enterprise Services Architecture, your applications world will be made from apps by us based on these services, apps from ISVs...and apps you build yourself."
Shai Agassi,"Organizations have started to create road maps that will enable their transition to a service-oriented architecture. As such, the SAP TechEd events create a community for success by allowing customers, partners and developers to share and accelerate knowledge surrounding SAP NetWeaver while they discover how existing processes and IT landscapes can be transformed into enablers of business innovation and change."
Shai Agassi,We have the potential ability to grow fourfold by looking at the number of employees in a corporation versus the number of users that are professional users of SAP.
James Agate,"Intelligence: I was asked tonight why I refuse to have truck with intellectuals after business hours. But of course I won t. 1. I am not an intellectual. Two minutes talk with Aldous Huxley, William Glock, or any of the New Statesman crowd would expose me utterly. 2. I am too tired after my day's work to man the intellectual palisade. 3. When my work is finished I want to eat, drink, smoke, and relax. 4. I don't know very much, but what I do know I know better than anybody, and I don't want to argue about it. I know what I think about an actor or an actress, and am not interested in what anybody else thinks. My mind is not a bed to be made and re-made."
James Agate,"Your Englishman, confronted by something abnormal will always pretend that it isn't there. If, however, you force him to look into it, he'll at once pretend that he sees the object not for what it is but for something that he would like it to be."
James Agate,The worst of failure of this kind is that it spoils the market for more competent performers.
James Agate,My mind is not a bed to be made and remade.
James Agate,Shaw's plays are the price we pay for Shaw's prefaces.
James Agate,My mind is not a bed to be made and re-made.
James Agate,"New Year's Resolution: To tolerate fools more gladly, provided this does not encourage them to take up more of my time."
James Agate,Theatre director: a person engaged by the management to conceal the fact that the players cannot act.
James Agate,"Don't pity me now, don't pity me never; I'm going to do nothing for ever and ever."
Elaine Agather,The leadership instinct you are born with is the backbone. You develop the funny bone and the wishbone that go with it.
Elaine Agather,The leadership instinct you are born with is the backbone.  You develop the funny bone and the wishbone that go with it.
Elaine Agather,We're off and running. People are holding our feet to the fire.
Philip Agee,"Well, I would like to see people ignore the law, that is to the degree the law doesn't have any meaning anymore,"
Philip Agee,"It is so ironic that the White House itself might be the first violator of this law, which my name is attached to,"
Philip Agee,"I'm not really interested in the case other than the way it might affect the law,"
Philip Agee,"It is so ironic that the White House itself might be the first violator of this law, which, my name is attached to,"
Spiro Agnew,"All sport... is one of the few activities where young people can proceed along traditional avenues, where objectives are clear, where the desire to win is not only permissible, but encouraged."
Spiro Agnew,"Three things have been difficult to tame: the oceans, fools and women. We may soon be able to tame the oceans; fools and women will take a little longer."
Spiro Agnew,The American people should be made aware of the trend toward monopolization of the great public information vehicles and the concentration of more and more power over public opinion in fewer and fewer hands.
Spiro Agnew,"They have formed their own 4-H club - the hopeless, hysterical hypochondriacs of history."
Spiro Agnew,"Confronted with the choice, the American people would choose the policeman's truncheon over the anarchist's bomb."
Javier Aguirre,By the 10th round we could have half the season's work done. If we can finish the week well we can be in a great situation.
Javier Aguirre,"Real Madrid is in a mess because it's suffering really high pressure and demands. We must take the initiative because we're at home, we're only a point behind and we can make history."
Javier Aguirre,This team knows that they are part of history but it also knows that they have done nothing yet.
Javier Aguirre,"We put in a lot of effort, our fans cheer us on although what we need is to greater consistency and better performances on the road."
Bertie Ahern,"We have the strongest possible basis for permanent peace in Ireland, such as has never before been experienced in our history,"
Bertie Ahern,I spoke to Jose Manuel last night and was happy to share this information with him. It is a great tribute to the prime minister and to Portugal that colleagues have expressed such support for him and wish to see him accept this appointment.
Bertie Ahern,George should be remembered as the very best at what he did. He was quite simply a football genius.
Bertie Ahern,"I would be a disaster, to put it at its mildest, if any of the institutions were to slide. I think people need to think very, very hard,"
Bertie Ahern,There is absolutely no excuse for the disgraceful scenes in Dublin today. It is the essence of Irish democracy and republicanism that people are allowed to express their views freely and in a peaceful manner.
Bertie Ahern,"was prepared to take risks for the peace process, risks to secure agreement and risks to implement it."
Bertie Ahern,Obviously we had wished to be able to present the proposals in the context of full agreement. (But) we are on the brink of an accommodation that would have been regarded as impossible not that long ago.
Akbar Ahmed,"Walking breaks down all the barriers you become part of one common mass of humanity, ... global message of peace and compassion."
Akbar Ahmed,"Cultures are rubbing against each other more than ever before in history. We need to be sensitive to ... respect, honor, dignity, and how they are viewed in different societies."
Akbar Ahmed,sends out a message both to critics and to supporters that he has the backing of America.
Martti Ahtisaari,The progress has to start now.
Martti Ahtisaari,I pleaded with [Serbian] leaders to encourage the Kosovo Serbs to take an active role in the negotiations and in Kosovo institutions. I told them that the talks in Vienna were a good start and invited them to stay continuously engaged.
Martti Ahtisaari,"There are certain standards, like the protection of minorities and the improvement in their lives that have to be improved now."
Martti Ahtisaari,There is a lot of hard work that needs to be done
Martti Ahtisaari,"As the talks are entering a sensitive phase, I appeal to all parties concerned to exercise utmost restraint on the ground."
Martti Ahtisaari,I don't see this development as a government crisis. We will continue the negotiations ... this development will not influence the process.
Martti Ahtisaari,It's an excellent choice ... for an organization that does extremely good work.
Martti Ahtisaari,This is the beginning of a new era.
Martti Ahtisaari,"Considering what has taken place during the negotiations and in the execution of the agreement, it would be difficult not to describe this as a success."
Martti Ahtisaari,"It's a leap of faith. The agreement is under 10 pages long and we could have signed 100 pages, but what counts is not words but deeds."
Martti Ahtisaari,"The ability of the countries within the region to cooperate and establish good-neighborly relations ... will be an important criterion for evaluating their prospects of full integration with the European Union,"
John Aiken,It has a certain appeal in terms of solving a couple of problems on both sides.
John Aiken,"They've been unwilling to sell to date, and I don't see what would have changed their mind at this point in the game. You could make the argument that they are in turnaround, and selling now might be at the bottom."
John Aiken,"When you get rid of the volatility factor the stock option expense creates, the earnings growth was actually very good."
Troy Aikman,"We go in with eyes wide open and recognize there will be a lot of hard work involved. But we anticipate having success. We feel like we have assembled a great group of people. If we were going to do it any other way, we would have made an announcement a long time ago. We were very diligent."
Troy Aikman,He spent the first three hours of our conversation trying to talk me out of it.
Troy Aikman,I have gone to several races and been intrigued by the competitiveness of this sport -- the way they go out and compete each and every week. The thought of being involved in that at such a high level was exciting to both of us.
Alvin Ailey,"Its roots are in American Negro culture, which is part of the whole country's heritage, ... But the dance speaks to everyone. ... Otherwise it wouldn't work."
Alvin Ailey,Sometimes you feel bad about yourself when there's no reason to.
Alvin Ailey,"One of the processes of your life is to constantly break down that inferiority, to constantly reaffirm that I Am Somebody."
Alvin Ailey,Nothing personal; I just don't have people over.
Alvin Ailey,"No matter what you write or choreograph, you feel it's not enough."
Alvin Ailey,"My lasting impression of Truman Capote is that he was a terribly gentle, terribly sensitive, and terribly sad man."
Alvin Ailey,My feelings about myself have been terrible.
Alvin Ailey,Money is a never-ending problem.
Alvin Ailey,Lena Horne is the sweetest and most adorable woman in the world.
Alvin Ailey,It will take very sophisticated marketing to achieve our aim of bringing more black people into the theater.
Alvin Ailey,"In this business, life is one long fund-raising effort."
Alvin Ailey,"If you live in the elite world of dance, you find yourself in a world rife with racism. Let's face it."
Alvin Ailey,I'm attracted to long-legged girls with long arms and a little head.
Alvin Ailey,I always want to have more dancers in my company.
Alvin Ailey,I always want more.
Alvin Ailey,Dance is for everybody. I believe that the dance came from the people and that it should always be delivered back to the people.
Alvin Ailey,"Choreography is mentally draining, but there's a pleasure in getting into the studio with the dancers and the music."
Alvin Ailey,One of the worst things about racism is what it does to young people.
Alvin Ailey,We still spend more time chasing funds than we do in the studio in creative work.
Alvin Ailey,The creative process is not controlled by a switch you can simply turn on or off; it's with you all the time.
Alvin Ailey,"Racism tears down your insides so that no matter what you achieve, you're not quite up to snuff."
Alvin Ailey,I am trying to show the world that we are all human beings and that color is not important. What is important is the quality of our work.
Anouk Aimee,"It's so much better to desire than to have... The moment of desire, when you know something is going to happen - that's the most exalting."
Anouk Aimee,"What helps me go forward is that I stay receptive, I feel that anything can happen."
Anouk Aimee,It's so much better to desire than to have.
Anouk Aimee,"It's so much better to desire than to have. . . . The moment of desire, when you know something is going to happen -- that's the most exalting."
Anouk Aimee,You can only perceive real beauty in a person as they get older.
Robert Aitken,"I was struck again by the need to collaborate and to work together strategically among churches in a city. One of the speakers really challenged me when he asked what other organization would have 1,200 franchises in one city that never talk to each other?"
Robert Aitken,But such fine words butter no parsnips.
Robert Aitken,It seems to me to be peculiarly unethical to be displaying foreign otters under a banner of educating people about the park. My view is that this is deeply inauthentic.
Akhenaton,"What is the source of sadness, but feebleness of the mind? What giveth it power but the want of reason? Rouse thyself to the combat, and she quitteth the field before thou strikest."
Akhenaton,"labor not after riches first, and think thou afterwards wilt enjoy them. He who neglecteth the present moment, throweth away all that he hath. As the arrow passeth through the heart, while the warrior knew not that it was"
Akhenaton,"As a camel beareth labour, and heat, and hunger, and thirst, through deserts of sand, and fainteth not; so the fortitude of a man shall sustain him through all perils."
Akhenaton,"Hear the words of prudence, give heed unto her counsels, and store them in thine heart; her maxims are universal, and all the virtues lean upon her; she is the guide and the mistress of human life"
Akhenaton,"As a rock on the seashore he standeth firm, and the dashing of the waves disturbeth him not. He raiseth his head like a tower on a hill, and the arrows of fortune drop at his feet. In the instant of danger, the courage of his heart sustaineth him; and the steadiness of his mind beareth him out."
Akhenaton,"To be satisfied with a little, is the greatest wisdom; and he that increaseth his riches, increaseth his cares; but a contented mind is a hidden treasure, and trouble findeth it not."
Akhenaton,"When virtue and modesty enlighten her charms, the lustre of a beautiful woman is brighter than the stars of heaven, and the influence of her power it is in vain to resist."
Shoaib Akhtar,They're going to have to rely on the reverse swing to get people out. I think it's going to be a tough series.
Shoaib Akhtar,"Both my knees were causing problems but I played on despite these injuries, just for the sake of my team."
Shoaib Akhtar,I have acute pain in my right shoulder which is very stiff. I could have played by taking pain killer injections but it is risky and I have decided to take the rest.
Shoaib Akhtar,"They'll find a different atmosphere, less bounce, good pitches for batting and it's going to be hard work for the fast bowlers."
Shoaib Akhtar,The doctors advised me six weeks rest after I bruised my ankle during the test series but I played in pain for four games.
Shoaib Akhtar,"The doctors have advised me to rest for two weeks to recover from the problem,"
Shoaib Akhtar,"It gets your blood going, the adrenaline is pumping, you're in a fight. To me, that's what test cricket is all about."
Shoaib Akhtar,He (Chappell) needs to respect the ICC more and understand what they have said about my bowling action. It's disappointing that he chose to bring this issue up again.
Jessica Alba,The secret to using power is not to use it. Just having it is enough.
Jessica Alba,"[ Proving Hollywood -- let alone society as a whole -- learned nothing from the feature film version of] Bewitched, ... I Dream of Jeannie."
Jessica Alba,"She's really girly and feminine, which is quite funny because Paul is so active and into sports. It's a nice balance for Paul."
Jessica Alba,"[And being on stage together as presenters] was great, ... And to have the energy of MC Hammer right before us! We were Hammer fans."
Jessica Alba,I thought it was my job to give all the boys their first kiss.
Jessica Alba,"not smart animals, which is why people do get bit once in a while. I was wearing a wet suit that was silver. So when I move around, it believed my head was a fish. So this shark with his mouth open was coming towards my head. I pushed it away because I freaked out. And the director later told me that that was happening to my double all day. He was like, 'I wasn't sure if it was going to happen to you.' I'm like, 'Thanks for the heads up!'"
Jessica Alba,"This is a beautiful action thriller -- it's a great date movie -- age appropriate,"
Jessica Alba,"When I used to do the action scenes, I would have to play it rough. If you hit an actress accidentally, she would usually take it on the chin and say, `Don't do that again.' But with the guys, they would put ice on it, take a 20-minute break and ask for x-rays. It was unbelievable."
Damon Albarn,"We don't sit around thinking, 'This'll be great for kids' - it just happened to really appeal to them,"
Damon Albarn,"Well, I made fun of the people in the government and then realized that even if we got rid of them, they were replaced by exactly the same guys."
Damon Albarn,"The whole period has taught me that I enjoy being part of an ensemble rather than just a front man. Don't get me wrong - I enjoy that too, but I get more enjoyment out of really listening to everyone."
Damon Albarn,The things that make me happy most are my family and working.
Damon Albarn,"The Gorillaz cartoons seem more real to me than the actual people on TV. Because at least you know that there's some intelligence behind the cartoons, and there's a lot of work that's gone into it, so it can't all be just a lie."
Damon Albarn,"The cartoon is a metaphor really for the fact that it's almost impossible in our celebrity obsessed culture to move around genres and sort of change you ideas, change your face, you know?"
Damon Albarn,"No, every album is something like a snapshot. It only shows one moment in time. It shows what we feel and think right at that point in time, nothing more and nothing less."
Damon Albarn,"More and more, cultural groups are cross-pollinating, and we're getting much more interesting art as a result."
Damon Albarn,"It's not like my old self - I'm not in character anymore, I'm me. I'm not hiding behind that anymore."
Damon Albarn,"It's also why I don't print lyrics anymore. I figure if you can't get the feeling across adequately with the song, then you've failed anyway."
Damon Albarn,"I was approached by Oxfam to go to Mali as their ambassador and get involved in their various initiatives out there. But I felt that was missing the point of using me, a musician."
Damon Albarn,I hope we can keep doing it this way - making music and art that are pure products of our influences while not really having to let the whole celebrity side of it get in the way. Then maybe more virtual bands will come out and do the same thing.
Damon Albarn,I can't be bothered anymore about giving songs titles.
Damon Albarn,Being in Blur has allowed me to travel and hear the music that's being made all over the world.
Damon Albarn,"As soon as it sounds fine, I'm on to the next thing, man."
Damon Albarn,As a musician usually music is your way out.
Damon Albarn,"And there are no stars and that you're never really sure who's doing what and what voice is what and, you know what I mean? It's supposed to be quite elusive."
Damon Albarn,"When you're doing a deal with someone in the southern Sahara, it's a very different way of doing business than in London. You can't sign them in the usual way because they'd end up getting ripped off, which would defeat the object of setting up a label like this."
Marv Albert,"I think this is going do extremely well. They'll pack the place, I don't think there is any doubt about it."
Marv Albert,It's impossible to work under conditions where they confused negativity with objectivity. You can't fool the fans.
Marv Albert,I don't really think that Reggie is going to need that much help. It's more in the area of the subtle aspects of working broadcasts.
Leon Alberti,"When I investigate and when I discover that the forces of the heavens and the planets are within ourselves, then truly I seem to be living among the gods."
Leon Alberti,We must always take from nature what we paint and always choose the most beautiful things.
Leon Alberti,Men can do all things if they will
Leon Alberti,A man can do all things if he but wills them.
Leon Alberti,Beauty:  the adjustment of all parts proportionately so that one cannot add or subtract or change without impairing the harmony of the whole
