author,quote
Alvar Aalto,Modern architecture does not mean the use of immature new materials; the main thing is to refine materials in a more human direction.
Alvar Aalto,"Building art is a synthesis of life in materialised form. We should try to bring in under the same hat not a splintered way of thinking, but all in harmony together."
Alvar Aalto,We should concentrate our work not only to a separated housing problem but housing involved in our daily work and all the other functions of the city.
Hank Aaron,I'm here to support the commissioner and tougher drug penalties.
Hank Aaron,That's going to be left up to the commissioner and the rules committee. They would probably have to go back and look at some of those things that happened.
Hank Aaron,That's going to be left up to the commissioner and the rules committee.
Hank Aaron,"I have always felt that although someone may defeat me, and I strike out in a ball game, the pitcher on the particular day was the best player. But I know when I see him again, I'm going to be ready for his curve ball. Failure is a part of success. There is no such thing as a bed of roses all your life. But failure will never stand in the way of success if you learn from it."
Hank Aaron,"I think it's very much a distraction to the ball club, and that is a cancer, you just get done playing the best team in baseball, the team has been playing very well, despite everything ... it's just a distraction, and it is a cancer,"
Hank Aaron,"Discover Greatness: An Illustrated History of Negro Leagues Baseball,"
Hank Aaron,"It took me seventeen years to get 3,000 hits in baseball. I did it in one afternoon on the golf course."
Hank Aaron,The pitcher has got only a ball. I've got a bat. So the percentage in weapons is in my favor and I let the fellow with the ball do the fretting.
Hank Aaron,I don't see pitches down the middle anymore - not even in batting practice.
Hank Aaron,"I looked for the same pitch my whole career, a breaking ball. All of the time. I never worried about the fastball. They couldn't throw it past me, none of them."
Hank Aaron,"I never smile when I have a bat in my hands. That's when you've got to be serious. When I get out on the field, nothing's a joke to me. I don't feel like I should walk around with a smile on my face."
Hank Aaron,Didn't come up here to read. Came up here to hit.
Hank Aaron,I don't feel right unless I have a sport to play or at least a way to work up a sweat.
Hank Aaron,Guessing what the pitcher is going to throw is eighty percent of being a successful hitter. The other twenty percent is just execution.
Hank Aaron,"I'm hoping someday that some kid, black or white, will hit more home runs than myself. Whoever it is, I'd be pulling for him."
Hank Aaron,"On the field, blacks have been able to be super giants. But, once our playing days are over, this is the end of it and we go back to the back of the bus again."
Hank Aaron,It took me seventeen years to get three thousand hits in baseball. I did it in one afternoon on the golf course.
Hank Aaron,"You can only milk a cow so long, then you're left holding the pail."
Hank Aaron,"I never doubted my ability, but when you hear all your life you're inferior, it makes you wonder if the other guys have something you've never seen before. If they do, I'm still looking for it."
Hank Aaron,"The triple is the most exciting play in baseball. Home runs win a lot of games, but I never understood why fans are so obsessed with them."
Hank Aaron,"My motto was always to keep swinging. Whether I was in a slump or feeling badly or having trouble off the field, the only thing to do was keep swinging."
Frank Abagnale,Why do the Yankees always win? The other team can't stop looking at the pinstripes.
Frank Abagnale,What I did in my youth is hundreds of times easier today. Technology breeds crime.
Frank Abagnale,"If my forgeries looked as bad as the CBS documents, it would have been 'Catch Me In Two Days'."
Frank Abagnale,The 2005 FBI Computer Crime Survey should serve as a wake-up call to every company in America.
Joseph Abate,"On net, we'll see some damage and a hit to corporate profits and proprietors' income, but that effect is temporary. But in the next quarter, we will get some mild stimulus from the rebuilding. Certainly, it will have no major, permanent effect on the economy."
Joseph Abate,The increase in capacity utilization is another sign of an economy approaching full employment of resources. This keeps the Fed on high alert for inflation.
Joseph Abate,Further improvement in earnings and additional declines in the unemployment rate is likely to boost overall confidence and keep consumption strong.
Mahmoud Abbas,We look with great worry on what might happen if (Sharon) is impaired.
Mahmoud Abbas,We are watching with great worry at what might happen if he is harmed.
Mahmoud Abbas,"realistic, if we work on it from now."
Mahmoud Abbas,We have to reach the moment when the vision of President Bush to have two states for the Israelis and the Palestinians is implemented.
Mahmoud Abbas,it is against our interests and it only increases the violence in this region.
Mahmoud Abbas,"We have agreed with Prime Minister Sharon to cease all violence against the Israelis and against the Palestinians, wherever they are,"
Mahmoud Abbas,"Unfortunately, the pressures have begun and the support and the aid started to decrease ... therefore, we are currently in a real financial crisis."
Mahmoud Abbas,"You either provide me support so that I can be loyal to this trust you have put in me, or you take it back,"
Mahmoud Abbas,"The most important message is our readiness, our full readiness to work for the internal security, ... We have deployed forces and we have taken a final decision on uniting the security apparatus, and we will continue applying this decision."
Mahmoud Abbas,"All the officers, soldiers and security personnel are asked not to abide by these decisions and to consider them null and void."
Mahmoud Abbas,"Today we are getting part of the payoff, of your sacrifice, by seeing the last settlers leaving Gaza. The credit for the evacuation is for you and for the martyrs who sacrificed themselves and gave their lives for the homeland."
Mahmoud Abbas,"Today we are getting part of the payoff of your sacrifice, by seeing the last settlers leaving Gaza. The credit for the evacuation is for you and for the martyrs who sacrificed themselves and gave their lives for the homeland."
Mahmoud Abbas,"Today we are getting part of the payoff, of your sacrifice, by seeing the last settlers leaving Gaza, ... The credit for the evacuation is for you and for the martyrs who sacrificed themselves and gave their lives for the homeland."
Mahmoud Abbas,This is a big responsibility that must be studied carefully.
Mahmoud Abbas,"If Mr. Sharon is facing internal problems, then I say he cannot solve one problem by creating another, ... It was the correct decision to withdraw from Gaza, and this is a good thing, and he now must continue with the peace process."
Mahmoud Abbas,"We are trying to lead our people to a just peace and to security, and we want to pave the way for the next generations."
Mahmoud Abbas,"Peace and security cannot be guaranteed by the construction of walls, by the erection of checkpoints and the confiscation of land, but rather by the recognition of rights."
Mahmoud Abbas,destructive policy toward the truce and the peace process.
Mahmoud Abbas,I am convinced that we could sign a peace accord in less than a year.
Mahmoud Abbas,"These issues are certainly harming the peace, and anyone who continues with it of course doesn't want peace."
Mahmoud Abbas,a person who has got the will to work for peace.
Mahmoud Abbas,"This exit of the settlers is the result of sacrifices of our people, the patience of our people ... and the wisdom of our people."
Mahmoud Abbas,"This pullout is a result of our sacrifice, of our patience, the sacrifice of our people, the steadfastness, and the wise people of our nation."
Mahmoud Abbas,"This pullout is a result of our sacrifice, of our patience, the sacrifice of our people, the steadfastness, and the wise people of our nation,"
Mahmoud Abbas,"This place was a taboo for us for the past 38 years, and now we are standing here."
Mahmoud Abbas,"I tell you, frankly, we have a historical opportunity that hinges on our good performance. Today there is no room for personal agendas,"
Mahmoud Abbas,"A new opportunity for peace is born,"
Mahmoud Abbas,"We have an opportunity and it would be irresponsible if we, the Israelis, or the world allow it to slip away,"
Mahmoud Abbas,Now these mistakes have been corrected.
Mahmoud Abbas,We're back to square one. Now we need time to regain calm. Our people need a quiet life and to make a living.
Mahmoud Abbas,The two leaders will not meet today because negotiators are still engaged in talks to prepare for the meeting. There will be another meeting tonight to try to finalize a joint document.
Mahmoud Abbas,"The two leaders will not meet today because negotiators are still engaged in talks to prepare for the meeting, ... There will be another meeting tonight to try to finalize a joint document."
Mahmoud Abbas,"We have taken active steps in imposing the rule of law and public order and ban armed demonstrations,"
Mahmoud Abbas,to keep law and order.
Mahmoud Abbas,We cannot build foundations of a state without rule of law.
Mahmoud Abbas,"We must all be responsible and guard the land and the property because it will leave the impression on the world that we are cultured and deserve a state,"
Mahmoud Abbas,"There have been some mistakes due to the feeling of joy,"
Mahmoud Abbas,The information I received from Jordan's prime minister and intelligence chief is dangerous and surprising at the same time.
Mahmoud Abbas,"I think that we are able to put all these ideas together and finalize them soon,"
Mahmoud Abbas,I am ready to meet him as soon as possible and I hope to sit round the negotiating table immediately.
Mahmoud Abbas,New era of peace and hope [on a ceasefire]
Mahmoud Abbas,"We are so happy with this election festival. So far, it's going very well and we hope it will keep going well until the end without any troubles."
Mahmoud Abbas,"The bullets that hit your bodies and the wounds that are still in your bodies are signs of honor,"
Mahmoud Abbas,"Up until now we haven't asked anyone to form a government. But we've negotiated with some of the factions and, of course, we will ask the party that has received the most votes to do so."
Mahmoud Abbas,"Of course, I am going to ask the majority party to form the government."
Mahmoud Abbas,"Until now, we haven't asked anyone to form the government. We are carrying on contacts with all factions, and of course we will ask the party that won the majority to form the government."
Mahmoud Abbas,"This government will continue until the end of the election period,"
Mahmoud Abbas,"lack of support for the government's policies; harsh and dangerous domestic incitement against the government and the obstruction of its functions, and unjustified accusations that the government and the prime minister had the motive of either having control over everything or nothing."
Mahmoud Abbas,"I pray to God to help us. The task is not easy, neither for us nor for the new government."
Mahmoud Abbas,"These are days of glory,"
Mahmoud Abbas,"While we are happy the Israelis have left Gaza ... we really have no hope for the future here in the West Bank,"
Mahmoud Abbas,for the sake of peace and the future of both peoples and the region.
Mahmoud Abbas,"We hope that we can reach a satisfactory solution for us, because it's important to have full freedom for people to come in and out, ... This subject is under serious discussion, but there is no agreement at this time ... We hope that we can reach solutions for all the crossings very soon."
Mahmoud Abbas,"We hope that we can reach a satisfactory solution for us, because it's important to have full freedom for people to come in and out,"
Mahmoud Abbas,fire all directors of the security services who failed to fulfill their duties.
Mahmoud Abbas,We are fully aware that the movement of finance is now globally subject to many inspections. I don't think the world can allow the entry of this type of money.
Mahmoud Abbas,"All of us agree elections must be allowed in Jerusalem too. If elections are not allowed there, all the factions agree the elections must be cancelled."
Mahmoud Abbas,"We all agree that Jerusalem should be included in the elections. If it is not included, all the factions agree there should be no elections."
Mahmoud Abbas,"Elections have been done in some places, and we deal with that in a positive way. For places which have not held their primaries, we will find a suitable solution."
Mahmoud Abbas,"You may have not taken into consideration the issue of elections, or some of you may have believed that I am going to delay the elections."
Mahmoud Abbas,"The elections took place in some areas and we will deal with the results of these areas in a positive way, ... As for the areas in which elections did not take place, we will find a proper solution."
Mahmoud Abbas,"This is sabotage and aimed at sabotaging the elections, not only the elections, but also the security of Palestinians. The culprits must be punished."
Mahmoud Abbas,We are so happy with this election festival.
Mahmoud Abbas,No state on earth can afford to allow several authorities to co-exist next to one another.
Mahmoud Abbas,"We could reach a point where I cannot perform my duty. Then I will not continue sitting in this place, against and in spite of my convictions."
Mahmoud Abbas,There are now grave doubts
Mahmoud Abbas,We have accepted the principle of democracy and we are committed to respect the popular verdict and the result of that national consultation.
Mahmoud Abbas,We should let them go peacefully in order not to give them any reason to delay the evacuation.
Mahmoud Abbas,"The Israelis say: 'OK, we'll impose a unilateral solution' - which means that they will postpone, delay the struggle and they will not solve the problem."
Mahmoud Abbas,We recognize that Palestinians need help in consolidating security forces and training security forces that would defeat the terrorists that would like to stop the march of freedom.
Mahmoud Abbas,Why assume that there will be crisis? Let us resort to dialogue. Everything comes through dialogue.
Mahmoud Abbas,We are in real financial crisis.
Mahmoud Abbas,We are in real financial crisis. We hope we can overcome it month by month.
Mahmoud Abbas,We cannot build a viable state with a country that is disintegrating into small pieces.
Mahmoud Abbas,"There will be no military solution to this conflict,"
Mahmoud Abbas,"If we build this confidence together, that will lead to other important steps,"
Mahmoud Abbas,"We are embarking on a new era, and we call on the international community to help us return to the negotiating table with the Israelis, to conclude a peace agreement and implement it."
Mahmoud Abbas,"We are coming into a new phase. In this phase, we are calling for the international community to help us return to the negotiating table with the Israelis, conclude the peace process and implement it."
Mahmoud Abbas,"Ending this deterioration requires the commitment of all parties to end violence and cease fire and begin serious implementation of the road map,"
Mahmoud Abbas,"That made sense, but maybe in hindsight it doesn't look so clever."
Mahmoud Abbas,so it will become a model of civilization for the rest of the world.
Mahmoud Abbas,"Do you think I am happy to work like this? I want to earn some living to feed my children,"
Mahmoud Abbas,"The situation along the border is stable and the chaos we saw in the past few days is over,"
Mahmoud Abbas,The chaos and security lapses create fertile ground for our enemies to hold back our people as they struggle for freedom and independence.
Mahmoud Abbas,"could widen the cycle of violence, chaos, extremism and bloodshed."
Mahmoud Abbas,"From today we will not allow armed chaos, the taking of the law into individual hands, or attacks on public property."
Mahmoud Abbas,"The chaos that existed is over,"
Mahmoud Abbas,We have one law for everyone and no one is above the law. We are not going to tolerate chaos after today.
Mahmoud Abbas,I will be able to control the chaos in Gaza.
Mahmoud Abbas,Tomorrow they will start leaving part of the West Bank. It's a beginning of the full withdrawal from all the settlements. We will not close our eyes. We will not rest until they leave from all our land.
Mahmoud Abbas,We have one authority and one law and everyone has the responsibility to follow that law and that authority.
Mahmoud Abbas,"The constitution gives me clear and definite authority to remove a government from power, but I don't want to use this authority. Everyone should know that by law this power is in my hands."
Mahmoud Abbas,"one authority, one legitimate gun, one law."
Mahmoud Abbas,The withdrawal of the [Israeli] army and settlers from the Gaza Strip does not signal the end of the occupation
Mahmoud Abbas,There will be a procedure to present the government to parliament for discussion and approval.
Mahmoud Abbas,"According to the agreement, the truce is continuing and it's not linked to a time ... and everyone knows that,"
Mahmoud Abbas,"This subject is under serious discussion, but there is no agreement at this time ... We hope that we can reach solutions for all the crossings very soon."
Mahmoud Abbas,"We are all in agreement that Jerusalem has to be included in the election. And if it is not included, all the factions agree that there will be no elections."
Mahmoud Abbas,"only with an international agreement because we want to do the right thing at the right time, to behave as a state in a responsible way."
Mahmoud Abbas,"It was a good meeting, ... We discussed the (Gaza) agreement reached yesterday. We discussed the continuation of such meetings."
Mahmoud Abbas,"I am always optimistic, because at the end we will ultimately reach agreement. But I reaffirm we will not accept a partial agreement,"
Mahmoud Abbas,"I am optimistic and I expect that we will reach an overall agreement with everybody for a complete cease-fire in all the territories,"
Mahmoud Abbas,It is necessary for everyone to be committed to a calm agreement.
Mahmoud Abbas,Any aggression against our foreign guests represents a challenge to the rule of law and we will not permit it.
Mahmoud Abbas,"It's important to see action,"
Mahmoud Abbas,We condemn this action and repeat that the extremist forces are still intent to destroy any efforts toward peace.
Mahmoud Abbas,"and a dangerous obstacle to the achievement of an independent, sovereign state we seek."
Edward Abbey,"When the biggest, richest, glassiest buildings in town are the banks, you know that town's in trouble."
Edward Abbey,"There have been some, even in the Park Service, who advocate spraying Delicate Arch with a fixative of some sort - Elmer's glue perhaps or Lady Clairol Spray Net."
Edward Abbey,"High technology has done us one great service: It has retaught us the delight of performing simple and primordial tasks - chopping wood, building a fire, drawing water from a spring"
Edward Abbey,"A journey into the wilderness is the freest, cheapest, most nonprivileged of pleasures. Anyone with two legs and the price of a pair of army surplus combat boots may enter."
Edward Abbey,"God still sits on the throne, the devil is a liar. You may be goingthrough a tough time right now but God is getting ready to bless youin a way that only He can. Keep the faith. My instructions were topick four people that I wanted God to bless, and I picked you. Pleasepass this to at least four people you care about"
Edward Abbey,"In the modern techno-industrial culture, it is possible to proceed from infancy into senility without ever knowing manhood"
Edward Abbey,"When a man's best friend is his dog, that dog has a problem"
Edward Abbey,Belief in the supernatural reflects a failure of the imagination
Edward Abbey,The distrust of wit is the beginning of tyranny.
Edward Abbey,Wilderness is not a luxury but a necessity of the human spirit.
Edward Abbey,"When a man's best friend is his dog, that dog has a problem."
Edward Abbey,"Say what you like about my bloody murderous government,' I says, 'but don't insult me poor bleedin' country."
Edward Abbey,Climbing K2 or floating the Grand Canyon in an inner tube; there are some things one would rather have done than do.
Edward Abbey,Belief in the supernatural reflects a failure of the imagination.
Edward Abbey,A drink a day keeps the shrink away.
Edward Abbey,Taxation: how the sheep are shorn.
Edward Abbey,Grown men do not need leaders.
Edward Abbey,Civilization is a youth with a molotov cocktail in his hand. Culture is the Soviet tank or L.A. cop that guns him down.
Edward Abbey,"Our culture runs on coffee and gasoline, the first often tasting like the second."
Edward Abbey,"The idea of wilderness needs no defense, it only needs defenders."
Edward Abbey,You can't study the darkness by flooding it with light.
Edward Abbey,If the end does not justify the means - what can?
Edward Abbey,Love implies anger. The man who is angered by nothing cares about nothing.
Edward Abbey,"Anarchism is founded on the observation that since few men are wise enough to rule themselves, even fewer are wise enough to rule others."
Edward Abbey,"May your trails be crooked, winding, lonesome, dangerous, leading to the most amazing view. May your mountains rise into and above the clouds."
Edward Abbey,"There is science, logic, reason; there is thought verified by experience. And then there is California."
Edward Abbey,Growth for the sake of growth is the ideology of the cancer cell.
Edward Abbey,A patriot must always be ready to defend his country against his government.
Edward Abbey,The missionaries go forth to Christianize the savages - as if the savages weren't dangerous enough already.
Edward Abbey,What is the purpose of the giant sequoia tree? The purpose of the giant sequoia tree is to provide shade for the tiny titmouse.
Edward Abbey,Society is like a stew. If you don't stir it up every once in a while then a layer of scum floats to the top.
Edward Abbey,"That which today calls itself science gives us more and more information, and indigestible glut of information, and less and less understanding."
Edward Abbey,"One man alone can be pretty dumb sometimes, but for real bona fide stupidity, there ain't nothin' can beat teamwork."
Edward Abbey,Power is always dangerous. Power attracts the worst and corrupts the best.
Edward Abbey,"For myself I hold no preferences among flowers, so long as they are wild, free, spontaneous. Bricks to all greenhouses! Black thumb and cutworm to the potted plant!"
George Abbott,"We're particularly concerned with the lack of disclosure in the '50s, '60s and '70s around the potential damages of this product."
George Abbott,"[B.C. Health Minister George Abbott praised the initiative.] The province commends the Lois Fish Palliative Society for creating a source of comprehensive information on palliative resources in B.C., ... By January 2006, we are hopeful this resource will link directly with B.C. NurseLine and further enhance the ability of the nurses to provide greater assistance to British Columbians with end-of-life care, service providers and organizations in their communities."
George Abbott,"We have not found any evidence or data either within the Ministry of Health or within the Fraser Health Authority that would appear to substantiate that particular suggestion, so we're following up now with the authors of the report to find out exactly what they meant."
Greg Abbott,We keep discovering additional methods Sony used to deceive Texas consumers who thought they were simply buying music. Thousands of Texans are now potential victims of this deceptive game Sony played with consumers for its own purposes.
Greg Abbott,"I am pleased this judge concluded that Merck made a wrong move by trying to run from justice in a Texas state court,"
Greg Abbott,"I thank the McAllen Police Department for assisting us in bringing this man to justice,"
Greg Abbott,"Sony has engaged in a technological version of cloak and dagger deceit against consumers by hiding secret files on their computers,"
Greg Abbott,Sony has engaged in a technological version of cloak-and-dagger deceit against consumers by hiding secret files on their computers.
Jack Abbott,"When they talk of ghosts of the dead who wander in the night with things still undone in life, they approximate my subjective experience of this life."
Jack Abbott,"I have been desperate to escape for so many years now, it is routine for me to try to escape."
Jack Abbott,Nothing is over and done with. Nothing. Not even your malice.
Jack Abbott,"My eyes, my brain seek out escape routes wherever I am sent."
Jack Abbott,"When I'm forced by circumstances to be in a crowd of prisoners, it's all I can do to refrain from attack."
Jack Abbott,"Imagine a thousand more such daily intrusions in your life, every hour and minute of every day, and you can grasp the source of this paranoia, this anger that could consume me at any moment if I lost control."
Jack Abbott,I escaped one time. In 1971 I was in the free world for six weeks.
Jack Abbott,"The other inmates stand in a long straight line, flanked by guards, and I am dragged past them. I do not respect them, because they will not run - will not try to escape."
Jack Abbott,I find it painful and angering to look in a mirror.
Jack Abbott,"The part of me which wanders through my mind and never sees or feels actual objects, but which lives in and moves through my passions and my emotions, experiences this world as a horrible nightmare."
Jack Abbott,"As long as I am nothing but a ghost of the civil dead, I can do nothing."
