author,quote
Shani Davis,"It showed that all the hard work and all the sacrifice paid off. Kids in general, if you put your mind to it and you believe it, you can achieve it."
Shani Davis,"I'll be honest with you. Sure, Chad and I are fighting for the same thing. But it would have been kind of nice after I won the 1,000 if he would have been a good teammate and shook my hand."
Shani Davis,"I'm trying not to get too emotional because I have more events. I'll be emotional in the closing ceremony, but I've got a job to do. I've got to stay focused."
Shani Davis,The Dutch fans are really passionate about speed skating. They bring a lot of energy and atmosphere to our sport.
Shani Davis,"No one loves you more than your mother. It's like on the Discovery Channel where you see a bald eagle do everything it can to protect its young. People can say whatever they want, but it's a sticks-and-stones thing."
Shani Davis,I really don't consider this a defeat because I am skating better and better every race.
Steve Davis,"Honestly, we don't really talk about (playing Ike). We just come out to play as a team and try to limit those easy baskets they like to get."
Steve Davis,"Those guys (the offensive line) have worked in the weight room since February. Because we didn't start school until Thursday, they were able to stay late on Monday and Tuesday and watch tape."
Steve Davis,We've got two of the best wide receivers I've ever coached. I haven't had two wide receivers with their quality since Sterling Hicks.
Steve Davis,"Hopefully, guys take more pride in those units."
Steve Davis,"All those backpacks are still in the school, all throughout the school, and there are briefcases and boxes, ... (Police) are using X-ray machines and everything else they can to X-ray literally thousands of backpacks, boxes, briefcases, anything that could house an explosive device."
Steve Davis,"With the exception of the legendary pink Cadillac Elvis gave his mother, this is as good as it gets."
Steve Davis,"The census is costing us right at $1 million, and all of that money we will recover, I believe, three for one in four years."
Steve Davis,"It is clear that integration to 'back-office' systems such as accounting or service management applications is an important aspect of providing end-to- end mobilization for field service organizations, ... With an easy to implement integration path via SOAP for EService, we are able to provide the considerable benefits of EService while also allowing our customers to use their 'tried and proven' business management applications."
Steve Davis,"It is clear that integration to 'back-office' systems such as accounting or service management applications is an important aspect of providing end-to- end mobilization for field service organizations. With an easy to implement integration path via SOAP for EService, we are able to provide the considerable benefits of EService while also allowing our customers to use their 'tried and proven' business management applications."
Steve Davis,"At first, the six of us thought we could keep our jobs and keep this going part-time,"
Steve Davis,"People are coming here now to have a good time. It's a destination location. It's the cuisine, it's the entertainment, it's the people-watching, it's the sharing of celebrity, and living vicariously through some of those folk."
Steve Davis,"You don't exactly know what she's going to say, but you know it's going to be entertaining."
Steve Davis,"I have very mixed emotions regarding Chris's performance this weekend. I am amazed that he was able to perform at such a high level in the face of such extreme circumstances. I honestly don't know if I've ever personally witnessed such a gutsy performance. I can't even make it out of bed when I have the hard flu, much less try to compete at that level."
Steve Davis,"This year, we came of age. This has evolved into what the vision was, which was to create a true lifestyle event with the auction as the nucleus."
Steve Davis,"They had a 2-1 advantage, and they took her off the ballot, ... What they have done is entered the twilight of election law."
Susan Davis,Our synergy offers the Navy more comprehensive support and training capabilities.
Susan Davis,Now I Lay Me Down To Sleep: An Album of Classical Lullabies
Susan Davis,"They have a lot of fun together, the dogs do."
Terrell Davis,"The one thing that scares me the most is failing. It scares me that one day I won't be at this level. But while I'm here and while I'm having success early, I'm trying to do everything to stay on this level."
Terrell Davis,"You can be the best person in the league but if you don't win championships, something's missing."
Terrell Davis,There is no such thing as sportsmanship.
Thomas Davis,I'm fighting tougher fighters now. But now no one wants to fight me.
Thomas Davis,That's how a real neighbor is. They could just sense what you need.
Thomas Davis,"A people without a language of its own, is only half a nation."
Thomas Davis,"What we'll do is, send out form letters, last week of May. If you're not home, we'll leave you a card, saying 'give us a call.' Also at the end of the job, we'll make one more sweep through the neighborhoods."
Thomas Davis,"The purpose of our Importance of Education Campaign is to convince youth and their parents of the benefits of doing well in school, graduating from high school, enrolling in college and graduating from college."
Thomas Davis,They're trying to make fuel cells a reality. They want to bring the hydrogen economy to the United States.
Tom Davis,We were having trouble getting out on the shooters. They just drilled us.
Tom Davis,"Hopefully we can bring in an IBM, or another big company's western regional conference, or some major trade associations,"
Tom Davis,"You can look at objective measurements such as RPI ratings and schedule strength and stuff like that and see that we're closer. I can look at tape and see where we're improved, and where we're closer. But it's still hard to lose."
Tom Davis,"I think (Stewart) understands that. The question is, can he apply it? Some give it lip service, but they won't get the job done. So it will be a great test for him. If he gets it done, that would be big."
Tom Davis,"I noticed that the (drunk) individuals had moved on, ... He (the AT&T security guard) pointed to a package under a bench in front of the tower and told me that one of them must have left it there."
Tom Davis,"This is progress, but it's not enough,"
Tom Davis,"Maybe we've had more problems with them than other teams have, but that's a reflection more on us. We just haven't been as good as they have been as a team."
Tom Davis,"This will encourage businesses to come in and fix these problems, and right now there's some hesitancy to do that,"
Tom Davis,"What made it hurt is that we told them what the play was going to be. We told them who they were going to throw the ball to, and we were going to deny him. Obviously we didn't execute, which was kind of the story of the game. They just seemed a step ahead of us."
Tom Davis,"It's very hard, because you never know what you're going to get."
Tom Davis,One of our goals was not to let them have a single rebound.
Tom Davis,It's a funny game. You just don't know what the home court is worth.
Tom Davis,You can often find the best information about family needs through their communities of faith. The connections we're making assure engagement of the entire community in the recovery process.
Tom Davis,"There was a profound failure to be proactive, a deep inability to execute,"
Tom Davis,"Our inside guys have really developed nicely, and Jonathan Cox is a good example of that. And our guards do a pretty good job of rebounding. We've had pretty good balance."
Tom Davis,"Nick Grant is a good example. He's getting it figured out about when to drive, and when to pull it out and use his abilities."
Tom Davis,"Great crowd, great environment. It does impact the game. It can be disruptive to visitors."
Tom Davis,"Every time we'd muster a little energy to get back in the game, they were able to hold us off."
Tom Davis,"There's always some national context to state elections here. It probably all does matter, and up here that's probably not a plus."
Tom Davis,"This is a debate the American people need to have, but I think we have more important priorities right now -- getting tax cuts, getting this economy moving, getting an education reform package, patients' bill of rights -- these are, I think, higher priorities for the American people,"
Tom Davis,It's been very easy. You must have a respect for each other and communication is important. Any problems you have at work stay at work because you solve the problem before you get home.
Tom Davis,This is not the movies. There is no Tommy Lee Jones character who comes in and takes charge of everything.
Tom Davis,"I always take a day-to-day approach. With my age, you just don't know. There could be health issues. And some of it is mental. If you don't have fun doing what you're doing, if you lose the part that's enjoyable about it, then you're not going to do a good job anyway."
Tom Davis,"The innovations of the information age - laptop computers, broadband Internet service, blackberries and so forth  continue to make location less relevant in the working world. Telework, by capitalizing on those technological advances, not only offers a broad range of benefits to employers and employees, but also helps reduce traffic congestion, air pollution, and fuel consumption. Because of these important benefits, we need to encourage telework wherever possible by removing disincentives, and I applaud the Telework Coalition's help in that effort."
Tom Davis,the type of self-initiated action we were hoping for all along.
Tom Davis,We don't see any other legal action we can take.
Tom Davis,"The first thing I was impressed with was how well the guys honored Drake with their acceptance speeches. I thought it was one of the finest displays of feeling, emotion, appreciation and brevity that I had seen. The other part was how strong their feelings were for Drake. They spoke of their gratitude for the education they got here and how they were treated, things having nothing to do with basketball."
Tom Davis,"We have quickness, we have athletic ability, good hands and good heads. We just don't have good games."
Brian Dawkins,We can't worry about the playoffs. We have to worry about the Giants.
Brian Dawkins,"They came out and everything they did clicked. Everything we did didn't work. We know in no way that's who we are. The bye came at a time where guys can use it. After a loss like that, it's good to get away."
Brian Dawkins,"To risk what he is potentially risking to want to stay out on the field, that's just the toughness that he has. That really speaks to what he thinks of this team and what he is as a player."
Brian Dawkins,That game is over with. We have to get on with the rest of the season.
Brian Dawkins,"It was just good to get back out there to practice your craft, to get that nasty taste out of your mouth. To get going towards another week of positive thinking."
Brian Dawkins,"But I mean, I felt their pain. How close we were, for that many years, to get to that point, and then lose it? We talked our way to where we wanted to be and we played our way to where we wanted to be. From the year before, we knew where we needed to be to get that next level. Then we got there and we couldn't capitalize."
Brian Dawkins,"You saw what happened this year. It can happen. It starts to filter through. Different opinions are given out, and things happen that shouldn't happen."
Brian Dawkins,"But that shouldn't matter to us. If they get the ball on the 30-yard line, our mind-set is we should still hold them to a field goal."
Brian Dawkins,"That's what I love so much about this team. We have some warriors here. We have some guys who go out there and fight. That's the best thing about this team. No matter what happens, we just keep fighting. You have to love that."
Brian Dawkins,"I can only hope that loss drives a lot of guys, ... I can honestly say that in my training sessions, my mind was focused on the fact that those last couple of steps off the field was somebody else celebrating once again in a big game. Personally, I don't want that to happen again, and I am going to do everything in my power not to have that happen again."
Brian Dawkins,"I hate to go because somebody has gone down with an injury, but being the first alternate, that happens. This is something that I work for each and every year and I never take it for granted. It's an honor."
Brian Dawkins,"It still stings a little bit regardless of the circumstances of him not being here. You still would like to have that guy on your side because you can count on him. From all reports, everybody in the organization and on both sides of the situation felt that this was the best thing to do. So they did it and you have to live and keep on playing."
Brian Dawkins,"My age is getting up there, but that doesn't mean my play has to diminish,"
Richard Dawkins,Dawkins Law of the Conservation of Difficulty states that obscurantism in an academic subject expands to fill the vacuum of its intrinsic simplicity
Richard Dawkins,"[But Richard Dawkins, an evolutionary theorist at Oxford, said that even scientists who were believers did not claim evidence for that belief.] The most they will claim is that there is no evidence against, ... which is pathetically weak. There is no evidence against all sorts of things, but we don't waste our time believing in them."
Richard Dawkins,"Complex, statistically improbable things are by their nature more difficult to explain than simple, statistically probable things"
Richard Dawkins,The essence of life is statistical improbability on a colossal scale
Richard Dawkins,The meme for blind faith secures its own perpetuation by the simple unconscious expedient of discouraging rational inquiry
Richard Dawkins,"[Evolution is] a theory in a special philosophical sense of science, but in terms of ordinary laymen's use of language, it's a fact, ... Evolution is a fact in the same sense that it's a fact that the Earth is round and not flat, [that] the Earth goes round the Sun. Both those are also theories, but they're theories that have never been disproved and never will be disproved."
Richard Dawkins,The theory of evolution by cumulative natural selection is the only theory we know of that is in principle capable of explaining the existence of organized complexity
Richard Dawkins,"God exists, if only in the form of a meme with high survival value, or infective power, in the environment provided by human culture"
Richard Dawkins,The essence of life is statistical improbability on a colossal scale.
Richard Dawkins,"Let us try to teach generosity and altruism, because we are born selfish."
Richard Dawkins,"But perhaps the rest of us could have separate classes in science appreciation, the wonder of science, scientific ways of thinking, and the history of scientific ideas, rather than laboratory experience."
Richard Dawkins,"We humans are an extremely important manifestation of the replication bomb, because it is through us - through our brains, our symbolic culture and our technology - that the explosion may proceed to the next stage and reverberate through deep space."
Richard Dawkins,We are all atheists about most of the gods that societies have ever believed in. Some of us just go one god further.
Richard Dawkins,Today the theory of evolution is about as much open to doubt as the theory that the earth goes round the sun.
Richard Dawkins,The theory of evolution by cumulative natural selection is the only theory we know of that is in principle capable of explaining the existence of organized complexity.
Richard Dawkins,The meme for blind faith secures its own perpetuation by the simple unconscious expedient of discouraging rational inquiry.
Richard Dawkins,"Complex, statistically improbable things are by their nature more difficult to explain than simple, statistically probable things."
Richard Dawkins,"The fact that life evolved out of nearly nothing, some 10 billion years after the universe evolved out of literally nothing, is a fact so staggering that I would be mad to attempt words to do it justice."
Richard Dawkins,"It has become almost a cliche to remark that nobody boasts of ignorance of literature, but it is socially acceptable to boast ignorance of science and proudly claim incompetence in mathematics."
Richard Dawkins,"God exists, if only in the form of a meme with high survival value, or infective power, in the environment provided by human culture."
Richard Dawkins,"For the first half of geological time our ancestors were bacteria. Most creatures still are bacteria, and each one of our trillions of cells is a colony of bacteria."
Richard Dawkins,"By all means let's be open-minded, but not so open-minded that our brains drop out."
Richard Dawkins,What has 'theology' ever said that is of the smallest use to anybody? When has 'theology' ever said anything that is demonstrably true and is not obvious? What makes you think that 'theology' is a subject at all?
Richard Dawkins,"Isn't it sad to go to your grave without ever wondering why you were born? Who, with such a thought, would not spring from bed, eager to resume discovering the world and rejoicing to be part of it?"
Richard Dawkins,"There may be fairies at the bottom of the garden. There is no evidence for it, but you can't prove that there aren't any, so shouldn't we be agnostic with respect to fairies?"
Richard Dawkins,"Faith is the great cop-out, the great excuse to evade the need to think and evaluate evidence. Faith is belief in spite of, even perhaps because of, the lack of evidence."
Richard Dawkins,I'm not sure this conversation can go any further.
Richard Dawkins,"After sleeping through a hundred million centuries we have finally opened our eyes on a sumptuous planet, sparkling with color, bountiful with life. Within decades we must close our eyes again. Isnt it a noble, an enlightened way of spending our brief time in the sun, to work at understanding the universe and how we have come to wake up in it? This is how I answer when I am askedas I am surprisingly oftenwhy I bother to get up in the mornings."
Richard Dawkins,"Personally, I rather look forward to a computer program winning the world chess championship. Humanity needs a lesson in humility."
Len Dawson,"We were tied 6-6 in the fourth quarter on our own 20 and needed a spark. I've got to hand it to him, he called the play and made it work."
Len Dawson,"This fight was one that was less painful, and a whole lot more severe. One thing I realized is that you just can't do it by yourself."
Len Dawson,One of the reasons I loved playing quarterback was that I got to call the plays. The cancer put me in a position where I really wasn't in control anymore.
Len Dawson,My PSA was normal but the DRE indicated there may be a problem.
Len Dawson,"If you're unable to catch it in time, the cancer can spread to the lymph nodes and at that point, the cancer is essentially incurable, but that doesn't mean your condition can't be improved."
Len Dawson,I was just fortunate that it was detected in the early stages. Unfortunately my brother Ron wasn't so lucky. He lost his battle with the disease.
Len Dawson,I still can't figure out how Minnesota wasn't in the Super Bowl last year. I've got to say they're the odds-on favorite to win it all this year.
Len Dawson,"I said to myself, 'I've never gotten anything for free that was worth anything. I want a second opinion.' But sure enough, they were right."
Len Dawson,"Granted, prostate exams aren't the most enjoyable things in the world, but they only last about 10 seconds. It's well worth it. Just think of the possible consequences if you don't get it done."
Len Dawson,"'Early stages' is when the cancer is completely contained within the prostate. If it is detected when the cancer is entirely in the gland, the chance for full recovery is at its highest."
Les Dawson,Marriage is an institution and that's where a couple finish up.
Les Dawson,I can always tell when the mother in law's coming to stay; the mice throw themselves on the traps.
Les Dawson,"I used to sell furniture for a living. The trouble was, it was my own."
Dorothy Day,"I have long since come to believe that people never mean half of what they say, and that it is best to disregard their talk and judge only their actions"
Dorothy Day,"We are the nation the most powerful, the most armed and we are supplying arms and money to the rest of the world where we are not ourselves fighting. We are eating while there is famine in the world."
Dorothy Day,"We and the Communists have a common idea that something else is necessary, some other vision of society must be held up to be worked for."
Dorothy Day,"They cannot see that we must lay one brick at a time, take one step at a time."
Dorothy Day,"The greatest challenge of the day is: how to bring about a revolution of the heart, a revolution which has to start with each one of us?"
Dorothy Day,"I believe that we must reach our brother, never toning down our fundamental oppositions, but meeting him when he asks to be met, with a reason for the faith that is in us, as well as with a loving sympathy for them as brothers."
Dorothy Day,"As for ourselves, yes, we must be meek, bear injustice, malice, rash judgment. We must turn the other cheek, give up our cloak, go a second mile."
Dorothy Day,"We have all known the long loneliness, and we have found that the answer is community."
Dorothy Day,Don't call me a saint. I don't want to be dismissed so easily.
Dorothy Day,"Men are beginning to realize that they are not individuals but persons in society, that man alone is weak and adrift, that he must seek strength in common action."
Dorothy Day,"The basis of the liturgical movement is prayer, the liturgical prayer of the church. It is a revolt against private, individual prayer."
Dorothy Day,We cannot build up the idea of the apostolate of the laity without the foundation of the liturgy.
Dorothy Day,"The legal battle against segregation is won, but the community battle goes on."
Dorothy Day,My radical associates were the ones who were in the forefront of the struggle for a better social order where there would not be so many poor.
Dorothy Day,"Words are as strong and powerful as bombs, as napalm."
Dorothy Day,"We believe in loving our brothers regardless of race, color or creed and we believe in showing this love by working for better conditions immediately and the ultimate owning by the workers of their means of production."
Dorothy Day,"Together with the Works of Mercy, feeding, clothing and sheltering our brothers, we must indoctrinate."
Dorothy Day,"Love casts out fear, but we have to get over the fear in order to get close enough to love them."
Dorothy Day,"Knitting is very conducive to thought. It is nice to knit a while, put down the needles, write a while, then take up the sock again."
Dorothy Day,"I have long since come to believe that people never mean half of what they say, and that it is best to disregard their talk and judge only their actions."
Dorothy Day,I firmly believe that our salvation depends on the poor.
Dorothy Day,Women think with their whole bodies and they see things as a whole more than men do.
Dorothy Day,Food for the body is not enough. There must be food for the soul.
Green Day,Billie Joe- We were terrible tennants at the time. We ended up chopping up the stairs for firewood
Green Day,Boulevard of Broken Dreams
Green Day,I beg to dream and differ from the hollow lies
Green Day,Minority is about being an individual. It's like you have to sift through the darkness to find your place and be that individual you want to be your entire life.
Green Day,Tr: I told my dad Yeah Im going to be a drummer and he said well you can if you can rub your stomach at the same time as you pat your head at the same time youre standing on one leg and kicking the other one out in a circle and say the pledge of allegiance. And I did all that just like bam you know?
Green Day,"I don't push my drums down; I go through 'em. I use my body as a battering ram. I had some sports therapists yelling at me for not taking better care of my body. I got a concussion bake in Rhode Island--no,that's where I got thrown around by this bouncer. I got the concussion in New York City. The paramedics wanted to take me to the hospital right there. But I was like, 'No, I'm cool. It's not like I'm going to settle down. I thought it was funny. The thing is, I could never afford to just trash my drums like that before, until I got my deal with Slingerland."
Green Day,"Billie Joe: What do you mean we walked around dressed like girls? They were our own clothes, they just happened to be dresses..."
Green Day,"I'm not gonna say anything inspirational, I'm just gonna f***ing swear a lot."
Pat Day,"The thrill of the victory in that race was decidedly less than what I'd anticipated, ... I think it was God's timing, it was God's way of getting my attention."
Pat Day,"I'm just really excited that Churchill Downs would choose to honor me,"
Pat Day,"I'm excited about what God's giving me to do,"
Pat Day,"When I got the nod from God to retire, ... it was a closed book. God relieved me of any anxiety."
Daniel Day-Lewis,"You can never fully put your finger on the reason why you're suddenly, inexplicably compelled to explore one life as opposed to another."
Daniel Day-Lewis,"When I've gone back to work, it's always with that sense of inevitability. That may be a complete delusion, but it's the one that I need to get out of bed and go about my business. That sense that I can't avoid this thing. I better just get on with it."
