author,quote
Charles Dickens,"Vether it's worth goin' through so much, to learn so little, as the charity-boy said ven he got to the end of the alphabet, is a matter o' taste."
Charles Dickens,I never see any difference in boys. I only know two sorts of boys. Mealy boys and beef-faced boys.
Charles Dickens,"Institutionalised in sports, the military, acculturated sexuality, the history and mythology of heroism, violence is taught to boys until they becomes its advocates"
Charles Dickens,"I've a pretty large experience of boys, and you're a bad set of fellows. Now mind . . . you behave yourself !"
Charles Dickens,"Now, what I want is, facts. Teach these boys and girls nothing but Facts. Facts alone are wanted in life. Plant nothing else, and root out everything else. You can only form the minds of reasoning animals upon Facts: nothing else will ever be of any service to them. This is the principle on which I bring up my own children, and this is the principle on which I bring up these children. Stick to Facts, sir!"
Charles Dickens,"No one who can read, ever looks at a book, even unopened on a shelf, like one who cannot."
Charles Dickens,"Tis love that makes the world go round, my baby"
Charles Dickens,Every baby born into the world is a finer one than the last
Charles Dickens,"It was a good thing to have a couple of thousand people all rigid and frozen together, in the palm of one's hand."
Charles Dickens,"You might, from your appearance, be the wife of Lucifer. Nevertheless, you shall not get the better of me. I am an Englishwoman."
Charles Dickens,Keep up appearances whatever you do.
Charles Dickens,"If its individual citizens, to a man, are to be believed, it always is depressed, and always is stagnated, and always is at an alarming crisis, and never was otherwise; though as a body, they are ready to make oath upon the Evangelists, at any hour of the day or night, that it is the most thriving and prosperous of all countries on the habitable globe."
Charles Dickens,"Father Time is not always a hard parent, and, though he tarries for none of his children, often lays his hand lightly upon those who have used him well; making them old men and women inexorably enough, but leaving their hearts and spirits young and in full vigor. With such people the gray head is but the impression of the old fellow's hand in giving them his blessing, and every wrinkle but a notch in the quiet calendar of a well-spent life."
Charles Dickens,The age of chivalry is past. Bores have succeeded to dragons.
Charles Dickens,"It was the best of times, it was the worst of times, it was the age of wisdom, it was the age of foolishness . . . it was the spring of hope, it was the winter of despair . . . in short, the period was so far like the present period . . . ."
Charles Dickens,"With affection beaming in one eye, and calculation out of the other."
Charles Dickens,"If you could see my legs when I take my boots off, you'd form some idea of what unrequited affection is."
Charles Dickens,"A silent look of affection and regard when all other eyes are turned coldly away--the consciousness that we possess the sympathy and affection of one being when all others have deserted us--is a hold, a stay, a comfort, in the deepest affliction, which no wealth could purchase, or power bestow."
Charles Dickens,"Many merry Christmases, friendships, great accumulation of cheerful recollections, affection on earth, and Heaven at last for all of us."
Charles Dickens,Accidents will occur in the best-regulated families
Charles Dickens,"Accidents will occur in the best-regulated families; and in families not regulated by that pervading influence which sanctifies while it enhances... in short, by the influence of Woman, in the lofty character of Wife, they may be expected with confidence, and must be borne with philosophy."
Charles Dickens,"There is a wisdom of the head, and a wisdom of the heart."
Charles Dickens,The first rule of business is: Do other men for they would do you.
Charles Dickens,Great men are seldom over-scrupulous in the arrangement of their attire.
Eric Dickerson,"When they have their hands on their knees, that's when they're tired."
Eric Dickerson,"She told me I wasn't playing for the coach, I was playing for myself."
Eric Dickerson,Most of the hits I take come on top of the shoulder pads.
Eric Dickerson,"I'd love to be in the Hall of Fame one day and win Super Bowl rings, or even one... and stay healthy."
Eric Dickerson,I think the Colts use my skills well.
Eric Dickerson,"I run upright mostly when I see daylight, so if you watch film you'll see I don't get hit in the chest much."
Eric Dickerson,I don't give players a chance to hit me.
Eric Dickerson,"I believe if I stay tall and run up high, I can see better."
John Dickerson,"We have by-law 461 that defines what a residence is. It defines a residence as a place where 95 percent of important family time takes place such as sleeping, where mail is received and where meals are prepared."
John Dickerson,"It still looks as though it's gonna go down to the wire, ... and the campaign finance reform plan did nothing to change that. People still think of John McCain as the campaign finance reform candidate."
John Dickerson,"The debt proves that the more than doubling of staff expenses was not affordable and still isn't, ... The supervisors need to discipline themselves to consider long-term decisions."
John Dickerson,"It's her choice. She could play in the boys sectional if she wanted to, because the school doesn't have a girls team."
Bruce Dickinson,"I can't work like this,"
Bruce Dickinson,"I'm a ham. I was immediately attracted to fencing because it seemed like a romantic, melodramatic form of combat."
Bruce Dickinson,"When I left the band, what the band did is really their own business. And their career - they got on with it, and I got on with my career."
Bruce Dickinson,"I don't like being recognised, I have no interest in being famous at all, I just do what I do. If I could be like Captain Kirk and beam myself up and then beam myself down, I would!"
Bruce Dickinson,"I do like Marylin Manson, actually. I think, he's very talented and he did make some great music."
Bruce Dickinson,Best two rock voices I've heard in a last few years both have been from grunge bands: it's Eddie Vedder and the other one is Chris Cornell from Soundgarden.
Bruce Dickinson,"The more guitars we have onstage the better, as I'm concerned."
Bruce Dickinson,I'll be arriving at the last possible minute and walking on stage raging and pillaging and then disappearing immediately afterwards.
Bruce Dickinson,Rock music should be gross: that's the fun of it. It gets up and drops its trousers.
Bruce Dickinson,I'm not going to do any more solo touring.
Bruce Dickinson,"I guess that the salary that they get when they are working with me is, like, it beats working at McDonalds, so it has got some things going for it."
Bruce Dickinson,The mystical poetry of William Blake's artwork also forms the basis for the album cover.
Bruce Dickinson,A guy called Arthur Brown... was a big influence of mine... and also Ian Anderson from Jethro Tull.
Bruce Dickinson,"I enjoy making solo albums because over the years it's evolved into more of a genuine personal expression of story-telling and day dreams, and I work in a way that has more control."
Bruce Dickinson,Major labels blow all their money massively and blame it on the band.
Bruce Dickinson,"If it all just happens like this for the rest of my life, it's going to be one endless Groundhog Day. I determined that I was not prepared to submit to this regime, so I thought I had to do something about it."
Bruce Dickinson,"Well, it's a nice quiet time for Iron Maiden, and I'll be releasing a new solo album next year, so this is a really good time for the managing out my solo career, which is quite well."
Bruce Dickinson,"I am taking a break, but not a huge break because the Maiden record is actually happening right now, and I am recording it as we speak, well not right as we speak, but close."
Bruce Dickinson,"I shall refract myself, yes, I shall no longer be known as the prism."
Bruce Dickinson,Life on the road can get a little one-dimensional. I didn't want to reach 40 and have to say all I'd done was look out the window of a tour bus and get drunk.
Bruce Dickinson,"Iron Maiden is an institution, and I'm delighted that I'm involved in it, but there was a time that I wasn't delighted so I quit."
Bruce Dickinson,"When I write with Maiden, then I write only with the guys in Maiden, we don't do songs from outside people."
Bruce Dickinson,I find that fencing and training give me more stamina and help me deal with the craziness of being on the road so much.
Bruce Dickinson,There are a lot of stuff on the record that I am thinking is generic but actually it is just as good as everybody else who is putting stuff out at the time.
Bruce Dickinson,"That gives me tremendous encouragement and optimism for the human race in general, that people choose to go off and do their own things."
Bruce Dickinson,"King in Crimson is actually an alchemical term. King Crimson is a metaphor for Devil or Satan, but at the same time it's also a metaphor for one of the statures in the purification of man and the purification of mankind soul towards union with God and with Infinite, which is the philosophical aim of alchemists."
Bruce Dickinson,"Well, yeah, sometimes I get a little too creative."
Bruce Dickinson,"A few of these interviews have gone slightly awry, because every now and again there has been the odd conflict of interest between interviews because of the Iron Maiden record, and I am a bit long-winded."
Bruce Dickinson,"When I left the band, what the band did is really their own business. And their career-they got on with it, and I got on with my career."
Bruce Dickinson,"Well, if it's the audience is a bit lagging we kick them in the nuts until they wake up!"
Emily Dickinson,A wounded deer leaps the highest.
Emily Dickinson,A word is dead when it is said. Some say. I say it just begins to live that day.
Emily Dickinson,"Truth is such a rare thing, it is a delight to tell it."
Emily Dickinson,"Time is a Test of Trouble But not a Remedy If such it prove, it prove too There was no Malady"
Emily Dickinson,"I like a look of Agony, because I know it's true -- men do not sham Convulsion, nor simulate, a Throe --"
Emily Dickinson,Success is counted sweetest by those who ne'er succeed.
Emily Dickinson,"The soul should always stand ajar, ready to welcome the ecstatic experience."
Emily Dickinson,How frugal is the chariot that bears a human soul
Emily Dickinson,"What fortitude the Soul contains, / That it can so endure / The accent of a coming Foot-- / The opening of a Door."
Emily Dickinson,"To fight aloud is very brave, but gallanter, I know, who charge within the bosom, the Cavalry of Woe."
Emily Dickinson,"His mind of man, a secret makes I meet him with a start he carries a circumference in which I have no part."
Emily Dickinson,Faith is a fine invention when Gentleman can see -- but microscopes are prudent in an emergency
Emily Dickinson,"We never know how high we are till we are called to rise; and then, if we are true to plan, our stature's touch the skies."
Emily Dickinson,I dwell in Possibility.
Emily Dickinson,"Poetry is not a turning loose of emotion, but an escape from emotion; it is not the expression of personality but an escape from personality. But, of course, only those we have personality and emotion know what it means to want to escape from these things."
Emily Dickinson,"Nature, like us is sometimes caught without her diadem."
Emily Dickinson,This is my letter to the World / That never wrote to Me-- / The simple News that Nature told-- / With tender majesty.
Emily Dickinson,"This World is not Conclusion./ A Sequel stands beyond--/ Invisible, as Music--/ But positive, as Sound."
Emily Dickinson,A] mother is one to whom you hurry when you are troubled.
Emily Dickinson,Remorse --is Memory --awake --/ Her Parties all astir --/ A Presence of Departed Acts --/ At window --and at Door --
Emily Dickinson,Much Madness is divinest Sense -- to a discerning Eye -- much Sense -- the starkest Madness --
Emily Dickinson,Much Madness is divinest Sense -  To a discerning Eye -  Much Sense - the starkest Madness
Emily Dickinson,"Luck is not chance, it is toil. Fortune is expensive smile is earned."
Emily Dickinson,That it shall never come again is what makes life so sweet
Emily Dickinson,"'Tis so much joy! 'Tis so much joy! If I should fail, what poverty! And yet, as poor as I Have ventured all upon a throw; Have gained! Yes! Hesitated so this side the victory!"
Emily Dickinson,"Hope is the thing with feathers, that perches in the soul, and sings the tune without words, and never stops at all."
Emily Dickinson,Heaven is so far of the mind that were the mind dissolved -- the site of it by architect could not again be proved.
Emily Dickinson,Heaven is what I cannot reach!
Emily Dickinson,Whydo they shut Me out of Heaven? Did I singtoo loud? ButI can say a little Minor Timid as a Bird!
Emily Dickinson,"My only sketch, profile, of Heaven is a large blue sky, and larger than the biggest I have seen in June -- and in it are my friends -- every one of them."
Emily Dickinson,"We never know where we go when we are going, We jest and shut the door; Fate - following behind us -bolts it, And we accost no more"
Emily Dickinson,I do not like the man who squanders life for fame; give me the man who living makes a name.
Emily Dickinson,Faith is a fine invention when Gentleman can see - but microscopes are prudent in an emergency
Emily Dickinson,Faith is the pierless bridge supporting what we see unto the scene that we do not.
Emily Dickinson,"I never saw a moor, I never saw the sea; Yet know I how the heather looks, And what a wave must be. I never spoke with God, Nor visited in Heaven; Yet certain am I of the spot, As if a chart were given."
Emily Dickinson,"Finite to fail, but infinite to venture."
Emily Dickinson,"I measure every grief I meet with narrow, probing eyes - I wonder if it weighs like mine - or has an easier size."
Emily Dickinson,"Our journey has advanced; / Our feet were almost come / To that odd fork in Being's road,/ Eternity by term."
Emily Dickinson,"Poetry is not a turning loose of emotion, but an escape from emotion; it is not the expression of personality but an escape from personality. But, of course, only those who have personality and emotion know what it means to want to escape from these"
Emily Dickinson,"Surgeons must be very careful. When they take the knife!, underneath their fine incisions, stirs the Culprit -- Life!"
Emily Dickinson,"Unable are the loved to die, for love is immortality."
Emily Dickinson,"Of Consciousness, her awful Mate. The Soul cannot be rid -- as easy the secreting her behind the Eyes of God."
Emily Dickinson,The abdication of belief makes the behavior small -- better an ignis fatuus than no illume at all.
Emily Dickinson,"Remember if you marry for beauty, thou bindest thyself all thy life for that which perchance, will neither last nor please thee one year: and when thou hast it, it will be to thee of no price at all."
Emily Dickinson,Nods from the Gilded pointers --/ Nods from the Seconds slim --/ Decades of Arrogance between/ The Dial life --/ And Him --
Emily Dickinson,Anger as soon as fed is dead; 'Tis starving makes it fat.
Emily Dickinson,Anger as soon as fed is dead - 'Tis starving that makes it fat
Emily Dickinson,"To hope means to be ready at every moment for that which is not yet born, and yet not become desperate if there is no birth in our lifetime."
Emily Dickinson,"He ate and drank the precious Words, his Spirit grew robust; He knew no more that he was poor, nor that his frame was Dust."
Emily Dickinson,"They say that God is everywhere, and yet we always think of Him as somewhat of a recluse."
Emily Dickinson,I argue thee that love is life. And life hath immortality.
Emily Dickinson,Celebrity is the chastisement of merit and the punishment of talent.
Emily Dickinson,"If I feel physically as if the top of my head were taken off, I know that is poetry."
Emily Dickinson,"Tell the truth, but tell it slant."
Emily Dickinson,For Love is Immortality.
Emily Dickinson,People need hard times and oppression to develop psychic muscles.
Emily Dickinson,"If I read a book and it makes my whole body so cold no fire can ever warm me, I know that is poetry."
Emily Dickinson,Drab Habitation of Whom? Tabernacle or Tomb - or Dome of Worm - or Porch of Gnome - or some Elf's Catacomb?
Emily Dickinson,Find ecstasy in life; the mere sense of living is joy enough.
Emily Dickinson,That it will never come again is what makes life sweet.
Emily Dickinson,My friends are my estate.
Emily Dickinson,"After great pain, a formal feeling comes. The Nerves sit ceremonious, like tombs."
Emily Dickinson,Truth is so rare that it is delightful to tell it.
Emily Dickinson,Dogs are better than human beings because they know but do not tell.
Emily Dickinson,"If I can stop one heart from breaking, I shall not live in vain."
Emily Dickinson,Dwell in possibility.
Emily Dickinson,The Brain is wider than the sky.
Emily Dickinson,Forever is composed of nows.
Emily Dickinson,There is no Frigate like a book to take us lands away nor any coursers like a page of prancing Poetry.
Emily Dickinson,To love is so startling it leaves little time for anything else.
Emily Dickinson,Saying nothing...sometimes says the most.
Emily Dickinson,It is better to be the hammer than the anvil.
Emily Dickinson,"To make a prairie it takes a clover and one bee, One clover, and a bee, And revery. The revery alone will do, If bees are few."
Emily Dickinson,"How strange that nature does not knock, and yet does not intrude!"
Emily Dickinson,To live is so startling it leaves little time for anything else.
Emily Dickinson,"Where thou art, that is home."
Emily Dickinson,Beauty is not caused. It is.
Emily Dickinson,"Old age comes on suddenly, and not gradually as is thought."
Denis Diderot,"Do you see this egg? With this you can topple every theological theory, every church or temple in the world."
Denis Diderot,"Sentences are like sharp nails, which force truth upon our memories."
Denis Diderot,There is no moral precept that does not have something inconvenient about it.
Denis Diderot,"The decisions of law courts should never be printed: in the long run, they form a counter authority to the law."
Denis Diderot,The general interest of the masses might take the place of the insight of genius if it were allowed freedom of action.
Denis Diderot,Skepticism is the first step on the road to philosophy
Denis Diderot,Patriotism is an ephemeral motive that scarcely ever outlasts the particular threat to society that aroused it.
Denis Diderot,To prove the Gospels by a miracle is to prove an absurdity by something contrary to nature
Denis Diderot,"In any country where talent and virtue produce no advancement, money will be the national god. Its inhabitants will either have to possess money or make others believe that they do. Wealth will be the highest virtue, poverty the greatest vice. Those who have money will display it in every imaginable way. If their ostentation does not exceed their fortune, all will be well. But if their ostentation does exceed their fortune they will ruin themselves. In such a country, the greatest fortunes will vanish in the twinkling of an eye. Those who don't have money will ruin themselves with vain efforts to conceal their poverty. That is one kind of affluence: the outward sign of wealth for a small number, the mask of poverty for the majority, and a source of corruption for all."
Denis Diderot,"There are three principal means of acquiring knowledge available to us: observation of nature, reflection, and experimentation. Observation collects facts; reflection combines them; experimentation verifies the result of that combination. Our observation of nature must be diligent, our reflection profound, and our experiments exact. We rarely see these three means combined; and for this reason, creative geniuses are not common."
Denis Diderot,"Justice is the first virtue of those who command, and stops the complaints of those who obey"
Denis Diderot,"Our observation of nature must be diligent, our reflection profound, and our experiments exact.  We rarely see these three means combined; and for this reason, creative geniuses are not common."
Denis Diderot,"No man has received from nature the right to give orders to others. Freedom is a gift from heaven, and every individual of the same species has the right to enjoy it as soon as he is in enjoyment of his reason."
Denis Diderot,Pithy sentences are like sharp nails which force truth upon our memory
Denis Diderot,Evil always turns up in this world through some genius or other.
Denis Diderot,"Every man has his dignity. I'm willing to forget mine, but at my own discretion and not when someone else tells me to."
Denis Diderot,Only a very bad theologian would confuse the certainty that follows revelation with the truths that are revealed. They are entirely different things.
Denis Diderot,"The following general definition of an animal: a system of different organic molecules that have combined with one another, under the impulsion of a sensation similar to an obtuse and muffled sense of touch given to them by the creator of matter as a whole, until each one of them has found the most suitable position for its shape and comfort."
Denis Diderot,"Genius is present in every age, but the men carrying it within them remain benumbed unless extraordinary events occur to heat up and melt the mass so that it flows forth."
Denis Diderot,Distance is a great promoter of admiration!
Denis Diderot,You have to make it happen.
Denis Diderot,"Power acquired by violence is only a usurpation, and lasts only as long as the force of him who commands prevails over that of those who obey."
Denis Diderot,"There is only one passion, the passion for happiness."
Joan Didion,A young woman with long hair and a short white halter dress walks through the casino at the Riviera in Las Vegas at one in the morning. It was precisely this moment that made Play It As It Lays begin to tell itself to me.
Joan Didion,"The secret point of money and power in America is neither the things that money can buy nor power for power's sake... but absolute personal freedom, mobility, privacy. It is the instinct which drove America to the Pacific, all through the nineteenth century, the desire to be able to find a restaurant open in case you want a sandwich, to be a free agent, live by one's own rules."
Joan Didion,"We are well advised to keep on nodding terms with the people we used to be, whether we find them attractive company or not. Otherwise they turn up unannounced and surprise us, come hammering on the mind's door at 4am of a bad night and demand to know who deserted them, who betrayed them, who is going to make amends. We forget all too soon the things we thought we could never forget."
Joan Didion,"When we start deceiving ourselves into thinking not that we want something or need something, not that it is a pragmatic necessity for us to have it, but that it is a moral imperative that we have it, then is when we join the fashionable madmen, and then is when the thin whine of hysteria is heard in the land, and then is when we are in bad trouble."
Joan Didion,I think nobody owns the land until their dead are in it
Joan Didion,"A pool is, for many of us in the West, a symbol not of affluence but of order, of control over the uncontrollable. A pool is water, made available and useful, and is, as such, infinitely soothing to the western eye."
Joan Didion,"Ask anyone committed to Marxist analysis how many angels on the head of a pin, and you will be asked in return to never mind the angels, tell me who controls the production of pins."
Joan Didion,"I write entirely to find out what I'm thinking, what I'm looking at, what I see and what it means. What I want and what I fear."
Joan Didion,"To free us from the expectations of others, to give us back to ourselves - there lies the great, singular power of self-respect."
Joan Didion,We forget all too soon the things we thought we could never forget.
Joan Didion,Self-respect is a question of recognizing that anything worth having has a price.
Joan Didion,Writers are always selling somebody out.
Joan Didion,The writer is always tricking the reader into listening to their dream.
Joan Didion,Call me the author.
Joan Didion,Grammar is a piano I play by ear. All I know about grammar is its power.
Joan Didion,"Americans are uneasy with their possessions, guilty about power, all of which is difficult for Europeans to perceive because they are themselves so truly materialistic, so versed in the uses of power."
Joan Didion,"Was there ever in anyone's life span a point free in time, devoid of memory, a night when choice was any more than the sum of all the choices gone before?"
Joan Didion,"The fancy that extraterrestrial life is by definition of a higher order than our own is one that soothes all children, and many writers."
Joan Didion,"Of course great hotels have always been social ideas, flawless mirrors to the particular societies they service."
Joan Didion,You have to pick the places you don't walk away from.
Joan Didion,"A place belongs forever to whoever claims it hardest, remembers it most obsessively, wrenches it from itself, shapes it, renders it, loves it so radically that he remakes it in his own image."
Joan Didion,The willingness to accept responsibility for one's own life is the source from which self-respect springs.
