author,quote
Billy Donovan,"Our kids just kept battling and playing hard. I mean, to win a championship game and not even get to 50 points is truly remarkable."
Billy Donovan,I'm happy for the kids. All season they have given me everything they had.
Billy Donovan,"This team is just different. Different kids, different time, different everything."
Billy Donovan,"I'm just a big believer that when guys are injured or hurt, if they elect to play, there's a certain expectation they have to uphold. And if they can't uphold that expectation, I'm totally fine if they sit out."
Billy Donovan,"They outplayed us, outperformed us and hurt us in the backcourt. You have to give them credit. They are a quick, explosive team. They rebound well. We are going to have to play a whole lot better than we did in Columbia to have a chance to win."
Billy Donovan,"They outplayed us, outperformed us and hurt us in the backcourt. You have to give them credit. They are a quick, athletic, explosive team. They rebound well. We are going to have to play a whole lot better than we did in Columbia to have a chance to win."
Billy Donovan,"If it were something where he was riding a motorcycle and he was popping some wheelies and he got hurt, than maybe I would be a bit more concerned. It was just a freak accident."
Billy Donovan,"You guys get more interested in all the details. All I know is that the guy's got a hurt shoulder. How it happened doesn't really make a difference. Maybe it was defective spokes or maybe he needs training wheels, I don't know. I just know he slipped off his bike."
Billy Donovan,I can't live their lives for them. They could just as easily get hurt doing something on the court.
Billy Donovan,"I don't care how old you are, there's a level of humility that comes with that."
Billy Donovan,I hope it doesn't flare back up with him.
Billy Donovan,"It's teams like George Mason that give so many people hope in their lives, just seeing what great things can be accomplished."
Billy Donovan,"I really thought that maybe they were not as fresh coming down the stretch. That was kind of our hope in the second half, that maybe we could try to wear them down because they were really sticking with their seven guys."
Billy Donovan,It's one of those things I can hope will get better and he can get back to playing because it's very obvious watching him play that he's not as reckless and daring and playing like he's capable of. I don't know if there's a level of uncertainty if he plants or runs or jumps or if the pain is so severe he just can't do what he's supposed to do.
Billy Donovan,"Tennessee has been hardened by all those losses in the past, and now Bruce has brought in hope."
Billy Donovan,"Ever since the Alabama game, for [Humphrey] and maybe the tirade I had on him in a timeout, I hope it's carried over. He just needs to let it go, it's really that simple for our team."
Billy Donovan,"I'm not even concerned about that right now. I'm more worried about playing LSU (Saturday at home). Even before this game, Tennessee was in control of its own destiny."
Billy Donovan,"There might be some truth to (more pressure playing close to home). Kids say, 'There's so many people there I want to do so well,' so that can happen. If you're out in San Diego you're just kind of playing. (But) I don't think these guys will feel that way -- I hope they don't."
Billy Donovan,"There's been a lot of hard work and sweat that's gone into it. It's a huge milestone. It's a huge thing for our state, for our fans."
Billy Donovan,They started to understand that playing hard isn't enough. I think that stretch helped them understand that there was another piece to winning.
Billy Donovan,"I don't know if we've played against teams as talented as teams we're playing against now. Playing hard, playing unselfish, doing all the right things, team-wise, is great. ... But it's not good enough to beat good teams."
Billy Donovan,I was shocked and happy that we were tied.
Billy Donovan,"John has done a great job over the course of the season with him, when you look at his growth and development as a player. He's a problem, because he can rebound, and he's a very good, [an] underrated passer. He can score. He does a lot of different things for his team."
Billy Donovan,"The biggest thing for David is to make good decisions and play very hard. There are some games, athletically, where what David can do is stretch the defense and really shoot it. So, we have to make sure in this game (Ole Miss) that we have him in the right match-up situation because they have so much quickness."
Billy Donovan,"Based on what do we deserve to win those games? Based on what? Three, four sophomores and a freshman? That doesn't give us a right."
Billy Donovan,"We still have to play the games. At this point in the year, you talk about those things. I don't know what real advantage it gives you except you've got to win three games instead of four."
Billy Donovan,"I told them before the game, this game was going to come down to everything we talk about being. Team work, unselfishness, sharing the ball, and being able to defend and rebound."
Billy Donovan,"He needed to have a game like this. I was happy for him. The last week or so, I think he's been doing some soul searching, just trying to find a way to come up with some answers to help our team. He helped out big-time tonight."
Billy Donovan,"To start this tournament over again, I may not be sitting up here. It is a one-shot game, one-shot deal. Sometimes the best teams don't always advance on in the NCAA Tournament. This team, starting the season, I felt had all the team makeup (to go far). They were unselfish and they wanted to win."
Billy Donovan,This could have been a game where he could have gone 8 for 11. He just didn't have one of those nights.
Billy Donovan,"The last 32 minutes of the game, we were totally outplayed, outperformed, out-everything. I don't think the score is indicative of how they outplayed us in this game."
Billy Donovan,"I felt like this year's team would be great to coach, a fun team to coach. They would be a team that would play unselfishly, play together. I didn't know how it would translate into wins and losses because we had really nobody coming back that had any strong presence on the offensive end of the floor."
Billy Donovan,I didn't know if we had enough experience.
Billy Donovan,We want to create a level of expectation that [future teams] want to uphold. It has to start somewhere.
Billy Donovan,"On TV, it looks great ... but it's really a scary environment on the floor. The other thing it does is it takes away from what a great win Florida State had. They shouldn't (have to) be addressing their lack of security or whatever. ... They should be talking about how great their kids played and what a great win it was for their program."
Billy Donovan,"That's generally a recipe for disaster, but because we defended the 3-point line that gave us an opportunity."
Billy Donovan,"Tonight, we won because of our defense and they didn't shoot the ball particularly well. I would say it was a combination, that we did at times challenge their shots, and there were maybe also some shots they just didn't knock down."
Billy Donovan,"I still don't necessarily believe we (are) the best team in the country. When you're playing in an event that's a one-and-done deal, anything can happen. I've been on the side of it where it ends in a heart-breaking manner. And now I've been on the side where it's obviously just an incredible feeling."
Billy Donovan,"I respect and appreciate him for coming across the country and playing at Florida. I think Ryan being away from his family and not playing as much was tough on him, and he saw that (since graduated guard) Anthony Roberson was coming back."
Billy Donovan,"Our bench has done good. I really believe if I could have control of when they shoot the ball, our bench making shots and giving our bench production, we would do it. But I'm not concerned about that. I'm more concerned about the type of shots we're getting."
Billy Donovan,"We have been right there. There have been some things that have been out of our control a little. I think our guys have put themselves in positions to win, and you are not going to have them all go your way. . . . What our team has done to this point in time and the way they have battled, I think it's pretty impressive."
Billy Donovan,I don't think our guys are upset or bothered by it. That's something that's beyond their control. People can talk about the George Mason story and rightfully so. It's a great story that I think will inspire many people outside of college basketball.
Billy Donovan,Sometimes there's things that are out of your control in these games.
Billy Donovan,"I have confidence putting Walter and David in the game. I'm not going to not play those guys. They deserve an opportunity to play. They may not always play well, but they're going to play hard."
Billy Donovan,"Our bench coming in has to have a little more confidence when they're out there, that there's not going to be a drop off."
Billy Donovan,"When he's letting it go and shooting with confidence like that, it makes us a different team. Some days, it might not be his night, but we need for him to continue to be aggressive."
Billy Donovan,"For a while there, everybody talked about if you really want to win at the college level, you have to have two or three pros on your team. I'm not so sure that's the case any more."
Billy Donovan,"I'm fortunate to coach an unbelievable group of guys who have been totally selfless. They've been all about the team, and all about winning. ... I'm happy that I can be a part of the first-ever national championship."
Billy Donovan,"This has probably been the greatest collection of guys I have had in one class in terms of understanding what unselfishness, what team is all about. They get that piece of it."
Billy Donovan,"He's really made a poor choice, hasn't he?"
Billy Donovan,"He really made a poor choice, didn't he?"
Billy Donovan,"That takes a kid with unbelievable character. It takes a kid who cares about the team, a kid who wants to win."
Billy Donovan,"Someone told me his comments after the game was he put blame on himself. That's wrong. If anything I hold myself more accountable than I would hold him. The only thing I told him in that situation is not get ahead of himself and say, I probably should have called time out. That's probably what we needed to do. But hopefully next time he'll be able to learn."
Billy Donovan,"That's a really, really interesting question because I've always been a big, big believer that things that have happened in the past, negatively or positively, don't affect your future. I believe I have to work harder now as a head coach, and what I mean by that is we've got to try to continue to recruit good, quality kids."
Billy Donovan,I haven't gone to bed yet.
Billy Donovan,"For our basketball team, it was a tale of two halves. In the first half, our guys were very, very impatient on offense. We didn't have the ball movement and the player movement we needed to have. We had good ball movement and player movement and we shot 57 percent in the second half. If we would have played similar to that and rebounded like we did in the first half, it would have been a different game. We couldn't put it all together."
Billy Donovan,As a basketball team you have to go through it. They need it. The game came down to our inexperience on the basketball court to their experience.
Billy Donovan,I would say that our basketball team is totally different. Every guy on our team is playing a completely different role than they did a year ago.
Billy Donovan,They play college basketball way they should play it. We're looking at this game as playing one of the best teams in the United States of America because that is what they are.
Billy Donovan,"Whether it said across their jersey Cinderella, George Mason or another team, for us our basketball team, it's just a matter of going out there playing. Our kids were feeling the same thing that George Mason kids were feeling. The feeling was not any different between teams."
Billy Donovan,The complexion of college basketball has changed so much.
Billy Donovan,"I've often said the greatest equalizer in college basketball is the 3-point line. They outscored us by 12 from the 3-point line. Our inability to limit them to one shot and inability to guard the 3-point line cost us. Anytime a team can come into your building and shoot 53 percent from the field and 47 percent from the 3-point line, you have to have a very, very good night on offense."
Billy Donovan,Those are great for our basketball team. You hate to lose them. But our team has to go through this before they can reach their potential.
Billy Donovan,The greatest equalizer in college basketball -- it doesn't make a difference about talent or who's better than who -- is the three-point line.
Billy Donovan,"I don't think basketball has ever been an afterthought, at least since I've been here. In the Southeast, in terms of enthusiasm and excitement, it's for football. In Kentucky and Indiana, it's for basketball. I understand that and Billy Donovan isn't changing that culture. ... But I think our program has gotten respect."
Billy Donovan,"That's the one thing that's been great about our basketball teams over the years -- they've earned their way in. Now, we've got to make something happen."
Billy Donovan,"I'm happy for Jordan. He's gotten a lot better as a basketball player, as I knew he would. He's a hard-working kid."
Billy Donovan,What they've been able to do this year is great for basketball.
Billy Donovan,"I know a lot of people are so excited for George Mason. It's great for college basketball. Believe me, I'm mesmerized."
Billy Donovan,Corey had a very good game shooting the basketball.
Billy Donovan,"I think our inexperience [caused that]. I'm not using it as an excuse. I think that when you win basketball games like we've won; we've won on heart, passion and toughness."
Billy Donovan,"It was a back-and-forth basketball game. Both teams had a chance to win, but give Arkansas credit. They were able to find a way to come out with a victory."
Billy Donovan,"We allowed him to do what he does well, and that's shoot the basketball. [If] we force him to make all twos, we probably win the game."
Billy Donovan,"It was a great, great college basketball game. Both teams had a chance to win. I think Arkansas is as talented as any team in the league. They have more experience, much more size and physicality than we do."
Billy Donovan,The second half was a back-and-forth basketball game. Give Arkansas credit. They made some plays and their kids played hard and I thought it was a great college basketball game that both teams had a chance to win at times.
Billy Donovan,"I think what George Mason has done this NCAA tournament has been a milestone and a breakthrough in college basketball. There's been so many programs that have been close. ... I just think in my opinion right now, when you talk about the word 'mid-major' or you talk about the word 'major,' there's no more of that to me. I think those days are over with."
Billy Donovan,"I look at who we're playing as a basketball team and don?t get wrapped up in what the perception is about their team. They're a very, very good basketball team that has beaten Connecticut, Michigan State, North Carolina."
Billy Donovan,The 3-point line is a great equalizer in college basketball.
Billy Donovan,"What they've been able to do this year is great for basketball. Most teams don't get a chance to experience what they've been able to experience. In this tournament, they were able to inspire a lot of people. There was no resentment on our team for feeling like they got all the attention or we got slighted."
Billy Donovan,We're just a basketball team that doesn't have a lot of depth right now. That's our biggest challenge.
Billy Donovan,I would say that our basketball team is totally different.
Billy Donovan,It is great for our basketball team to go through this. They need this. I really think it was our inexperience as a basketball team in relation to [Tennessee's] experience.
Billy Donovan,It was a courageous win for our basketball team.
Billy Donovan,Glen Davis is to college basketball and to this league what Shaquille O'Neal is to the NBA. There's nobody quite like him.
Billy Donovan,"It was a good win for us. Vanderbilt is a very good basketball team. Vanderbilt is a very difficult team to play against. The biggest thing is that our basketball team is still learning. Vanderbilt did some things to us at first where we had to settle in and we picked it up, certainly in the second half, but the first 10 minutes were tough."
Billy Donovan,"It was great to see him shoot the basketball and let it go with the confidence he did. The biggest thing I look at with Lee is the confidence level he's shooting the ball with. Tonight, he was just letting it go and shooting it with a great deal of confidence."
Billy Donovan,You just don't see a lot of players like Glen Davis in college basketball.
Billy Donovan,"He runs, he catches and he alters shots. You just don't see a lot of players in college basketball like him."
Billy Donovan,"These are the situations our guys need to be in for us to reach our full potential as a basketball team. I think a lot of people will focus on the last play, but you know what, with the way these guys battled, it's a shame to lose that way."
Billy Donovan,"We have entered a stage right now in college basketball where 15 years ago, it would have been maybe totally no way George Mason could go to the Final Four. It just goes to show how many good coaches there are out there, how many good players there are out there. On any given night, anybody can beat anybody."
Billy Donovan,"I've never gotten into any of that stuff. If we win basketball games, our seed will continue to improve. If we don't win basketball games, our seed will not improve."
Billy Donovan,"I was getting frustrated watching balls go up from the three-point line, when those guys are standing 1-on-1 in the post with a guy 6-6 guarding them. It's hard sometimes. I'm constantly preaching to (Green and guard Lee Humphrey), 'When you're open, let it go.' Sometimes you have to change your thought processes."
Billy Donovan,"I think it's a great comparison. Bobby Jones was a great runner in transition, he was a great athlete on the floor. I believe as David continues to grow, his shooting will get better. He's a very versatile guy."
Billy Donovan,"They can play with anybody in the United States of America, and they've proven that."
Billy Donovan,"With the age limit, I think you're going to continually make college basketball very young. Some kids handle it better than others. ... It makes it very challenging, very, very, very difficult."
Billy Donovan,I think our guys are a little further along mentally than a lot of guys their age.
Billy Donovan,"Our team battled through the adversity of the game. They battled through not shooting the ball, and we found a way, defensively, to win the game."
Billy Donovan,Everybody was worried about the adversity he was going to face if he didn't make shots. We didn't know the adversity was riding a bike.
Billy Donovan,Their ability not to embrace success.
Billy Donovan,"There's no question Corey has the ability to make game-changing plays with his length, his quickness, and speed. But more than anything else he gives us an experienced player who gives us a little depth and maybe some size across our frontline to help us rebound a little better."
Billy Donovan,"I don't think that we have played against anyone with his size and athletic ability. He is very impressive because he is so skilled. He is a good passer which is impressive for a guy who is 7-foot-2. He runs, he catches and he alters shots. You just don't see a lot of players in college basketball like him. This will be a unique game for us to play against a guy like him."
Billy Donovan,"He has the ability to take difficult shots one, to get them off and two, to be able to make them at a high percentage. He has a special gift and there is nothing you can do about it."
Billy Donovan,"There's no question Corey has the ability to make game-changing plays with his length, his quickness, and speed. But more than anything else, he gives us an experienced player who gives us a little depth and maybe some size across our frontline to help us rebound a little better."
Billy Donovan,"This game was all about the 3-point line and our ability to guard it. They made very, very timely 3-point shots. ... The great equalizer in college basketball is the 3-point line. It's the No. 1 stat I look at."
Billy Donovan,I don't know if I would necessarily say we're just tougher. But we have the ability to play more physical and tougher than maybe we did a year ago.
Landon Donovan,"Crucial, ... You don't want to worry about other results, you don't want to worry about getting a result in the sixth game. If you can finish it ... you finish it."
Landon Donovan,"Having Claudio and John makes it easy on me because they do all the work. I don't have to worry about getting the ball and moving it from side to side or finding people. They do that. I just get in front of the goal and try to score, so it's going to be fun for me."
Landon Donovan,"Talent-wise, looking at our roster, we are deeper. But the thing we don't have that we did in 2002, is there are not as many clear leaders."
Landon Donovan,"Talent-wise, we are much deeper. We are deeper, one through 23, and that's a better thing. The thing we don't have that we had four years ago is as many clear leaders. This time, we have only four or five leaders. That's one issue that will sort itself out."
Landon Donovan,"I don't know about the rest of the world, but I know in our region everyone is gunning to beat us. We have a new challenge."
Landon Donovan,You'd be hard-pressed to find another team in our region that could do that.
Landon Donovan,"We had a good team game plan. I wanted to put on a show, though, and I did."
Landon Donovan,"It's not just another game for me,"
Landon Donovan,"Relaxing, going on vacation, sleeping, having fun when I want, golfing when I want, do whatever I want - I am going to enjoy it,"
Landon Donovan,"All of us who play here for less money than we could make and less fame than other players get around the world, we have the same goal in mind, ... We want soccer to develop and become a major sport in this country."
Landon Donovan,"We've had excuses for part of the year, but we don't have excuses now. This is a game we need to win, period."
Mark Donovan,It's clear that music is a key thing.
Mark Donovan,"Among the U.S. carriers, Sprint has been the most aggressive in trying to become a media and entertainment player, and they're leading the pack."
Mark Donovan,"AOL owes its strong position in the mobile domain to its ability to provide seamless access to AIM buddy lists on handsets through an elegantly designed service and its strong relationships with mobile carriers. Its challenge is to demonstrate that it can use AIM as the foundation to engage users with a broader base of services, much as it is seeking to do on the desktop by opening access to its portal and e-mail services and linking these with AIM."
Shaun Donovan,What's really different here is that we are changing the rules. We're saying the developer who wins is the one with the most affordability.
Shaun Donovan,The city will not tolerate residents living in inhuman conditions.
Shaun Donovan,"By creating ownership, you are giving moderate income residents a financial stake in their neighborhoods, so they benefit from the improvement rather than be hurt by it."
Vince Dooley,I like the opportunity to get together with these coaches I've known over the years and exchange ideas. I think the process lends itself to sound judgments and a thorough evaluation of the teams. I think that we do have some credibility.
Vince Dooley,"I see a coach who worked at it, studied other coaches, who was driven to be a good coach overall, ... We all need a little humility, and he's probably an even better coach than he was from that [Redskins] experience."
Vince Dooley,"Stanfill put him on his tail four or five times, ... Steve was a great athlete, confident and cocky, but we put tremendous pressure on him. That was the best way I knew to stop the quarterback."
Vince Dooley,"Steve had a great ability to stick it to somebody, and he took a special delight in doing it to Ray. And their personalities are different, which might be a part of it."
James Doran,"We have to keep remembering that it is a first year, ... is not a small amount of money."
James Doran,There's a future for it and I believe the town needs an attraction of this nature and size to bring people in.
James Doran,We serve as a research center. But our most important role is education. We teach the history of the fire service - and we teach fire safety. That's the most important component.
James Doran,The museum has probably the finest collection of its kind in the country.
Byron Dorgan,"If the allegations brought forward by the whistle-blowers are correct, they represent both a security threat and a waste of taxpayer dollars."
Byron Dorgan,"If the allegations brought forward by the whistleblowers are correct, they represent both a security threat and a waste of taxpayer dollars."
Byron Dorgan,"If the allegations brought forward by the whistleblowers are correct, they represent both a security threat and a waste of taxpayer dollars. It would be ironic, to say the least, if DHS were unable to secure its own headquarters."
