author,quote
Rudy Giuliani,"The first thing that has to be accomplished by this design is to properly and in a beautiful and compelling way capture the significance of what happened at this place,"
Rudy Giuliani,how he is demonized. It doesn't matter what the media does to ridicule him or misinterpret him or defeat him.
Rudy Giuliani,"We're gaining jobs ahead of America,"
Rudy Giuliani,"We used to be the crime capital and now we're the safest large city in America. We used to be the welfare capital of America and now we're seen as the city that has moved more people off welfare, has moved more people to work from welfare, of any city in America,"
Rudy Giuliani,the safest large city in America.
Rudy Giuliani,"The prayers are for the people missing, the people who have died, and for America and for everyone that survived,"
Rudy Giuliani,"There is no city in America that has reduced crime as much as we have in the last three years, ... This is not the product of accident. This is the product of design."
Rudy Giuliani,"America, ... needs to be defended. We need missile defense to better police the skies over the United States."
Beth Givens,It just points out how pervasive these security breaches are.
Beth Givens,"Yes, you'll probably get that money back once they've done the investigation, but if the investigation takes two weeks or two months, here you are without money in your checking account."
Beth Givens,"We really don?t have anything to compare it to. Victims are protected by federal law from having to pay fraudulent charges, so the loss is primarily of time."
Beth Givens,"The person on the other end of the line is likely to have very sensitive information -- your account number, your Social Security number, the types of accounts you have (and) the way you use your accounts."
Beth Givens,"If they answer yes, then ask, 'How are you making sure that my information is being protected?' If you don't like the answer, take your business to another financial institution."
Beth Givens,These online information brokers are really on the hot seat. There's a lot of interest in what they are doing.
Beth Givens,"The more tracking that's done even within the family, the more we'll all be getting accustomed to tracking, and ... it will become more and more acceptable."
Beth Givens,But it's creepy for a family to be under the watchful eye of a neighbor.
Beth Givens,They are usually off the hook financially. But what they are going to have to endure is far worse than having to pay the impostor's bills.
Beth Givens,"They are usually off the hook financially, ... But what they are going to have to endure is far worse than having to pay the impostor's bills."
Beth Givens,[Congress] could very well wipe out some extremely strong and effective legislation that has been passed into law here in California.
Beth Givens,"The FTC is reporting on the complaints that they've received, and it could be that more people know to report to the FTC when something bad happens to them."
Beth Givens,It's the Social Security numbers that give fraudsters the ability to impersonate that person.
Jeff Gladstein,"I like the dollar higher. There's relatively sub-par growth out of Europe, and the U.S. is humming along."
Jeff Gladstein,"Any bets on dollar weakness will be a bet that higher energy prices will divert consumer spending, which has been the motor for the economy."
Jeff Gladstein,"These numbers tell you that the economy is humming right along through the holiday season. There will be no reason for the Fed to stop hiking interest rates, which is very supportive of the U.S. economy and the dollar."
Jeff Gladstein,There's some selling of the dollar on what appears to be a little weaker demand in the U.S. economy.
Jeff Gladstein,"Everybody's waiting for tomorrow to see if the economy really is on a aggressive roll. It would imply moving more toward 5.25 percent, which should keep the dollar relatively well bid."
William Gladstone,We look forward to the time when the Power of Love will replace the Love of Power. Then will our world know the blessings of Peace.
William Gladstone,"I would tell them of my own intention to keep my own counsel . . . and I will venture to recommend them, as an old Parliamentary hand, to do the same."
William Gladstone,He is the purest figure in history. [About George Washington]
William Gladstone,You cannot fight against the future. Time is on our side.
William Gladstone,"It is the duty of government to make it difficult for people to do wrong, easy to do right."
William Gladstone,The disease of an evil conscience is beyond the practice of all the physicians of all the countries in the would
William Gladstone,"There should be a sympathy with freedom, a desire to give it scope, founded not upon visionary ideas, but upon the long experience of many generations within the shores of this happy isle, that in freedom you lay the firmest foundations both of loyalty and order."
William Gladstone,"Be happy with what you have and are, be generous with both, and you won't have to hunt for happiness."
William Gladstone,Justice delayed is justice denied.
Malcolm Gladwell,"Instinct is the gift of experience. The first question you have to ask yourself is, 'On what basis am I making a judgment?' ... If you have no experience, then your instincts aren't any good."
Malcolm Gladwell,"A country that displays an almost ruthless commitment to efficiency and performance in every aspect of its economya country that switched to Japanese cars the moment they were more reliable, and to Chinese T-shirts the moment they were five cents cheaperhas loyally stuck with a health-care system that leaves its citizenry pulling out their teeth with pliers,"
Malcolm Gladwell,What do we tell our children? ... Haste makes waste. Look before you leap. Stop and think. Don't judge a book by its cover. We believe that we are always better off gathering as much information as possible and spending as much time as possible in deliberation.
Malcolm Gladwell,"For every romantic possiblity, no matter how robust, there exists at least one equal and opposite sentence, phrase, or word capable of extinguishing it."
Malcolm Gladwell,I hope I have encouraged people in business to expand the way they make sense of human behavior.
Malcolm Gladwell,Those with health insurance are overinsured and their behavior is distorted by moral hazard. Those without health insurance use their own money to make decisions based on an assessment of their needs. The insured are wasteful. The uninsured are prudent. So what's the solution? Make the insured a little more like the uninsured.
Malcolm Gladwell,What do we tell our children? Haste makes waste. Look before you leap. Stop and think. Don't judge a book by its cover. We believe that we are always better off gathering as much information as possible and spending as much time as possible in deliberation.
Malcolm Gladwell,The best example of how impossible it will be for Major League Baseball to crack down on steroids is the fact that baseball and the media are still talking about the problem as steroids.
Malcolm Gladwell,"An aggressive drug-testing program would cut down on certain abuses, but its never going to catch everyone - or even close to everyone."
Malcolm Gladwell,"We don't know where our first impressions come from or precisely what they mean, so we don't always appreciate their fragility."
Malcolm Gladwell,That fundamentally undermines your ability to access the best part of your instincts. So my advice to those people would be stop thinking and introspecting so much and do a little more acting.
Stanton Glantz,What Phillip Morris is doing here is a tremendous disservice to parents and to infants because it's increasing the risk infants will die.
Stanton Glantz,This report is forcing reconsideration of this issue by health officials all over the world.
Stanton Glantz,"It's pretty simple. These laws are very bad for the cigarette companies, because they create an environment for people to quit if they want to."
Stanton Glantz,"There are more studies, the risk estimates are more consistently elevated, and they're higher than they were for lung cancer. Plus, there's all these toxicology studies and molecular biology they didn't have back then."
Stanton Glantz,"If people are serious about breast cancer, they have to deal with secondhand smoke. That's what this is all about."
Jerry Glanville,"Once a coach, always a coach. I don't think it ever leaves you. When I was a television analyst, I would study both teams and prepare a game plan, just as I did when I was coaching."
Jerry Glanville,You make your biggest improvement your second year and I think we're going to make a leap.
Jerry Glanville,I don't know the guy and I don't think I've ever had a conversation with him. But I know he's a great coach. The film is his resume. He has a great resume.
Jerry Glanville,"No griping. No complaining. No one asking, 'Why me?'"
Jerry Glanville,"They're shifting to get an advantage on you. Their shift is not gingerbread for the crowd. They're not shifting so the crowd thinks they're cerebral. They shift a guy to one side, and if you don't have him covered, they'll get him the ball."
Jerry Glanville,"With his ability we're going to look at him at both spots. We haven't done anything yet, but just watching him last year I think he can help us at both places."
Jerry Glanville,"He has enough ability to be an excellent player. Unfortunately, he's been hurt the last couple of years."
Milton Glaser,"We are all born with genius. It's like our fairy godmother. But what happens in life is that we stop listening to our inner voices, and we no longer have access to this extraordinary ability to create poetry."
Milton Glaser,Computers are to design as microwaves are to cooking.
Milton Glaser,"The real issue is not talent as an independent element, but talent in relationship to will, desire, and persistence. Talent without these things vanishes and even modest talent with those characteristics grows."
Milton Glaser,To design is to communicate clearly by whatever means you can control or master.
Ira Glass,You'd think that radio was around long enough that someone would have coined a word for staring into space.
Ira Glass,"Where radio is different than fiction is that even mediocre fiction needs purpose, a driving question."
Ira Glass,"When I say something untrue on the air, I mean for it to be transparently untrue. I assume people know when I'm just saying something for effect. Or to be funny."
Ira Glass,"One reason I do the live shows - and the monthly speeches at public radio stations - is to remind myself that people hear the show, that it has an audience, that it exists in the world. It's so easy to forget that."
Ira Glass,"It's not a terribly original thing to say, but I love Raymond Carver. For one thing, he's fun to read out loud."
Ira Glass,"In some theoretical way I know that a half-million people hear the show. But in a day-to-day way, there's not much evidence of it."
Ira Glass,"I think good radio often uses the techniques of fiction: characters, scenes, a big urgent emotional question. And as in the best fiction, tone counts for a lot."
Ira Glass,I suppose I shouldn't go around admitting I speak untruths on the radio.
Ira Glass,"But sadly, one of the problems with being on public radio is that people tend to think you're being sincere all the time."
Ira Glass,Just when did I get to the point when staying at a hotel wasn't fun?
Ira Glass,"But you can make good radio, interesting radio, great radio even, without an urgent question, a burning issue at stake."
John Glass,"Certainly if you bought it last March, it was cheap. It was a value stock. It is generally regarded as a well-run company with a big return on investment. Buffett likes beaten-up names and things you can feel, touch and literally eat. It fits his profile pretty well."
John Glass,"The second half of 2004 is extremely critical. April sales were very strong, but I don't think anyone expects a 10 percent sales increase in September, October and November."
John Glass,"They've chosen not to invest as aggressively as other companies, but also they're not seeing the same sales ramp. You know $17 million in sales this year, that's not really a huge number,"
John Glass,The company has been grooming Bell for that role and he's certainly become more of a public face of the company recently.
Philip Glass,Night Stalker.
Philip Glass,"There were audiences for the first time in living memory. People were discussing modern music. Maybe they liked it and maybe they didn't, but the question of what we were doing suddenly became an urgent one."
Philip Glass,What came to me as a revelation was the use of rhythm in developing an overall structure in music.
Philip Glass,"European musicians didn't learn popular music, whereas in America we did, ... So you played in bands, you played in orchestras, you played everything. The high-art/low-art idea, that was a very European idea and not much appreciated in America. People like Cole Porter and Gershwin were considered very important composers."
William Glass,"People were horrified. Some of the principals started crying. It must have lasted for 20 minutes just watching and listening to the commentators. We spent another 20 minutes working out what to do, and then we went to the schools."
William Glass,"She's open to new ideas and opportunities and will be a natural for creating partnerships with Western Connecticut State University and capitalizing on the rich resources the university brings. Most importantly, she puts children first in all of her educational decision making."
William Glass,I can't put my feelings into words. I don't know what's going on. My words won't flow right now.
William Glass,This is a good example of where we excel.
William Glasser,"When we label anyone bad, we will have more trouble dealing with him than if we could have settled for a lesser label."
William Glasser,"If we are to persuade all students to do quality work, we must involve them deeply in the process of evaluating their own work as they do it! This is concurrent evaluation."
William Glasser,"A friend of mine, a dedicated golfer, shot a hole in one playing by himself. Disaster."
William Glasser,Everybody needs one essential friend.
William Glasser,You can acquire a lot of knowledge without ever going to school.
William Glasser,"Without pay, no human being will work up to their ability if he or she is not cared for and respected."
William Glasser,"When we label anyone 'bad', we will have more trouble dealing with him than if we could have settled for a lesser label."
William Glasser,What students lack in school is an intellectual relationship or conversation with the teacher.
William Glasser,"What happened in the past that was painful has a great deal to do with what we are today, but revisiting this painful past can contribute little or nothing to what we need to do now."
William Glasser,"We don't focus as much in schools on educational knowledge which requires thinking and application, as we do on acquiring facts."
William Glasser,"We can teach a lot of things, but if the teacher can't relate by talking to a group of friendly students, he'll never be a competent teacher."
William Glasser,"We can pay teachers a hundred thousand dollars a year, and we'll do nothing to improve our schools as long as we keep the A, B, C, D, F grading system."
William Glasser,"Told that the passing grade is a B or competence and that we will help you to get there, students do competent work. The lowest passing grade in the real world is competence. Why do schools accept so much less?"
William Glasser,"This is at the heart of all good education, where the teacher asks students to think and engages them in encouraging dialogues, constantly checking for understanding and growth."
William Glasser,There is plenty of competition in a Glasser Quality School in that there is winning but no losing.
William Glasser,"Running a school where the students all succeed, even if some students have to help others to make the grade, is good preparation for democracy."
William Glasser,"Prior to being allowed to enter the profession, prospective teachers should be asked to talk with a group of friendly students for at least half an hour and be able to engage them in an interesting conversation about any subject the prospective teacher wants to talk about."
William Glasser,No human being will work hard at anything unless they believe that they are working for competence.
William Glasser,In a Glasser Quality School there is no such thing as a closed book test. Students are told to get out their notes and open their books. There is no such thing as being forbidden to ask the teacher or another student for help.
William Glasser,I think education is both using and improving knowledge and that changes the whole picture.
William Glasser,"If everyone could learn that what is right for me does not make it right for anyone else, the world would be a much happier place."
William Glasser,"Good or bad, everything we do is our best choice at that moment."
William Glasser,"Too many of us fail to fulfill our needs because we say no rather than yes, or perhaps later in life, yes when we should say no."
William Glasser,Effective teaching may be the hardest job there is.
William Glasser,"We may be up against a stone wall, but we don't have to bloody our heads against it unless we choose to."
William Glasser,Caring for but never trying to own may be a further way to define friendship.
William Glasser,"We almost always have choices, and the better the choice, the more we will be in control of our lives."
William Glasser,"If you want to change attitudes, start with a change in behavior."
William Glasser,"If you improve education by teaching for competence, eliminating schooling, and connecting with students, the test scores will improve."
William Glasser,"If we had in this room a hundred teachers, good teachers from good schools, and asked them to define the word education, there would be very little general agreement."
William Glasser,I think it is totally wrong and terribly harmful if education is defined as acquiring knowledge.
William Glasser,"Every single major push in education has made it worse and right now it's really bad because everything we've done is de-humanizing education. It's destroying the possibility of the teacher and the student having a warm, friendly, intellectual relationship."
William Glasser,"As long as acquiring knowledge is the educational goal of schools, educational opportunities will be limited, as they are now, to affluent families."
William Glasser,"To counter the avoidance of intellectual challenge and responsibility, we must reduce the domination of certainty in education."
William Glasser,"The faster you go, the more students you leave behind. It doesn't matter how much or how fast you teach. The true measure is how much students have learned."
William Glasser,"We are driven by five genetic needs: survival, love and belonging, power, freedom, and fun."
William Glasser,"It is almost impossible for anyone, even the most ineffective among us, to continue to choose misery after becoming aware that it is a choice."
William Glasser,Education is the process in which we discover that learning adds quality to our lives. Learning must be experienced.
Tom Glavine,"It gives me a sense of tunnel vision,"
Tom Glavine,Having Billy makes us a better team. He will give us a sense of security in the late innings.
Tom Glavine,"You don't always expect them to get excited about anything to do with school, but they do,"
Tom Glavine,"You don't always expect them to get excited about anything to do with school, but they do. It's kind of their thing. They have concern for it and they're proud of how it looks. It's kind of an extension of their personality. They want it to be cool like they are."
Tom Glavine,We were running out of outs. You don't get a lot of opportunities.
Tom Glavine,"We can. I've said all along, our talent is equal to that of any team in this race. We just have to do it."
Tom Glavine,"I'm not going to say it's good for the game. I'm not going to say there are no economic problems,"
Tom Glavine,"It's a complete reversal. It's certainly something we want to continue to do, but we have had some problems last year winning on the road, and that's something we have to do something about."
Tom Glavine,"You're looking at a game of more and more power pitchers, and quite honestly, you got to figure those guys are more susceptible to getting hurt. It'll be interesting to see how many of those guys are able to pitch long enough to even come close to having a chance to do it."
Tom Glavine,"Unless my arm falls off, I'm not planning on getting this close to 300 wins and shutting it down."
Tom Glavine,"He carried himself with a lot of passion, and he had an infectious personality, so he's going to be missed. You hate seeing something like that, obviously, at such a young age and seemingly in the prime of his life ."
Tom Glavine,"If there was ever any ... question about what kind of player he was going to be, it was on the offensive side of the ball. There was always a feeling that offensively, he was capable of putting up monster numbers."
Tom Glavine,It stinks that we lost and it stinks that one of our buddies got hurt.
Tom Glavine,I was tired (in the fifth). Striking a lot of guys out is hard work. I realized in the fifth I didn't have a lot of ground outs.
Tom Glavine,"We gave him grief about everything. We always got on him about his physique, which is less than intimidating. How he'd dress sometimes. All that stuff. He was fair game. He played the game, and he gave it back. That was part of the great thing there, for the three of us to be able to be teammates as long as we were, to form a great friendship. Nowadays in baseball, that's hard to do."
Tom Glavine,"All I can do is keep trying to pitch and keep giving us chances to win, ... Sure it is frustrating when you try and go out there and win games and do not."
Tom Glavine,"It's just the environment that we're in right now. There's a lot of people who still don't want to believe that the program we have in place is a good program, and that it's going to work. They're just trying to find a way to shoot holes in it."
Tom Glavine,"We need to wipe away as much doubt about this as we possibly can. Anything we can do to take away people's suspicions, we need to do that."
Tom Glavine,"Without having read it, being told what was in the newspaper, I'm not going to deny that that conversation took place. But that's it. That's a business situation that should remain between the people that were involved. As far as my reaction to it, I really don't have one. I think the only reaction is that I don't really think it's something that needs to be public knowledge."
Tom Glavine,It might have been their birthdays. I gave them each a gift.
Tom Glavine,"I didn't get the benefit of any calls in the first. Having been through this so many times in this park, you don't worry about it."
Tom Glavine,"I like to be in a position of helping people. I find it very humbling that, simply by playing baseball, I'm in position to help so many people. I never take that for granted."
Tom Glavine,"With three balls, Willie told me to put him on. That took care of it for me. I was intent on trying to make pitches and get back. ... Regardless of what his numbers say, he's still capable of doing a lot of things. He's the guy you don't want beating you."
Tom Glavine,"I don't feel the anxiety I felt in my first start for the Mets. Obviously, that game wasn't as important in the standings as [tonight's] game."
Tom Glavine,"I don't feel the anxiety I felt in my first start for the Mets, ... Obviously, that game wasn't as important in the standings as [tonight's] game."
Tom Glavine,"In 1994 there was virtually no chance we were going to reach an agreement without a work stoppage, ... They were talking about a salary cap and we weren't. In this negotiating we've been talking about virtually the same thing. It's sometimes a difference in philosophy on how to reach certain goals."
Tom Glavine,"I think it's just getting to be an increasingly difficult thing to do in the day and age we're in now, ... More than anything else now, I think it's just the offensive explosion. It's so hard to stay in there and win games."
Tom Glavine,"I don't like going to young players and forcing myself on them with advice because they get it all the time. But, if someone asked I'd help them anyway I could. When they approach you, you know they want to learn."
Tom Glavine,"If I have to make the team on my vertical jump, my long jump or my running ability, I don't like my chances. I don't plan, unless my arm falls off, on getting this close to 300 wins and then shutting it down."
Ron Glaz,"Sony hasn't been in the SLR business, so they'll leverage the brand name to try to penetrate the [SLR] market. That's the one piece of the pie they've been missing."
Ron Glaz,"If, for $30, you can get 50 images in a book that is bound for you  where you don't have to buy an album  I think there's a lot of opportunity there. The market is starting to evolve and look beyond the 4-by-6 print."
Ron Glaz,Their true advantage is their using inkjet print solutions.
Malcolm Glazer,[Forbes Magazine] has an eye for value.
Malcolm Glazer,We are enjoying it greatly. It's a wonderful franchise and we just love it.
Malcolm Glazer,no current intention to make an offer for Manchester United.
John Glenn,"You don't need a walker up here and you don't need to worry about osteoporosis or a cane or anything like that, because you just float across the room,"
John Glenn,taking part in some research in a hospital someplace.
John Glenn,largely an opportunity lost.
John Glenn,We have an infinite amount to learn both from nature and from each other
