author,quote
Bill Gates,We're just at the beginning of what can be done with digital technology.
Bill Gates,"This is the beginning of a new chapter in this case,"
Bill Gates,"We hope to find a way to resolve this and put it behind us, ... From the very beginning, we've said we would like nothing better than to settle this case."
Bill Gates,"As we step up malaria research, it's also critically important to save lives today with existing tools. Bed nets cost just a few dollars each, but only a small fraction of African children sleep under one."
Bill Gates,That license is concrete proof of government commitment to strengthen the awareness and the activities around intellectual property.
Bill Gates,"There are some architecture changes that need to be made,"
Bill Gates,"Whether it's Google or Apple or free software, we've got some fantastic competitors and it keeps us on our toes."
Bill Gates,640K ought to be enough for anybody.
Bill Gates,"Until we're educating every kid in a fantastic way, until every inner city is cleaned up, there is no shortage of things to do."
Bill Gates,The Internet is becoming the town square for the global village of tomorrow.
Bill Gates,"I really had a lot of dreams when I was a kid, and I think a great deal of that grew out of the fact that I had a chance to read a lot."
Bill Gates,Your most unhappy customers are your greatest source of learning.
Bill Gates,We always overestimate the change that will occur in the next two years and underestimate the change that will occur in the next ten. Don't let yourself be lulled into inaction.
Bill Gates,At Microsoft there are lots of brilliant ideas but the image is that they all come from the top - I'm afraid that's not quite right.
Bill Gates,It's fine to celebrate success but it is more important to heed the lessons of failure.
Bill Gates,Intellectual property has the shelf life of a banana.
Bill Gates,Television is not real life. In real life people actually have to leave the coffee shop and go to jobs.
Bill Gates,"As we look ahead into the next century, leaders will be those who empower others."
Bill Gates,"If I'd had some set idea of a finish line, don't you think I would have crossed it years ago?"
Bill Gates,"Technology is just a tool. In terms of getting the kids working together and motivating them, the teacher is the most important."
Bill Gates,We are not even close to finishing the basic dream of what the PC can be.
Bill Gates,"Since when has the world of computer software design been about what people want? This is a simple question of evolution. The day is quickly coming when every knee will bow down to a silicon fist, and you will all beg your binary gods for mercy."
Bill Gates,Life is not fair; get used to it.
Bill Gates,Microsoft is not about greed. It's about innovation and fairness.
Bill Gates,Life is not divided into semesters. You don't get summers off and very few employers are interested in helping you find yourself.
Bill Gates,"This is a fantastic time to be entering the business world, because business is going to change more in the next 10 years than it has in the last 50."
Bill Gates,"When you want to do your homework, fill out your tax return, or see all the choices for a trip you want to take, you need a full-size screen."
Bill Gates,DOS is ugly and interferes with users' experience.
Bill Gates,"If you can't make it good, at least make it look good."
Bill Gates,"I actually thought that it would be a little confusing during the same period of your life to be in one meeting when you're trying to make money, and then go to another meeting where you're giving it away."
Bill Gates,"I'm a great believer that any tool that enhances communication has profound effects in terms of how people can learn from each other, and how they can achieve the kind of freedoms that they're interested in."
Bill Gates,People everywhere love Windows.
Bill Gates,"If you think your teacher is tough, wait until you get a boss. He doesn't have tenure."
Bill Gates,"You see, antiquated ideas of kindness and generosity are simply bugs that must be programmed out of our world. And these cold, unfeeling machines will show us the way."
Bill Gates,I believe that if you show people the problems and you show them the solutions they will be moved to act.
Bill Gates,"When the PC was launched, people knew it was important."
Bill Gates,"Like almost everyone who uses e-mail, I receive a ton of spam every day. Much of it offers to help me get out of debt or get rich quick. It would be funny if it weren't so exciting."
Bill Gates,Information technology and business are becoming inextricably interwoven. I don't think anybody can talk meaningfully about one without the talking about the other.
Bill Gates,"People always fear change. People feared electricity when it was invented, didn't they? People feared coal, they feared gas-powered engines... There will always be ignorance, and ignorance leads to fear. But with time, people will come to accept their silicon masters."
Bill Gates,"In this business, by the time you realize you're in trouble, it's too late to save yourself. Unless you're running scared all the time, you're gone."
Bill Gates,"We're hoping the remaining states will join in this agreement so that everyone can focus on the future and avoid the unnecessary costs and delays of further litigation, ... While this decree will place significant restrictions on Microsoft's business, we believe this is a fair and reasonable settlement that will be good for consumers, good for the high-tech industry and good for the economy."
Bill Gates,"The vision is really that in the information age the microprocessor-based machine, the PC, along with great software, can become sort of the ultimate tool dealing with not just text, but numbers and pictures, and eventually, even difficult things lik"
Bill Gates,"This advertising model has emerged as a very important thing,"
Bill Gates,"And we marvel about how, as two young overachievers, we began a great adventure on the fringes of a little-known industry and it landed us at the center of an amazing universe."
Bill Gates,"If those children were in rich countries, we would have headlines, we'd take action. We wouldn't rest until every child was protected,"
Bill Gates,Software is the place where the action is . . . it is an area that will continue to generate jobs. This is the golden age of software.
Bill Gates,"Private philanthropy is no substitute for governmental action here,"
Bill Gates,"Encore implies that life is not a continuous process, that there's some sort of finite number of achievements that defines your life. For me, there are a lot of exciting things in front of me at Microsoft, things that we want to see if we can make ha"
Bill Gates,The arrival of lots of low-cost microprocessors (and) the ability to connect those together with a fairly high-speed data network has led to an exciting new way of thinking about running these high-end applications.
Bill Gates,"The arrival of lots of low-cost microprocessors (and) the ability to connect those together with a fairly high-speed data network has led to an exciting new way of thinking about running these high-end applications,"
Bill Gates,"If you give people tools, [and they use] their natural ability and their curiosity, they will develop things in ways that will surprise you very much beyond what you might have expected."
Bill Gates,"[Smart] is an elusive concept. There's a certain sharpness, an ability to absorb new facts. To ask an insightful question. To relate to domains that may not seem connected at first. A certain creativity that allows people to be effective."
Bill Gates,"The ability to innovate Windows, the ability to maintain the integrity of Windows as a fully designed product -- those are important to us, ... As long as we can keep those intact, it would be great to settle the thing."
Bill Gates,"I think all students start off with incredible ability and curiosity, and if they're given the opportunity to pursue that, if they're given a chance to see the neat things about the world in terms that they can appreciate and enjoy, that their abilities will be reinforced and that we'll really achieve so much more potential out of the great students we have than we do today."
Bill Gates,The first rule of any technology used in a business is that automation applied to an efficient operation will magnify the efficiency. The second is that automation applied to an inefficient operation will magnify the inefficiency.
Bill Gates,Success is a lousy teacher. It seduces smart people into thinking they can't lose.
Bill Gates,We've got to put a lot of money into changing behavior.
Bill Gates,"Security is, I would say, our top priority because for all the exciting things you will be able to do with computers - organizing your lives, staying in touch with people, being creative - if we don't solve these security problems, then people will hold back."
Bill Gates,"I am here to share my story and answer questions about Microsoft and the PC industry, ... I hope that my testimony helps the court to resolve the issues in this case. That would be best for consumers and the industry, and that's why I am here."
Bill Gates,"Windows 2000 already contains features such as the human discipline component, where the PC can send an electric shock through the keyboard if the human does something that does not please Windows."
Gareth Gates,I've had lots of offers of marriage and from women wanting to have my kids.
Gareth Gates,"I do find my speech difficult at times, but it's getting so much better as my confidence grows and that's thanks to the position I'm now in, which is totally due to my fans."
Gareth Gates,"I've got my feet firmly on the ground, I can't see life changing too much. I reckon more girls will talk to me at college and more people will look at me, but they know me for who I am."
Gareth Gates,Having my first number one single and being able to travel to places I've never been before has been amazing. The tour was also fantastic. There are so many things which I've experienced this year which I never even dreamed of.
Gary Gates,You need more people up there (in Austin) who are not lawyers. You need real businessmen. There is a fear in the establishment of people like me getting up there.
Gary Gates,(Hegar) deliberately did that to deceive.
Gary Gates,"If you believe that the market is what rules in this world, all the trends in corporate America say that increasing amounts of policies that promote diversity are good for the bottom line. Companies aren't doing this because it's nice; they do it because it's good for business."
Justin Gatlin,"I have had enough rest and enough training,"
Justin Gatlin,The second half of the race was mine.
Justin Gatlin,It's great. I like the way it is now. You have to have room for error to make mistakes to be better next time around.
Justin Gatlin,"I don't mind a target on my back,"
Justin Gatlin,It is such a great honor.
Justin Gatlin,"My job was to come out here and get the 100 and 200 gold medals. That's what I did. The (relay) was icing on the cake. Obviously there's no icing now, but I feel sorry for the guys who came here with dreams to win a medal. ... They didn't get that chance."
Justin Gatlin,Double gold means I'm king of the sprints. It shows I'm the best sprinter around.
Justin Gatlin,"says the Olympic 100-meter gold medalist. ''If I go out and do great, it'll be, 'Well, Asafa wasn't there.' That's the first thing they'll say."
Justin Gatlin,"I'll be giving it my best shot,"
Justin Gatlin,"We're just really, really close friends. If the situation were different we probably would be together, but we're just friends, and that's how we like to keep it right now. Hopefully things will turn out the best they can."
Justin Gatlin,Double gold. I think I've sealed my fate right now as the king of sprints.
Justin Gatlin,What events do you run?
Justin Gatlin,"I ran like a champion. It is a great consolation to show how dominant I am. I am the Olympic champion and the world champion, but I want Justin Gatlin to be the champion of everything,"
Justin Gatlin,"I might go out there and grab a medal from these young boys running fast,"
Gennaro Gattuso,There is little to say after that performance. He is able to do what few others in the world can.
Gennaro Gattuso,"There is little to say after that performance,"
Gennaro Gattuso,It's wonderful to play in a side like Milan where there is the ability to react to difficult moments and bring the best out of ourselves.
Paul Gauguin,We never really know what stupidity is until we have experimented on ourselves
Paul Gauguin,"In marriage, the greater cuckold of the two is the lover"
Paul Gauguin,"I have always wanted a mistress who was fat, and I have never found one. To make a fool of me, they are always pregnant."
Paul Gauguin,"Life being what it is, one dreams of revenge."
Paul Gauguin,There is always a heavy demand for fresh mediocrity. In every generation the least cultivated taste has the largest appetite.
Paul Gauguin,It is the eye of ignorance that assigns a fixed and unchangeable color to every object; beware of this stumbling block.
Paul Gauguin,The history of modern art is also the history of the progressive loss of art's audience. Art has increasingly become the concern of the artist and the bafflement of the public.
Paul Gauguin,Art is either plagiarism or revolution.
Sunil Gavaskar,"This is the first time in decades that the greatest players from the rest of the world have combined their talents, and I expect them to put Australia under real pressure."
Sunil Gavaskar,"Andrew has played a lot of cricket lately at a high intensity so it didn't seem necessary to rush him into a game only two days after he has arrived in Melbourne,"
Sunil Gavaskar,"For Indian cricket, I am always ready to assist in whatever way I can."
Sunil Gavaskar,"Cricket has lost a lot of spectators in the wake of the match-fixing scandal, and it must ensure it does not lose more because some official is waiting for the conditions to be perfect."
Sunil Gavaskar,The umpires on the field can call the bowler if they feel that his action is not right.
John Gay,"I know you lawyers can, with ease, twist words and meanings as you please"
John Gay,"The fly that sips treacle is lost in the sweets, So he that tastes woman, woman, woman; He that tastes woman, ruin meets"
John Gay,There is no dependence that can be sure but a dependence upon one's self
John Gay,"When we risk no contradiction, it prompts the tongue to deal in fiction"
John Gay,We are frustrated with the broken immigration system. It doesn't match the economic reality.
John Gay,"O ruddier than the cherry, / O sweeter than the berry, / O nymph more bright / Than moonshine night, / Like kidlings blithe and merry."
John Gay,"Where yet was ever found a mother, / Who'd give her booby for another?"
John Gay,"Do you think your mother and I should have lived comfortably so long together, if ever we had been married? Baggage!"
John Gay,"Sure men were born to lie, and women to believe them!"
John Gay,"Bring me a hundred reeds of decent growth,/ To make a pipe for my capacious mouth."
John Gay,The child whom many fathers share hath seldom known a father's care
John Gay,There is no dependence that can be sure but a dependence upon one's self.
John Gay,I must have women - there is nothing unbends the mind like them.
John Gay,"O Polly, you might have toyed and kissed, by keeping men off, you keep them on."
John Gay,"Cowards are cruel, but the brave love mercy and delight to save."
John Gay,"Those who in quarrels interpose, must often wipe a bloody nose."
John Gay,"On the choice of friends, Our good or evil name depends."
John Gay,"The brave love mercy, and delight to save."
John Gay,"But money, wife, is the true Fuller's Earth for reputations, there is not a spot or a stain but what it can take out."
John Gay,"But his kiss was so sweet, and so closely he pressed, that I languished and pined till I granted the rest."
John Gay,"A rich rogue nowadays is fit company for any gentleman; and the world, my dear, hath not such a contempt for roguery as you imagine."
John Gay,Tell me and I forget. Show me and I remember. Involve me and I understand.
John Gay,"What then in love can woman do? If we grow fond they shun us. And when we fly them, they pursue: But leave us when they've won us."
John Gay,We only part to meet again.
John Gay,No retreat. No retreat. They must conquer or die who've no retreat.
John Gay,Shadow owes its birth to light.
John Gay,"Gamesters and highwaymen are generally very good to their whores, but they are very devils to their wives."
John Gay,"Follow love and it will flee, flee love and it will follow thee."
John Gay,"Lions, wolves, and vultures don't live together in herds, droves or flocks. Of all animals of prey, man is the only sociable one. Every one of us preys upon his neighbor, and yet we herd together."
John Gay,She who has never loved has never lived.
John Gay,"An open foe may prove a curse, but a pretended friend is worse."
John Gay,"Fill ev'ry glass, for wine inspires us, / And fires us / With courage, love and joy. / Women and wine should life employ. / Is there aught else on earth desirous?"
John Gay,Corruption's not for modern date; It hath been tried in ev'ry state
John Gay,"To cheat a man is nothing; but the woman must have fine parts, indeed, who cheats a woman"
John Gay,"In beauty, faults conspicuous grow;  the smallest speck is seen on snow"
John Gay,The comfortable estate of widowhood is the only hope that keeps up a wife's spirits.
Marvin Gaye,"If you cannot find peace within yourself, you will never find it anywhere else"
Marvin Gaye,"I hope to refine music, study it, try to find some area that I can unlock. I don't quite know how to explain it but it's there. These can't be the only notes in the world, there's got to be other notes some place, in some dimension, between the crack"
Marvin Gaye,"If you cannot find peace within yourself, you will never find it anywhere else."
Marvin Gaye,"I hope to refine music, study it, try to find some area that I can unlock. I don't quite know how to explain it but it's there. These can't be the only notes in the world, there's got to be other notes some place, in some dimension, between the cracks on the piano keys."
Marvin Gaye,Marriage is miserable unless you find the right person that is your soulmate and that takes a lot of looking.
Marvin Gaye,Negotiating means getting the best of your opponent.
Marvin Gaye,"I am not going to be dictated to by fans, certainly. I am dictated enough to by my record company to last me a million years."
Marvin Gaye,"Most fear stems from sin; to limit one's sins, one must assuredly limit one's fear, thereby bringing more peace to one's spirit."
Marvin Gaye,Great artists suffer for the people.
Marvin Gaye,I sing about life.
Crystal Gayle,You're either in it for the long haul or you're not.
Crystal Gayle,"You have to be committed or you fall behind, lose out."
Crystal Gayle,Women have to show that tummy to stay noticed.
Crystal Gayle,"Well, maybe surf one time; I think it would be fun to catch a wave just once."
Crystal Gayle,There was a time when country never used to do videos.
Crystal Gayle,Staying focused is hard work and staying married is even harder.
Crystal Gayle,"So many singers want to act, and so many actors try to sing."
Crystal Gayle,Now so many really good groups who have had a first major hit can't get a deal for a second one.
Crystal Gayle,Nashville used to have more integrity than just looking at the bottom line.
Crystal Gayle,It used to be that Nashville would work to develop promising artists.
Crystal Gayle,Country is not what you heard on the Grammys.
Crystal Gayle,"But these days, it's hard to make it just on a beautiful voice."
Crystal Gayle,All I ever want to do is what I am: a singer.
Gloria Gaynor,"Well, we all know that self-esteem comes from what you think of you, not what other people think of you."
Gloria Gaynor,"Well, I went through some emotionally abusive relationships and allowed myself to not be properly respected as a lady, as a human being even, though I tried everything I knew to be a lady."
Gloria Gaynor,"There's nothing to compare to live music, there just isn't anything."
Gloria Gaynor,People always want to ask me about my drug problem - I never had a drug problem; I had a self-esteem problem!
Gloria Gaynor,I think I sound like Barry White.
Gloria Gaynor,I have never been a different person onstage than I am off.
Gloria Gaynor,I had a fear of being alone.
Gloria Gaynor,"That's why you find a lot of entertainers are insecure, because it's the perfect camouflage for insecurity."
Andrew Gaze,I don't think they'll trouble the shot clock too many times. They like to get out there and run and shoot it up. Any time you get top players running around it makes for a good contest.
Andrew Gaze,"The mind was willing to keep going but I didn't think that physically I could do it,"
Andrew Gaze,"This is a huge coup for the Games to be invited to be part of the pre-game entertainment,"
Andrew Gaze,"Your heath and, physically, your ability to perform are key factors."
Laurent Gbagbo,"This acceleration of violence is unacceptable, ... We will fight against this mentality of (coups)."
Laurent Gbagbo,"This acceleration of violence is unacceptable,"
Laurent Gbagbo,"I told them if that was the truth, then an inquiry should be opened and the culprits brought to book."
Laurent Gbagbo,"I hope elections will take place well before 12 months ... that is a job I will entrust to my new prime minister whom we will name in a few days,"
Laurent Gbagbo,"Take other elections throughout the world, ... Take the election in the U.S. itself. The turnout rate is not higher than what we got. ... I was elected democratically in my country, and I believe I have a right to conduct my mandate."
Laurent Gbagbo,"All the dates we have set will be maintained. The elections will take place in the northern region on January 14,"
Laurent Gbagbo,"The President of the Republic will carry on guaranteeing the continuity of the state ... until elections are held,"
Laurent Gbagbo,"The children of Ivory Coast will not allow them to do it. Those who stand up against us, we will fight,"
Jomo Gbomo,The hostages are so far in good health. They have been scattered around communities.
Jomo Gbomo,The Nigerian government is not sufficiently impacted to consider the conditions we have laid out before them and we perhaps need to be more ambitious in our attacks on oil facilities. Whether we will achieve this objective remains to be seen.
Jomo Gbomo,We wish to warn the Chinese government and its oil companies to steer well clear of the Niger Delta. Chinese citizens found in oil installations will be treated as thieves. The Chinese government by investing in stolen crude places its citizens in our line of fire.
David Geffen,"You have an idea of the way you think it is, and it's not that way at all, it's something else."
David Geffen,To be able to live and work in the United States is a privilege.
David Geffen,The opportunity for an entrepreneur to start a company from scratch today is abysmal.
David Geffen,Steven Spielberg and I have tremendous amounts of money.
David Geffen,My mother taught me to love my work. I learned everything about business from her.
David Geffen,Move to California. Malibu is paradise.
David Geffen,It's very easy for me to thank everyone for the incredible contribution they've made to my life.
David Geffen,It's the perfect definition of a settlement. Both parties didn't get what they wanted.
David Geffen,It's easy in music to tell what's good. It's hard to tell what's bad.
David Geffen,In Hollywood people lie to each other and cheat each other and then go and play tennis. But I don't want to be a tennis player.
David Geffen,I'm not Sammy Glick. I've never killed anyone. I don't have to. I'm too talented.
David Geffen,"I'm Billy the Kid, the fastest draw. It's not arrogance. It's the truth."
David Geffen,I would say that Bob Dylan is as interested in money as any person I've known in my life. That's just the truth.
David Geffen,I thought I'd be a success even back in the mailroom at William Morris.
David Geffen,"I just needed a job. Before being hired as an usher at the CBS Theatre, I didn't even know there was a show business!"
David Geffen,I intend to be me. Whatever that is.
David Geffen,I believe we're all in denial about the people we love.
David Geffen,Happy is harder than money. Anybody who thinks money will make you happy hasn't got money.
David Geffen,Broke is a Hollywood term!
David Geffen,I never went to business school. I was just bumbling through a lot of my life. I was like the guy behind the curtain in The Wizard of Oz.
David Geffen,"Anybody who thinks money will make you happy, hasn't got money."
David Geffen,I am truly my mother's son.
Neil Gehrels,We designed Swift to look for faint bursts coming from the edge of the Universe.
Neil Gehrels,"We designed Swift to look for faint bursts coming from the edge of the universe. Now we've got one, and it's fascinating. For the first time we can learn about individual stars from near the beginning of time. There are surely many more out there."
Neil Gehrels,"This is totally new, totally unexpected. This is the type of unscripted event in our nearby universe that we hoped Swift could catch."
Larry Gelbart,"In a world that operates at least 50 percent on fear, he was very confident,"
Larry Gelbart,Today's audience knows more about what's on television than what's in life.
Larry Gelbart,"If vaudeville had died, television was the box they put it in."
Larry Gelbart,One doesn't have a sense of humor. It has you.
Bob Geldof,"I just don't think the violence will achieve anything. The debt campaigners have never been violent, and they have achieved a lot."
