author,quote
Peter Grandich,"Gold continues to defy the bears, skeptics and even ardent bulls all of whom continue to pay little or no attention to one of the most powerful factors driving the secular bull market."
Peter Grandich,"Since bottoming in 2001, gold has seen a two-steps-up, one-step-back rise, and Monday's big drop is nothing more than the start of the one-step-back part."
Peter Grandich,The news of an attack on an oil facility in Saudi Arabia is just an example of the many different geopolitical events that underpin the secular gold bull market.
Peter Grandich,There should be no doubt that gold remains in a secular bull market.
David Granger,"Really, it's mostly confidence, ... He has a way of mixing fine tailoring with clothes that are relaxed, so he looks equally put-together and casual at the same time."
David Granger,"Really, it's mostly confidence. He has a way of mixing fine tailoring with clothes that are relaxed, so he looks equally put-together and casual at the same time."
David Granger,"It's tragic when someone's struck down at such a young age, and Auburn University extends its condolences to the Cox family."
Amy Grant,"I don't think it's about the hype, I think it's about the possibility of people saying, 'You mean there is really a possibility that my wish could be chosen?'"
Amy Grant,"The music industry has changed so much. Musically, I don't really know what it is I'm trying to do."
Amy Grant,"I started writing when I was a kid, and I have always seen music as a great opportunity to either get in touch or stay in touch with things that matter, ... how you feel about somebody, what you think, what you hope for, what you are crying about."
Amy Grant,I had the great advantage of a mother who used to tell me the most beautiful years of a woman's life are ages 35 to 45.
Amy Grant,a walk down Memory Lane.
Amy Grant,"[Earlier, in a sampling of Gill's hits, Grant sang] Whenever You Come Around. ... Man, that's the luckiest woman alive that he wrote that song for."
Amy Grant,"What a great thing to wish for, your life plays out in a way, that you miss something that's so important to you, and somebody says what would you like, or if I could wish I would turn back the hands of time and go back and enjoy this experience that I missed."
Amy Grant,"You do your best, you do all this stuff, but the only thing that counts is faith expressing itself through love."
Amy Grant,"Winnie the Pooh & Christmas, Too"
Amy Grant,"AIM has been important to Nancy for a long time. Nancy has been asked to do a lot of charity things, and I thought, 'If this has captured her heart for 25 years, that is pretty important.' Any time you can bring people together, especially in the life of a child, everybody is richer for it."
Amy Grant,"But now it's kind of a given that a 15-year-old would have a record deal and sell a quarter of a million records. No one's expecting her to answer any deep theological questions. And I'll tell you, I was asked some deep theological questions from the git-go."
Amy Grant,"You have to treat people gently because we're all in a process. What might seem like a good idea to somebody at 21 is probably not going to seem like a good idea at 50, but you don't know that until you get there."
Amy Grant,"Everybody's entitled to think whatever they want and to express that, but my personal day-to-day experience does not come into contact with any of those people."
Amy Grant,The people I've been exposed to have been people of amazing integrity.
Amy Grant,"Life goes by really fast, and it seems that there are times when you're burying a lot of friends and family. And then there are times that feel really precious and everybody is doing okay. This is one of those times."
Amy Grant,"It's human nature to be curious about people, and to be more curious about young people than old people. We want to cheer something on at the same time we want to tear it down. That's just so normal."
Amy Grant,"In the past, when I'd recorded during a break in a tour, it was so easy to sing, because I felt strong. Also, like so many new mothers, I wasn't getting a lot of sleep, and sleeping is such a huge part of being able to sing."
Amy Grant,"If you went to your closet today, would you pull out the same outfit you wore 10 or 15 years ago? You wear feelings and faith differently as well."
Amy Grant,"I've found that music allows years to fold like an accordion over each other, so I guess you don't feel the passage of time as much."
Amy Grant,"I know how it feels to go into a studio to start a record, and eight weeks later it's finished. I know how an intense schedule feels."
Amy Grant,"I just think people should find the music that helps them through the day and enjoy that. I've never felt like, if somebody does or doesn't like what I'm doing, it's a morality issue."
Amy Grant,I feel a part of the congregation. I've never had to do special music. The kids sing in the choir. It's just normal. We're treated like everybody else.
Amy Grant,"I did the best I could, and in some arenas, my best was not good enough. I've made some bad choices."
Amy Grant,"I can look back at different times in my life when I felt I could not find my way out of whatever it was. I'm not necessarily talking about marriage, but I wanted to pack it in. I wanted to disappear. A lot of that has to do with being in the public eye."
Amy Grant,"Depending on what day of the week it is and what time of the month it is, I'm a good friend or not a good friend. I'm more or less a good mom or not a good mom, more or less a good mate or not a good mate. That's just life, whether or not you're public."
Amy Grant,"I think that if my kids are completely convinced of God's unfailing love for them, whether they fail or not, they'll have confidence to persevere in life."
Amy Grant,"I think for a woman, the hardest thing about growing old is becoming invisible. There's something very front and center about being young."
Amy Grant,I love being with my children. They're fascinating people.
Amy Grant,"Come Christmas Eve, we usually go to my mom and dad's. Everybody brings one gift and then we play that game when we all steal it from each other. Some are really cool, others are useful and some are a bit out there."
Amy Grant,"But my experience is that people who have been through painful, difficult times are filled with compassion."
Amy Grant,I'm not anxious to be anywhere other than where I am right now.
Amy Grant,"I'm frustrated by something, it's my fault for exposing myself to it in the first place. The rumor mill always seemed like a grass fire to me. Why walk out in the middle of the field, it's just going to flame out and go away just like everything else does?"
Amy Grant,"Every good relationship, especially marriage, is based on respect. If it's not based on respect, nothing that appears to be good will last very long."
Amy Grant,"For me, the backdrop of half the experiences of life includes music."
Amy Grant,"Without black, no color has any depth. But if you mix black with everything, suddenly there's shadow - no, not just shadow, but fullness. You've got to be willing to mix black into your palette if you want to create something that's real."
Amy Grant,"The fact of the matter is, when I'm on tour, I'm juggling so hard to keep all the balls in the air that I don't often get to really enjoy what I'm out there doing."
Amy Grant,"Anybody who's ever gone through a hard time - any outsider's perception, no matter how much information they're given, they have no idea what the person's life is like."
Amy Grant,"Since I travel so much, it's always great to be home. There's nothing like getting to raid my own refrigerator at two in the morning."
Amy Grant,There's a beauty to wisdom and experience that cannot be faked. It's impossible to be mature without having lived.
Hugh Grant,"Corn farmers in the United States recognize the tremendous value and performance that Monsanto's insect-protected and herbicide-tolerant traits are providing to their farms. This season, we are seeing strong order patterns in our corn traits business, and early indications also reinforce that the company's value-pricing model is expected to drive penetration of our corn traits."
Hugh Grant,"When you do this for five years in a row, it's no longer luck. It's a trend line."
Hugh Grant,The moral of filmmaking in Britain is that you will be screwed by the weather.
Hugh Grant,I whimper like a little girl.' - when he has bad dreams
Hugh Grant,"The Virgin Suicides score is really good. Lots of Air. And About A Boy , that Hugh Grant movie, has lots of cool stuff by Badly Drawn Boy. I had it on my Christmas list one year and my parents didn't get it because they thought I was kidding"
Hugh Grant,I don't particularly like babies. I don't mind them for about four minutes. That's my max. After that I can't quite see what everyone's fussing about.
Hugh Grant,But Europe has redefined and redesigned the regulatory architecture and the last year we saw the beginnings of products being approved. I passionately hope we will see that pace picking up.
Hugh Grant,"Women are frightening. If you get to 41 as a man, you're quite battle-scarred."
James Grant,"As an arithmetic proposition in many mutual funds, chances are that by the time the great performance has been registered, you, the public investor, are only entering. You're coming in for the last of it."
James Grant,Anybody who feels indispensable is living in a false world. All you can do is do the best you can.
James Grant,"He's going to conduct practice until Mike returns, which we hope is tomorrow morning."
James Grant,"We were very much a family club,"
James Grant,"It seems to me the least-esteemed asset in existence is cash, short-dated treasuries, and I think that is the asset that is going to surprisingly outperform in the years ahead."
James Grant,What few were thinking about in the summer of 1998 was a Russian [debt] default.
James Grant,What the MOVE index measures is the level of complacency or confidence in the interest rate world. The market chooses not to see much risk in anything.
James Grant,I don't know the exact circumstances. He did have some medical problems and was transported to Heartland Medical Center for some evaluations.
James Grant,He was sitting up in bed. They were doing tests. They weren't allowing him to walk around.
James Grant,"As much anxiety as we might extend over the victims of a rising funds rate, we ought to also spare a thought for the consequences of rates having been here in the first place,"
Jim Grant,It's not that we're concerned. We have plenty of options for the space.
Jim Grant,We cover a mostly commercial area over there. We had some spots that were without power for six or seven hours but mostly we were able to keep it to a couple of hours.
Jim Grant,"There was magic to that season -- for me, and more for my team,"
Jim Grant,We need an approval soon. Every delay at the Planning Board level pushes the dates back.
Jim Grant,Bank of New York or Bank of America would come in and each would have their own regulatory or audit questionnaires. But it would be in a different form.
John Grant,"Our power-play's been playing well all year, that's been one of the bright spots of our team this year, and we got the shot and it went in."
John Grant,"I've been coming to Notre Dame since 1957. This place, this campus, is the closest thing there is to perfection."
John Grant,It's sort of nice to take a journey on a record and end up in all sorts of different places.
John Grant,"You sort write things to have an excuse to use trumpet. And to have Ron Miles do that [on 'Little Pink House'] is a huge honor. On the new album, for example, I'm specifically thinking about the bass clarinet all the time because I love it so much."
Robert Grant,"At this time he's not a target, ... He's a logical interview. He runs city government, he makes decisions."
Robert Grant,certain areas of the government appeared to be rewarded with jobs.
Robert Grant,The demands of modern living are so exacting that men and women everywhere must exercise deliberate selection to live wisely
Robert Grant,"For us to get Independence up and running again, we need to inject the community with an infusion of cash. We're trying to raise $250,000 and 100% of it will go to helping families in the area and rebuilding the community. We're asking the people of Connecticut, especially from Waterbury where we've made our home since 1812, to help Independence become independent again."
Ulysses Grant,"Everyone has his superstitions. One of mine has always been when I started to go anywhere, accomplished."
Ulysses Grant,Let us have peace.
Ulysses Grant,I know no method to secure the repeal of bad or obnoxious laws so effective as their stringent execution.
Ulysses Grant,"There are many men who would have done better than I did under the circumstances in which I found myself. If I had never held command; if I had fallen, there were 10,000 behind who would have followed the contest to the end and never surrendered the"
Charles Grassley,"The serious nature of the reported findings and allegations, coupled with the grave implications if these allegations are meritorious, compel me ... to refer these matters to the Department of Justice and to the Securities Exchange Commission for consideration."
Charles Grassley,"The FBI's excuse that the 'computer ate my homework' simply doesn't add up. Instead, the McVeigh case reveals a management meltdown,"
Charles Grassley,Are you against cameras in the courtroom like Justice Rehnquist was?
Charles Grassley,"Well, I don't want to directly comment on what Justice Souter said. He is either going to be a colleague or continue to be one of my bosses. So I want to maintain good relations in either case."
Charles Grassley,"The immediate relief package that we're announcing today will help get short-term aid to hurricane victims by encouraging food donations and the employment of displaced individuals,"
Charles Grassley,"Rather than delay help for seniors, we need to fix the problems."
Charles Grassley,"I think there's a management culture here that's at fault. I call it a cowboy culture,"
Charles Grassley,"If Congress does its job, taxpayers won't suffer any tax increase,"
Charles Grassley,"We here in Congress have to find solutions. They don't have to, ... The answer is, they are both running for president."
Charles Grassley,"My (Republican) colleagues are not brave enough,"
Charles Grassley,"I believe the victims of Katrina would certainly be covered under this provision, ... that there are no unintended results."
Charles Grassley,"We've looked at Army regulations, and it specifically states there are no toxins allowed in textile fabrics,"
Charles Grassley,"I think the FBI has shown, going back to January of 1997, its ability to use its power and prestige to curb statements and truths other agencies were willing to give out,"
Chuck Grassley,"More of his unreserved honesty is needed inside the beltway,"
Chuck Grassley,"Last night we passed the most extensive update to the Medicare program since the program's creation in 1965, ... The effort was bipartisan."
Chuck Grassley,This is a jobs creation legislation.
Chuck Grassley,"Imports create competition and keep domestic industry more responsive to consumers. In the United States, we import everything consumers want. So why not pharmaceuticals?"
Jeffrey Grau,Online sales still represent about 2 percent of total retails sales. So there's a lot more room to grow.
Jeffrey Grau,"Online sales still represent about 2 percent of total retails sales. So there's a lot more room to grow,"
Jeffrey Grau,"Online sales are growing at a healthy clip, even though sales may have pulled back somewhat from the robust pace seen earlier this year."
Jeffrey Grau,"This year online shopping has gone mainstream, where we're seeing a greater percentage of consumers from different age and income demographics buying on the Internet."
David Graveney,"People have a spring in their step. When you read that the TV ratings exceeded the final night of Big Brother, you know that you're heading in the right direction."
David Graveney,Simon is continuing to make progress in his recovery from injury and we will give him as much time as he needs in order to prove his fitness.
David Graveney,They are always immaculately turned out no matter what circumstances.
David Graveney,"I don't know what the situation is with the Australian team but they seem pretty settled. In the same way that there were plenty saying last summer that they did not want to be in the side that loses the Ashes, there'll be more wanting to be in the team that regains them. We are under no illusion about how determined Australia will be."
Adam Graves,I think guys gained strength from his will.
Adam Graves,How long do you have from the warm-up to the end of the game? Three hours? That's probably not enough time to pay tribute to what he's meant to the organization. That's why there will be a day he will join Mike and Mark and Rod and Ed.
Adam Graves,He came here and made us believe winning the Cup was our destiny.
Adam Graves,He made us believe that the Stanley Cup was our destiny.
Adam Graves,"He changed the culture. He made us stronger as players, stronger as a team and stronger as an organization."
Michael Graves,"At the time we were planning the building, ... Joyce wanted to include a sensory park. But the budget wouldn't let us do both projects, so we agreed to work on the park when there was money to do so."
Michael Graves,"The daughter said, 'Look at these things -- these are terrific.' The mother agreed, 'These are really cool things. I'd buy a tea kettle if they had one.'"
Michael Graves,"I think it's a really good way to get people to come up here. It's good to expand your mind by meeting people of other countries and beliefs, a good experience."
Michael Graves,As an architect I've always believed that what can make a domestic setting truly home is the infusion of a cultural dimension.
Michael Graves,"It really warmed my heart,"
Michael Graves,"Design has nothing to do with economic class. If I were designing for Cartier or Tiffany, I would expend the same energy."
Michael Graves,This is one of the few things that would make me instantly drop Northwest as a carrier of choice.
Michael Graves,"I see architecture not as Gropius did, as a moral venture, as truth, but as invention, in the same way that poetry or music or painting is invention."
Michael Graves,The dialogue of architecture has been centered too long around the idea of truth.
Michael Graves,"I don't care what people call me,labels have the negative value of making smaller boundaries for people."
Michael Graves,I have no requirements for a style of architecture.
Michael Graves,I have a requirement for myself in making designations of elements. I need to have full language and I do not want the language to be only space.
Michael Graves,It was always my goal to 'up the ante' on good design and rye devoted much of my career to this.
Michael Graves,I don't believe in morality in architecture.
Michael Graves,"In designing hardware to be used every day, it was important to keep both the human aspects and the machine in mind. What looks good also often feels good."
Michael Graves,"In any architecture, there is an equity between the pragmatic function and the symbolic function."
Michael Graves,"If I have a style, I am not aware of it."
Wavy Gravy,What a rush it was to plunge into the bin of official decision and cast a ballot in favor of FUN.
Wavy Gravy,"Well, this week for example, I was just in Los Angeles making a documentary for German television on whales. They had tried to get me in England where they missed me."
Wavy Gravy,We are all the same person trying to shake hands with our self.
Wavy Gravy,"To let the people know there was life beyond Shirley Dean, we decided to focus on voter registration; each day I set up my card table somewhere in the district, signed people up, and passed out noses."
Wavy Gravy,The 90's are the 60's standing on their head.
Wavy Gravy,"Sure, I could of done it different... put my clown in a closet and dressed up in straight clothing. I could of compromised my essence, and swallowed my soul."
Wavy Gravy,"Laughter is the valve on the pressure cooker of life. Either you laugh and suffer, or you got your beans or brains on the ceiling."
Wavy Gravy,"Keep your sense of humor, my friend; if you don't have a sense of humor it just isn't funny anymore."
Wavy Gravy,I had 500 kids at camp this past summer for example. We do nine weeks for kids and nine days for grown ups every summer. The adult camp is a lot of fun.
Wavy Gravy,I am in total ecstasy with where my life is now.
Wavy Gravy,"I always say, dare to struggle, dare to grin."
Aaron Gray,This is a typical Big East game. Even this game came right down to the last shot. The guys did a good job fighting back. It's going to be like this day-in and day-out. There's no gimme wins in this conference.
Aaron Gray,It's been a pleasure playing against you.
Aaron Gray,The mental mindset is great because of our strong performance in the Big East tournament. A lot of positive things came out of it.
Aaron Gray,"All the great people learn from the people before them. Chris took one approach and did things the way he wanted to do it. Carl took a completely different approach and did the things the way he wanted to do it. I'm not saying either way is right or wrong, just a different approach."
Aaron Gray,"Other teams are keying in on him, setting whole defensive strategies around him. That's presenting opportunities for other people to step up. It's amazing. It seems like every game, it's someone different."
Aaron Gray,We got a lot of people out on their shooters and didn't give them many open looks. We think we're a good man-to-man team and we can be physical.
Aaron Gray,"Carl does so many things that people don't realize. He only scored eight points, and he was probably the happiest guy in the locker room. Obviously, he doesn't have a problem with it."
Aaron Gray,"He does a great job of getting people to play their best. One of the reasons we are such a good team is that every day in practice is like a game to us. Everything we do is competitive, and everything we do we want to win, no matter what the drill is. He knows you have to coach everyone differently."
Aaron Gray,"There are so many emotional highs and lows. You play really well one night, and the next night, you don't play well at all."
Aaron Gray,That was a tough game. We played real hard. The shots just weren't falling tonight. It just wasn't our night.
Aaron Gray,"No matter how much money the NBA offers, that amount won't be able to buy back my senior year at Pitt."
Aaron Gray,"The coaches just told me to be patient. I get real anxious when I see teams are playing me man-to-man. Early on, I had a lot of bad turnovers. I think that goes to the fact that we hadn't played in eight days."
Aaron Gray,"This team, we're winners. We hate to lose. We don't know how to lose. We have 13 guys who are willing to do whatever it takes to win."
Aaron Gray,We didn't do anything special to prepare for the game or do anything differently. We put in hard work and prepared for this game just like any other.
Aaron Gray,One of our goals is to get a bye in the first round of the Big East Tournament.
Aaron Gray,Lacrosse is fast paced and I like fast paced games. It's demanding physically and has the hardest conditioning of any sport. You are always running if you are not sprinting. It's constant movement.
Aaron Gray,"They got me tired, but I had to push through it. There are points in the game where my teammates feed off me. I have to make sure I get back on defense, and just get in position where I can make plays."
Aaron Gray,"Everyone got their feelings out. We accomplished a lot just by being able to talk to each other. Now, we're getting ready to go in not only physically prepared, but mentally prepared."
Aaron Gray,"In discussing my options the last couple of weeks with my family and Coach Dixon, I feel that it is in my best interest to declare for the NBA Draft. I will not hire an agent, leaving me the option to return to the University of Pittsburgh for my senior season. The draft process will provide me a great learning experience and will help me become a better player."
Aaron Gray,"The draft process will provide me a great learning experience and will help me become a better player. Academically, I am well on my way to graduating and earning a degree and that is a priority for me."
Aaron Gray,"Maybe it was a lack of our defense. They got a lot of wide-open looks and they missed a lot of wide-open looks, too."
Aaron Gray,"From the tape, I knew I would have to play good defense and avoid foul trouble. That allowed me to make some plays, and I was just able to come out and have a really good performance."
Aaron Gray,They definitely wanted to control it a little more. It was a little weird that our three top players had two fouls in the first half and they didn't have any of their top players in foul trouble.
Aaron Gray,"We definitely feel like we control our own destiny, but at the same time, we don't feel there are any easy games that we have left. We still have a lot of good teams left to play, but we definitely feel like we're good enough to get through it."
Aaron Gray,We're steps ahead of last year. We're playing more like a team. We have confidence in each other.
Aaron Gray,"That's when I play my best, against the best competition. Sometimes my problem is playing against guys who don't have much of a post presence. It will be a great challenge. I'm looking forward to it."
