author,quote
John Harvey Kellogg,"Then, after I came home from Europe, I found I was under condemnation; and I was condemned at that time because I did not endorse the financial policy of the General Conference."
John Harvey Kellogg,Now there are a whole lot of things that in my busy life I have not had time to study into all the details so that I can define my belief.
John Harvey Kellogg,"Is God a man with two arms and legs like me? Does He have eyes, a head? Does He have bowels? Well I do, and that makes me more wonderful than He is!"
John Harvey Kellogg,"I was about four years old when I came to Battle Creek, and there was no organized church at that time - simply a small company."
John Harvey Kellogg,I think I am the oldest member and have been in good standing longer than any other member of this church.
John Harvey Kellogg,"I don't want you to misunderstand me. You might get up and state what you believe to be Seventh-day Adventism, and I might not agree with everything you said."
John Harvey Kellogg,I believe the Sabbath; I keep the Sabbath.
John Harvey Kellogg,I believe that the end of things man-made cannot be very far away - must be near at hand.
John Harvey Kellogg,"I believe just what I have believed for the last forty years, and I am standing by everything I have stood by. I have not changed."
John Harvey Kellogg,"I am, I think the only surviving member of the original Battle Creek church. The church was disbanded, with the exception of thirteen members, in 1870."
John Harvey Kellogg,"Do you know, that is the root of the whole trouble - has been one of the roots at any rate - is people hearing things and then imagining some more and magnifying it and multiplying it."
John Harvey Kellogg,"But sometimes in the midst of worry, anxiety and hard work, it has been pretty hard to bear all these false reports going about the country - to see my friends alienated and being made to believe things that were absolutely false."
John Harvey Kellogg,"Brother Jones is not my product, and I am not responsible for anything he writes or says."
John Harvey Kellogg,A dead cow or sheep lying in a pasture is recognized as carrion. The same sort of a carcass dressed and hung up in a butcher's stall passes as food.
John Harvey Kellogg,"Irritation of the spinal cord, with its resultant evils, is one of the most common of the nervous affections originating in this cause."
Brian Kelly,This is the culmination of a lot of people's vision. I think this is just another step towards making Central Michigan football among the elite programs in the Mid-American Conference.
Brian Kelly,All the bands are here to support a worthwhile cause.
Brian Kelly,"They still have Daunte Culpepper. He didn't lose any strength in his arm, and he is still a big-time passer."
Brian Kelly,He didn't lose any strength in his arm. They have a lot of guys that can make big plays over there on offense.
Brian Kelly,He didn't lose any strength in his arm. They have a lot of guys that can make big plays over there on offence.
Brian Kelly,Doug is talking and is his old self. It seems Doug has rolled the dice again and been very lucky.
Brian Kelly,"I don't regret the fact that I came back and signed a contract [with Tampa Bay] when I signed it because I felt that was my value, at that time,"
Brian Kelly,We have made real progress. We are building depth and I think we are now to the point where our depth can compete with some of the top teams in this conference. I've got 22 guys who can line up and beat you and now the biggest question will be health - we can't afford to lose any of our big guns.
Brian Kelly,We have to be prepared for them to use all their weapons. This is an opportunity for them to look at all their kids and find out what direction they want to go with their offense heading into their Big Ten schedule.
Brian Kelly,"We came with all 11 men, our Desperado package. We went all out after the kick. It was indicative of our effort for the entire game."
Brian Kelly,"It will be a great honor for me to play against Joe Paterno, (but) we would like to win the game."
Brian Kelly,"We came here with a chip on our shoulder today. With the things that went on back home this week and the way we were perceived... we wanted to show the country that in no way, shape, or form could we not win this football game."
Brian Kelly,"The North Bay is a very prosperous region, and deposit growth is very strong here. This is no secret, and for this reason there will always be a steady flow of startup banks that fill the much-needed role of community banker."
Brian Kelly,"We'll probably be an underdog for the first eight games,"
Brian Kelly,"Hey, (PSU) has a heck of a football team. But I'm very disappointed in the way we played. We were ready and excited for this opportunity and we failed to take advantage of it."
Brian Kelly,"We came in here with the idea that we wanted to make it known that Central Michigan football is a program to pay attention to, ... We came in here with a chip on our shoulder, because of all of the off-the-field distractions."
Brian Kelly,We were going to run the football. We knew it. They knew it. Everybody knew it.
Brian Kelly,"I have a great deal of faith and trust in our judicial system. These young men will be given the opportunity to have a fair trial... However, as student-athletes, they are held to a higher level, and will remain suspended until further information becomes available."
Brian Kelly,"I have a great deal of faith and trust in our judicial system. These young men will be given the opportunity to have a fair trial, and because of our system of justice, are innocent until proven guilty. However, as student-athletes, they are held to a higher level, and will remain suspended until further information becomes available."
Brian Kelly,We're excited about Charley joining our staff. He brings a great deal of experience in the MAC and specifically within the passing game. He is a well-respected individual in the coaching profession and has a bright and innovative mind.
Brian Kelly,"Absolutely, without a doubt, ... What we do out there and what we've been doing for the last couple of years, you can look at other tandems and try to compare their numbers to ours. I think our numbers are better and just the performance that we bring to the team. I definitely think we're the best tandem."
Brian Kelly,The good signs were on defense. We did some things on defense that we can build on. We feel the defense can make an impact now where in the past we didn't feel that way.
Brian Kelly,I consider Kelly/Shorts to be a premier stadium of its size in the country. It's definitely part of the vision we had for our program.
Brian Kelly,"It's a matter of being at the right place at the right time and having the right conversation. There were a number of Big 12 teams that were in the mix there. Ontario was a late qualifier, academically. And we stood by him. Four days prior to our Indiana game he had not been certified by the NCAA, so sometimes you have to hang in there with a young man and build that trust, and we built that trust with him, and he rewarded us with some great play here and ultimately signing with us."
Brian Kelly,We're in control. It's always good to have some control over things this time of year.
Brian Kelly,It's a nice swagger we have right now. There's a lot of confidence in this locker room.
Brian Kelly,"(Miami) has tradition, a level of confidence where each and every week they believe they're going to win, and they're very talented, ... Add great speed and athleticism to an Indiana team, is the way I look at it. I'd rather be playing Indiana again, quite frankly. We think that much of Miami."
Brian Kelly,I thank all three of them for their commitment and loyalty to the Central Michigan University football program. I wish them the best in their future endeavors.
Brian Kelly,"We had to overcome the adversity of having two coaches leave during the recruiting process, so everybody on the staff had to pick up the slack. We had a lot of coaches in areas that are not normal for them, but I thought the commitment of our staff throughout the process was outstanding."
Brian Kelly,"It further damages the state's ability to attract and retain job creators, because it is essentially a tax on small businesses."
Chris Kelly,"We also have an information page on our member services section talking about security issues, ... We are working on the next generation of offerings that will include firewall product recommendations."
Chris Kelly,We also have an information page on our member services section talking about security issues. We are working on the next generation of offerings that will include firewall product recommendations.
Chris Kelly,"That does not in any way deter our intent or efforts to reach a consensual agreement. We are negotiating now, and we have a mutually agreed upon process to help facilitate reaching an agreement if we are unable to do so by the end of the month."
Chris Kelly,It is a fantastic achievement for Mark to have been given this opportunity. I have no doubt that he will fulfil his new role expertly and we wish him the best of luck. We have some highly qualified umpires to replace Mark ... all of whom have plenty of experience and expertise in the field.
Craig Kelly,"So I've been pushed farther and farther out into the mountains, but at the same time realizing that that experience is really nice and I'm glad I'm getting pushed out there farther."
Craig Kelly,Oakley and Burton have been my main sponsors since '87. I've been riding for both of them.
Craig Kelly,"My experience and what I do in snowboarding is really quite independent of the industry and the more independent it is, the more pure and better I feel about snowboarding."
Craig Kelly,"I've always been into powder, that's what I like riding, and now you've got to go farther to get it."
Craig Kelly,I suffer every moment of every day that I am not with my son. All I want is to be reunited with my son.
Craig Kelly,"I don't ride ski areas all that much, and I don't do contests and I don't go in snowboard shops and I rarely read the snowboard magazines."
Craig Kelly,I didn't really get that into backcountry riding until about eight or 10 years ago and the main reason for it is the ski areas are more crowded.
Craig Kelly,"For Oakley, I'm basically a media vehicle for them to promote the product. For me, it's both, I get a salary from them, but I also get great products so it just kind of works, continues on."
Dan Kelly,"We have no choice but to pick up what the state has refused to fund,"
Dan Kelly,It's been a goal of ours to have a multiple state champion. Glad it happened with him. He's never missed a match. He's never been hurt in four years. He's Mr. Dependable.
Dan Kelly,"These were modest changes. We should have closed more. For all that anxiety, all that stress, all that anger - this is all we saved."
Dan Kelly,"I think it's the rich getting richer, ... They're taking advantage of a bad situation and punishing our wallets."
Dan Kelly,Most fire departments are not very familiar with propane accidents because they happen very infrequently.
Dennis Kelly,"We are committed to, at a minimum, honoring the agreement we have. If we don't negotiate an agreement that's much more sustainable from our perspective, then we'll choose to not continue the exhibit and study pandas."
Dennis Kelly,The large turnout and strong vote reflects the deep frustration that educators feel over not having a contract for nearly two years.
Dennis Kelly,The Zoo Atlanta family is elated at the news of twin gorilla babies. We are proud to do our part to support a species that is experiencing such catastrophic decline in the wild.
Dennis Kelly,"It's crazy. These bears, year-round, are some of the most pampered animals on the planet. We measure everything that goes in. We measure everything that goes out."
Gary Kelly,"We've been concerned about the costs in the past, but they've done a remarkable job in bringing costs down, ... It's now a highly regarded, very efficient airport."
Gary Kelly,"There's a very large opportunity in Denver,"
Gary Kelly,We are unaware of any other International Singles Golf Tournament ever having been held. We have aggressively searched the Internet and not found a single reference to this sort of event. We thought it would be a real value added service to offer our members and other single golfers something that has never been done before.
Gary Kelly,Baby boomers find dating online is the most efficient way.
Gary Kelly,"I think you can push fares only so far, and there'll be a negative effect and a backlash by customers."
Gary Kelly,It's a very exciting opportunity for one of the fastest-growing areas of the country.
Gary Kelly,"You say, 'Is it getting crowded?' but this is a big country. There's bound to be some competition in the future, but right now there's relatively little overlap."
Gary Kelly,"We realized two things. Golf is a male-dominated sport, and the fastest growing age group online is those who are 40-plus, especially women. It seemed a natural match."
Gary Kelly,Mike and I believe our ultimate success lies in our ability to attract women 45-55.
Gene Kelly,I wanted to invent some kind of American dance that was danced to the music that I grew up on: Cole Porter and Rodgers and Hart and Irving Berlin. So I evolved a style that certainly didn't catch on right away - but I had some good mentors in New York who encouraged me.
Gene Kelly,I got started dancing because I knew it was one way to meet girls
Gene Kelly,"My mother had gotten a job as a receptionist at a dancing school and had the idea that we should open our own dancing school; we did, and it prospered."
Gene Kelly,On the one hand there is definitely rage and anger for the drunken driver of the car mixed with overwhelming sadness for the survivors.
Grace Kelly,The freedom of the press works in such a way that there is not much freedom from it.
Grace Kelly,Hollywood amuses me. Holier-than-thou for the public and unholier-than-the-devil in reality
Grace Kelly,Emancipation of women has made them lose their mystery.
Grace Kelly,Women's natural role is to be a pillar of the family.
James Kelly,"Eileen is fantastic. She has gone through this on ... every one of her missions, being one of the first women to do so many things."
James Kelly,the first step on the road home to the Kennedy Space Center .
James Kelly,"Traumatic brain injury is a public-health epidemic,"
James Kelly,the tough decisions.
James Kelly,It really hasn't been about the money. It's been about positioning our company for the future and giving us the currency for acquisitions.
James Kelly,"We view management's long-term guidance of double-digit EPS growth through 2010 as laudable from a company morale and motivation standpoint, but difficult to achieve from an investor's perspective."
James Kelly,"We think the pension issue is very important for both our people and the future of our company, but as I said, there is no one or two single issues that will determine whether or not we're able to reach agreement."
James Kelly,"It's hurt us. Hurt our employees. And it's hurt our customers. We have lost business. We've had customers who have told us they will not be back. We're gonna work as hard as we can to get every customer back,"
James Kelly,There is a false notion in this town that America loses in any such discussion.
James Kelly,"Reality is that direct contact may be helpful, or they may be neutral. Awkward absence (of contact) undercuts support among Asians and provides a handy excuse for North Korea to delay."
Jim Kelly,"I've been told he has the tools, the talent and the skills."
Jim Kelly,"If we have 800 parents withhold tuition payments that's $500,000 that they won't be getting. If we withhold the June 1 one also, it will be a total of $1 million. We would like to see how they respond to that."
Jim Kelly,"[One letter writer said Hunter may turn out to be the most famous Kelly, even more so than his father, the Hall of Fame quarterback.] I hope he is, ... God, I hope he is."
Jim Kelly,This is our life commitment.
Jim Kelly,"It was a tough loss. But there's a lot of baseball to be played, and they've got a bunch of games to make up."
Kevin Kelly,"Everybody was telling me to stay relaxed, stay focused, don't worry about the first or second one, eventually you are going to get a third one. I was upset after I missed the first one, but I was upbeat after I missed the second one because I figured what are the chances of missing three in a row."
Kevin Kelly,"This year, Mardi Gras is a shadow of its former self, because its only 1/3rd of the city back, the rest of us are spread around the country such as myself. So it's good that they got together and held the celebration because it's a holiday, although it's not respected nationally, but like I said it's a shadow of its former self."
Kevin Kelly,"We had some roof damage in three warehouses, but moved the nearby coffee to dry areas in those buildings. We have no odors, no unusual humidity or toxicology problems, and suffered no losses in our seven coffee warehouses."
Kevin Kelly,All imaginable futures are not equally possible.
Marjorie Kelly,"Most companies today are probably oriented toward legal compliance - gotta obey the rules. Then there are others who say, 'We need to adopt ethical values in the core of how we manage this company.' The best firms are doing that."
Marjorie Kelly,Those that perform to a higher standard in serving a variety of stakeholders with excellence and integrity.
Marjorie Kelly,"What distinguishes the 100 Best Corporate Citizens from their peers is a commitment to higher standards,"
Mike Kelly,Any team can win it. Kingsley and Lake City are two quality teams. I wouldn't be surprised if that goes five games.
Mike Kelly,"We're not here to prepare students for specific jobs. No. 1, because those jobs may change too fast. Our goal is to prepare kids to be great thinkers and have a great set of core base knowledge so they can go forward."
Mike Kelly,"Golf balls and endorsements go hand and hand, when they perform you get various blips in perception and sales."
Mike Kelly,We have two problems what to do with these particular parcels of land and .Â .Â . how to prevent a similar (failure) in the future.
Mike Kelly,"This partnership between all the agencies, with everybody pulling in the same direction at the same time has really helped."
Patsy Kelly,Estelle Winwood is not Tallulah's best friend! I am! And I've got the scars to prove it!
Patsy Kelly,"In 40-odd years in show business, some years I could do no wrong, and some years I could do nothing right. Show business. I owe it everything - it owes me nothing."
Patsy Kelly,"I'll be a flop in movies. Besides, I don't like 'em, and I never did believe there was a place called Hollywood. Somebody made it up!"
Scott Kelly,... No rain is in the forecast for the rest of the week. This means that ground conditions will become even drier.
Scott Kelly,Air quality will be a little bit lower than usual for Brevard. We're going to get a sea breeze that will mix things up.
Scott Kelly,"Integrative medicine means therapies that integrate body, mind and spirit. This gives patients the best of both worlds, developing a treatment plan that includes the patients? primary care physician."
Scott Kelly,This isn't a quick fad like Beanie Babies -- PokÃ©mon has legs.
Scott Kelly,"LovelyBySurprise.com and TheNeverything.com are each designed for a distinct audience that shares an important element with the other: a mindset that looks to the Web as a place to work, shop, and play. We think people will be intrigued by the characters in the stories, and return every week to learn more -- ideally clicking through to learn more about our great new Lincoln and Mercury products."
Scott Kelly,We notice there tend to be more accidents when there are patchy dense spots.
Tim Kelly,"I certainly can appreciate the out-and-back course and how it saves on manpower. The race is always well organized and I give a lot of credit to the race directors. That said, I would have to rate the original course as my favorite, though I really appreciated the flat courses on years I didn't train much."
Tim Kelly,"Warren is still 20 percent undeveloped, but the township is buying up the land more quickly than we can sell it to people who want to develop it."
Tim Kelly,This will probably be the biggest fundraiser in local history. It's one of those really remarkable things where everyone comes together.
Tim Kelly,Jenna was ice tonight. She's a real hard-nosed kid. When she steps to the line she does it with a lot of confidence.
Tom Kelly,The prime minister believes in free trade.
Tom Kelly,In general terms it will come up. But the detailed negotiations are for the commission. We fully support the commission and the commissioner in trying to sort this out.
Tom Kelly,In music that's how they refer to it. I didn't know anything about it and I'm sure the people that approved the ad didn't.
Tom Kelly,It is entirely a matter for the media organizations to decide what they want to do within the law. It is for people to reach their own judgments.
Tom Kelly,"This is understanding a complex situation and applying your knowledge to it. Moving from not just what you know, but what you can actually do -- that's broadening the application of e-learning."
Tom Kelly,"He made my life a joy. I was just fortunate to come along at the same time he did. Let's be honest. I rode the coattails and a lot of coaches did and fans did, and a whole bunch of people got on board and rode that train right with him, and he was driving."
Tom Kelly,"It's a health and safety issue, and that's why it's there."
Tom Kelly,"I did what I could for 17 years for the Fire Department. It got me into this trouble. They don't want me anymore, and under these conditions, it stinks."
Tom Kelly,"Some parents and local snowboarding organizations came to us for help. They wanted to know how to organize events and get TV coverage, which is what we do."
Tom Kelly,Our Rotary Mardi Gras was voted the Best of Yuma entertainment for the past several years.
Tom Kelly,"Engineering this technology for tractors is more straightforward. But as a leader in the heavy-duty vocational truck market, we're committed to getting this technology in the hands of mixer and dump customers as soon as possible. We targeted mixers initially per customer demand. But we're working very hard with our partner Bendix on other vocational applications as well, to make the technology available across the board in the very near future."
Tom Kelly,"With the industry trend shifting to more automatic transmissions, particularly in heavy-duty mixer and dump applications, we saw the opportunity to partner with Allison in their EDGE Program as an effective way to take full advantage of this trend and, more importantly, to offer our customers a greater overall value."
Tom Kelly,"The doctors said that if he has good luck, he'll be all right. You have to keep the faith."
Tom Kelly,Nuclear energy has got to be part of that debate. The prime minister sees this as a priority and as an issue he is pursuing.
Tom Kelly,"It took a big leap of courage to bring Antonio in. I give (Carp) a lot of credit for doing that. In Antonio, he had someone with experience in successfully building digital imaging businesses."
Tom Kelly,Tough day. The Minnesota Twins and major league baseball ask fans to keep Kirby and his family in their thoughts and prayers.
Tom Kelly,"Cabinet started with the Prime Minister expressing on behalf of the government his deep appreciation and admiration for the outstanding courage and professionalism for all those involved in the operation, military and civilian."
Susette Kelo,"The wolves are at our door and we are asking for support. Really, that's clearly what it is. The wolves are at our door,"
Susette Kelo,"The wolves are at our door and we're asking for support, really. And that's clearly what it is. The wolves are at our door."
Susette Kelo,"This battle against eminent domain abuse may have started as a way for me to save my little, pink cottage, but it has rightfully grown into something much larger  the fight to restore the American Dream and the sacredness and security of each one of our homes."
Susette Kelo,What is happening to me should not happen to anyone. Congress and state legislatures need to send a message to local governments that this kind of abuse of power will not be funded or tolerated.
Jack Kemp,"There is a kind of victory in good work, no matter how humble."
Jack Kemp,"There's no way you can compare a modest contribution from a so-called Hong Kong businessman with China trying to influence U.S. foreign policy and the sale of the Lincoln Bedroom in the White House,"
Jack Kemp,"He gave the same old speech at 100 miles an hour and got a hard lesson in how far the base has moved away from that,"
Jack Kemp,"anxious to talk about race and related issues, but you can't have a dialogue on race behind closed doors."
Jack Kemp,"When people lack jobs, opportunity, and ownership of property they have little or no stake in their communities"
Jack Kemp,"[Supply-siders have two horses to pick from: Steve Forbes and Jack Kemp.] The supply-side claim is not a claim, ... It is empirically true and historically convincing that with lower rates of taxation on labor and capital, the factors of production, you'll get a bigger economy."
Jack Kemp,"Bob, you have to win. I believe with all my heart that you are the right man for the job."
Jack Kemp,The federal government is the only one that can provide immediate assistance.
Jack Kemp,There are no limits to our future if we don't put limits on our people.
