author,quote
Li Ka-Shing,"I don't think Husky is for sale; it's doing well, the potential is great and its production will increase before the end of this year."
Li Ka-Shing,"Information and communications technology unlocks the value of time, allowing and enabling multi-tasking, multi-channels, multi-this and multi-that."
Li Ka-Shing,"Vision is perhaps our greatest strength... it has kept us alive to the power and continuity of thought through the centuries, it makes us peer into the future and lends shape to the unknown."
Li Ka-Shing,"The future may be made up of many factors but where it truly lies is in the hearts and minds of men. Your dedication should not be confined for your own gain, but unleashes your passion for our beloved country as well as for the integrity and humanity of mankind."
Li Ka-Shing,"We are approaching a new age of synthesis. Knowledge cannot be merely a degree or a skill... it demands a broader vision, capabilities in critical thinking and logical deduction without which we cannot have constructive progress."
Marwan Kabalan,"If you hand over these people, you would contribute to undermining the regime. The Syrian government might think that sanctions are a better alternative at the end of the day."
Marwan Kabalan,"Nobody listens, nobody reads. You have a very small circle of decision-makers in charge of decisions in the country. What do you expect?"
Marwan Kabalan,"Syria can't be important unless it plays its regional cards. This country is not wealthy and it doesn't have enough oil to be influential. We are playing the role of a bad student at school. If you don't make trouble, no one will pay attention to you."
Kabir,"plunge into the truth, find out who the Teacher is,Believe in the Great Sound!"
Kabir,"plunge into the truth, find out who the Teacher is,Believe in the Great Sound!"
Kabir,The stone neither speaks nor gives anything. Therefore its service is fruitless and its worship is of no avail.
Kabir,"Don't open your diamonds in a vegetable market. Tie them in bundle and keep them in your heart, and go your own way."
Kabir,"If you make love with the divine now, in the next lifeyou will have the face of satisfied desire."
Kabir,"If you make love with the divine now, in the next lifeyou will have the face of satisfied desire."
Kabir,"When affection for the I-creature and what it owns is dead,then the work of the Teacher is over."
Kabir,Do you believe there is some place that will make thesoul less thirsty?In that great absence you will find nothing.
Kabir,Do you believe there is some place that will make thesoul less thirsty?In that great absence you will find nothing.
Jaroslaw Kaczynski,I hope we will manage to create a coalition. I have reasons to believe this is a realistic perspective.
Jaroslaw Kaczynski,I'm convinced this will allow us to slowly build a majority in parliament and allow backing for the government until 2009.
Jaroslaw Kaczynski,"In our relations with Russia you need to be patient and avoid provocations, but if events like the recent ones take place, you have to tell the truth -- cowardice is only an encouragement."
Jaroslaw Kaczynski,We will submit this motion (to dissolve parliament) shortly so that elections could take place before the Pope's visit to Poland (on May 25-28).
Jaroslaw Kaczynski,Russia needs to accept that Poland is an independent player in this part of Europe and no doubt this will be a long and difficult process.
Jaroslaw Kaczynski,"This was the first conversation, we will hold further meetings."
Jaroslaw Kaczynski,"We have won. Everything indicates that we have won, but this is only the beginning."
Jaroslaw Kaczynski,"We just signed an agreement that I am deeply certain will lead to the creation of a lasting majority in parliament, which will rule until (the term ends) in 2009."
Pauline Kael,"The words Kiss Kiss Bang Bang which I saw on an Italian movie poster, are perhaps the briefest statement imaginable of the basic appeal of movies"
Pauline Kael,"Watching old movies is like spending an evening with those people next door. They bore us, and we wouldn't go out of our way to see them; we drop in on them because they're so close. If it took some effort to see old movies, we might try to find out which were the good ones, and if people saw only the good ones maybe they would still respect old movies. As it is, people sit and watch movies that audiences walked out on thirty years ago. Like Lot's wife, we are tempted to take another look, attracted not by evil but by something that seems much more shameful -- our own innocence."
Pauline Kael,"Brando represented a reaction against the postwar mania for security. As a protagonist, the Brando of the early 50's had no code, only his instincts. He was a development from the gangster and the outlaw."
Pauline Kael,Just about the best Hollywood musical of all time.
Pauline Kael,"In this country we encourage creativity among the mediocre, but real bursting creativity appalls us. We put it down as undisciplined, as somehow too much."
Pauline Kael,A book might be written on the injustice of the just.
Pauline Kael,Trash has given us an appetite for art
Pauline Kael,Trash has given us an appetite for art.
Pauline Kael,The first prerogative of an artist in any medium is to make a fool of himself.
Pauline Kael,Movies are so rarely great art that if we cannot appreciate great trash we have very little reason to be interested in them.
Pauline Kael,"A mistake in judgment isn't fatal, but too much anxiety about judgment is."
Pauline Kael,"It seems likely that many of the young who don't wait for others to call them artists, but simply announce that they are, don't have the patience to make art."
Pauline Kael,"In the arts, the critic is the only independent source of information. The rest is advertising."
Pauline Kael,The critic is the only independent source of information. The rest is advertising.
Pauline Kael,Kevin Costner has feathers in his hair and feathers in his head. The Indians should have called him 'Plays with Camera.'
Pauline Kael,This movie is a toupee made up to look like honest baldness.
Pauline Kael,"I see little of more importance to the future of our country and of civilization than full recognition of the place of the artist. If art is to nourish the roots of our culture, society must set the artist free to follow his vision wherever it takes him."
Pauline Kael,One of the surest signs of the Philistine is his reverence for the superior tastes of those who put him down.
Pauline Kael,"Where there is a will, there is a way. If there is a chance in a million that you can do something, anything, to keep what you want from ending, do it. Pry the door open or, if need be, wedge your foot in that door and keep it open."
Pauline Kael,Citizen Kane is perhaps the one American talking picture that seems as fresh now as the day it opened. It may seem even fresher.
Kato Kaelin,"Thoughts would go in and out of my mind, but I didn't want to believe that he could have done it."
Kato Kaelin,"The circumstance is the incredible part, but I always knew in my heart that something was going to be out there, just for the world to notice me. It sounds so cocky, but it's happening."
Kato Kaelin,"Sometimes people who get wealthy when they are very, very young, it's a curse to them. They don't realize it."
Kato Kaelin,Sometimes people just want you to fail. Except your really good friends. I've always known who my best friends were.
Kato Kaelin,"People should realize that I shot a Coke commercial back in 1986. So, you know, I've been around a long time. I carry my Screen Actors Guild Card."
Kato Kaelin,Never live with someone that won the Heisman.
Kato Kaelin,It's incredible when I'm out in these towns. I have people telling me they were waiting for hours just to meet me and get my autograph. I feel so guilty. I always feel like I have to give them more than just Kato Kaelin.
Kato Kaelin,"If there's something that you hear on TV about me, just call me and I'll tell you if it's true."
Kato Kaelin,"I'm the guy, I'm kind of like the, uh, Everyman, so I think people just relate to that."
Kato Kaelin,"I'm not going to just fade out, I know."
Kato Kaelin,I'm not afraid of O.J. now.
Kato Kaelin,I'm doing comedy development at National Lampoon.
Kato Kaelin,"I was never OJ's closest pal, and the media would say that over and over, but I wasn't his enemy either."
Kato Kaelin,I was at an acting academy for seven years prior to the trial.
Kato Kaelin,I want people to realize that the domestic abuse charges happened in 1989. I didn't meet any of them until 1993.
Kato Kaelin,"I thought it was possible that O.J. could have done something. It crossed my mind. I was thinking about the events of everything and going, Why did I hear that? I was going, No, it can't be, and just all that stuff was adding up."
Kato Kaelin,I think the prosecution had all the evidence in front of them to have won the case.
Kato Kaelin,I think that money is the root of all evil. I've seen it happen.
Kato Kaelin,I have contact with no one involved in the trial.
Kato Kaelin,I ended up living at OJ's because Nicole bought a home that no longer had a guest house. OJ offered his guest house to me. Anybody in LA looking for a place knows the best places to live are guest houses.
Kato Kaelin,"I don't want to be Kato, the trial guy. It's like everything I do is under a microscope."
Kato Kaelin,I believe in my heart Simpson is guilty.
Kato Kaelin,"At the time that I knew them, they were not living together. They began dating again after their divorce, so I didn't really see fighting."
Kato Kaelin,"It's a show where I go across America, I knock on doors of the unsuspecting and invite myself in to spend a weekend with the family,"
Franz Kafka,"In science one tries to tell people, in such a way as to be understood by everyone, something that no one ever knew before. But in poetry, it's the exact opposite."
Franz Kafka,Now I can look at you in peace; I don't eat you anymore
Franz Kafka,"All human errors are impatience, a premature breaking off of methodical procedure, an apparent fencing-in of what is apparently at issue."
Franz Kafka,"In the fight between you and the world, back the world."
Franz Kafka,"I can prove at any time that my education tried to make another person out of me than the one I became. It is for the harm, therefore, that my educators could have done me in accordance with their intentions that I reproach them; I demand from their hands the person I now am, and since they cannot give him to me, I make of my reproach and laughter a drumbeat sounding in the world beyond."
Franz Kafka,"Don't despair, not even over the fact that you don't despair"
Franz Kafka,"From the true antagonist, illimitable courage is transmitted to you"
Franz Kafka,"Who has the gift to recognize beauty, will not live long"
Franz Kafka,Evil is whatever distracts.
Franz Kafka,Anyone who keeps the ability to see beauty never grows old.
Franz Kafka,"In theory there is a possibility of perfect happiness: To believe in the indestructible element within one, and not to strive towards it."
Franz Kafka,"In argument similes are like songs in love; they describe much, but prove nothing."
Franz Kafka,I do not read advertisements - I would spend all my time wanting things
Franz Kafka,"God gives the nuts, but he does not crack them."
Franz Kafka,Start with what is right rather than what is acceptable.
Franz Kafka,"So long as you have food in your mouth, you have solved all questions for the time being."
Paul Kagame,"We cannot turn the clock back nor can we undo the harm caused, but we have the power to determine the future and to ensure that what happened never happens again."
Paul Kagame,There are some who are scared by unity and by building a country on the basis of ideas.
Paul Kagame,I firmly believe that these two issues ... constitute the ultimate solution to the conflict. We are more than willing to resolve this issue once and for all.
Paul Kagame,Let no one think that flexibility and a predisposition to compromise is a sign of weakness or a sell-out.
Andy Kahan,"The rest of their lives, they're pegged and targeted."
Andy Kahan,"I think that's a big difference. If the ones in the program aren't coming back to society, what's the purpose? If you're going to do it, do it for the ones that are coming out."
Andy Kahan,"You're asking the most cunning, secretive and diabolical type of felon to be part of the honor system. It's always been befuddling to me."
Andy Kahan,"There is no authority, there is no certain agency that monitors these types of offenders."
Andy Kahan,I certainly would endorse and support any legislation that would give those types of offenders the ability to appeal their registration process.
Brewster Kahle,"If a band posts restrictions as to what materials can be put on the archive, there is a self-appointed sense of making sure the that the band's wishes are observed,"
Brewster Kahle,"More and more people are expecting access, and they are making do with what they can get easy access to. Let's make it so that they find great works rather than whatever just happens to be on the [Internet]."
Brewster Kahle,"The opportunity before all of us is living up to the dream of the Library of Alexandria and then taking it a step further -- universal access to all knowledge. Interestingly, it is now technically doable,"
Brewster Kahle,"The opportunity before all of us is living up to the dream of the Library of Alexandria and then taking it a step further -- universal access to all knowledge. Interestingly, it is now technically doable."
Brewster Kahle,"If we go and bring universal access to all human knowledge it will be remembered as one of the great things humankind has ever done,"
Brewster Kahle,"Social networks, search engines and things yet invented are critical as we bring millions of movies, books and musical recordings online."
Brewster Kahle,Other projects talk about snippets. We don't talk about snippets. We talk about books.
Alfred Kahn,"It's like saying, 'We've got 95 percent of the benefits of deregulation -- why bother going for the rest?'"
Alfred Kahn,It turned out that their problems were far more fundamental (than September 11).
Alfred Kahn,"We are very excited about partnering with Microsoft to share the 'Viva Piâ€“ata' universe with the world. The potent combination of the Microsoft Game Studios and 4Kids will ensure that the 'Viva Piâ€“ata' world, including the video game, television series and merchandising program, attracts a worldwide audience."
Alfred Kahn,The increasing status of Xbox 360 as the premiere next generation digital gaming and entertainment system makes this the perfect time to introduce a carefully orchestrated licensing program that expands the Xbox brand.
Alfred Kahn,"We have built an impressive roster of captivating and successful children's entertainment properties. Given the increased number of brands that we are representing that focus on an older audience, we felt it would be beneficial to organize a new subsidiary primarily devoted to the marketing and licensing of these brands. We believe that we can successfully utilize our marketing and licensing expertise to build brand value for properties targeting an older consumer that are not necessarily media or character driven."
Alfred Kahn,"Nobody could fly an airplane commercially on any route without specific permission from the Civil Aeronautics Board, and price competition, cutting prices, was illegal."
Oliver Kahn,"We are Bayern Munich and English teams always have trouble as soon as they leave the island,"
Oliver Kahn,I'll have to do everything I can to make sure that I can take the pitch pain-free.
Oliver Kahn,"We are a really good group now, we were unlucky not to score against Latvia and we'll get luck on our side too,"
Oliver Kahn,"We played well, but we had a little bit of luck today. We can't take our lead over Bremen too seriously -- these things change fast in football."
Oliver Kahn,"We lacked determination and we weren't completely in the game,"
Oliver Kahn,"Bremen are really playing well at the moment, despite the defeat to Lyon, ... They are making a very strong impression on me and we are really going to have to be at our best next week."
Oliver Kahn,Perhaps this defeat will make us more aggressive and we will react by turning in a fantastic display in Milan.
Oliver Kahn,Maybe this defeat will make us aggressive and lead us to such a reaction that we can produce a great game in Milan.
Oliver Kahn,"I have a contract until 2006 which I would like to fulfil but certain circumstances occur again and again and we have reached a solution (with Bayern),"
Oliver Kahn,"To think that this might be to our advantage would be the dumbest things to do, ... It may be a bluff, anyway."
Richard Kahn,The combination of risk factors doesn't add up to a more significant or higher cardiovascular risk than the individual components.
Richard Kahn,"The combination of risk factors doesn't add up to a more significant or higher cardiovascular risk than the individual components,"
Richard Kahn,We greatly support the idea of helping people with diabetes better manage their disease. We also are concerned with information about a person's individual medical condition becoming publicly known.
Kasey Kahne,This is a great victory. The guys did an awesome job. They gave me the best car out there. I've always loved coming to Texas and racing in front of hundreds of thousands of fans out there. It's one of the best places we go all season long. ... This is awesome.
Kasey Kahne,"I really don't regret it at all,"
Kasey Kahne,The car was perfect through the entire race.
Kasey Kahne,"This is behind us now. As a team, our focus is on the upcoming events and the future."
Kasey Kahne,These are definitely the hardest cars I've driven -- ever.
Abdul Kalam,The product being internationally competitive it is able to service a large market with availability in time and state of the art performance at reduced costs per unit.
Abdul Kalam,Science leads to development of technologies. Availability of technologies leads to products.
Abdul Kalam,not to allow problems to rule you.
Abdul Kalam,"Nuclear power generation has been given a thrust by the use of uranium-based fuel [which US is set to supply to India if the deal comes through]. However, there would be a requirement for ten-fold increase in nuclear power generation even to attain a reasonable degree of energy self-sufficiency for our country."
Abdul Kalam,There are forces in life working for you and against you. One must distinguish the beneficial forces from the malevolent ones and choose correctly between them.
Abdul Kalam,"You have done a wonderful job,"
Abdul Kalam,"On behalf of the Government and people of India and on my own behalf, I would like to convey to you and to the people of Pakistan our heartfelt sympathies."
Abdul Kalam,To line only for some unknown future is superficial.
Abdul Kalam,"We need to create brand institutions. In the fortune 500 companies, 5 Indian companies are named while 15 are from China though we have similar kind of populations."
Abdul Kalam,My government is committed towards creating such an environment so that the latent potential of our people can blossom and create a new India of our dreams.
Abdul Kalam,"India must achieve the real goal?that is energy independence or an economy which will function well within total freedom from oil, gas or coal imports."
Abdul Kalam,"The entire country is with you,"
John Kaleo,"I started the game and played about halfway through the game. To get hurt in the 3rd quarter and watch in the 4th quarter was tough, ... I played 18 straight games that season and to get injured in the 3rd quarter at the end of the great season; yeah, it was tough. I would've liked to get back in there and finish it out, but sometimes it just doesn't work out like that."
John Kaleo,"I think Shane is one of the most promising young guns in arena football, ... I think it's just a matter of time before he experiences winning a championship in his career and I don't think he's even reached his full potential yet. He's not young like he used to be, but I think he's just getting in to his best years now and I expect a lot of great things out of Shane Stafford."
John Kaleo,"I'd like to give coaching a try, either in the arena league or at the college level and get into that in some capacity, ... I have some options to consider, I've had a career in real estate outside of football for the past few years so I could always fall back on that."
Al Kaline,You've got to get good habits of working hard so that when that play comes up during the regular season that you're able to complete it and do it the right way.
Al Kaline,What gets me upset about with the newer players is their lack of intensity. They tend to go through the motions a little bit. They don't understand that you've got to practice the way you play.
Al Kaline,Switching to the outfield was the best break I ever got.
Al Kaline,It hurt me a great deal. It put a lot of pressure on me because I was at a young age and the writers around here and throughout the league starting comparing me to Cobb. It put a lot of pressure on me.
Al Kaline,I'll never forget that first night with the team. Going to the ballpark on the bus was the hardest 30 minutes of my life. I had to walk down that aisle between all the players. I really didn't know too much about the Detroit Tigers at that time.
Al Kaline,"I was very, very shocked about Cooperstown. I thought my chances were fairly good, but I tried to stay low key about it, not too high and not too low. That was the way I played, too."
Al Kaline,I started in for the ball but I just couldn't get it. I should have caught it because I was used to catching everything on the sandlots. But they hit the ball a lot harder in the major leagues and I just couldn't reach the ball this time.
Al Kaline,"I didn't know who was on the team, but I saw every eye as I walked down the aisle. It looked like a thousand eyes were staring right at me saying, 'Who is this young punk?' I just kept my eyes straight ahead."
Al Kaline,"As the days went on, I didn't mind the games. In fact, I looked forward to them. That was the easiest part of all. I couldn't wait to get to the ballpark I'd be the first one there and I was willing to do anything. I think that's why the veterans liked me."
Al Kaline,All of a sudden I'm in the major leagues and we're traveling from town to town. I see the other players dressing different every day. I've got only one suit and I keep wearing it over and over. I'm really embarrassed.
Jacques Kallis,We'll have a peaceful night away from the game and we'll decide tomorrow morning what we want to do and what the plan is for the day.
Jacques Kallis,"It's now up to the players to repay the good faith of the selectors and produce the results, even though four months of playing Australia does wear you out and the bodies are tired."
Jacques Kallis,There may be a few nerves before his first over in test cricket but he seems a relaxed sort of guy so hopefully he can put in a big performance. He couldn't ask for a better stage than at the SCG.
Jacques Kallis,It does give the guys a lot of confidence going into the next few Test matches. We know they'll bounce back. The (Perth) wicket was pretty flat.
Jacques Kallis,It has given the guys a lot of confidence.
Jacques Kallis,"It's a difficult place to get in, it takes a few extra balls because of the bounce."
James Kallstrom,"There was no finding that any of those charges were valid. From my knowledge, the two investigations were voluminous and took literally years to complete."
James Kallstrom,"It would probably not be an efficient use of these resources, minus specific information,"
James Kallstrom,This'll be reflective of the times we live in. The consequences of attacking here could have more significance to the terrorists. It has a lot of symbolism. It's going to be extremely well protected.
Kamal,"The four ministerial candidates are gathering more and more support,"
Kamal,"There is no evidence to support this, ... This is just an unlikely assumption. If that were the case, then there would have been gunmen with the suicide bombers. There were no gunmen."
Kamal,"It's part of Test cricket, you can get out on a good first ball or you get out on the 300th delivery,"
Kamal,"As notebook PCs become ubiquitous for computing, entertainment, and communication, the need for improved visual performance and longer battery life become paramount, ... The innovations by BOE HYDIS clearly point to a future where brighter, higher contrast, and wider viewing angle displays are possible while keeping both the cost and power consumption down."
Dean Kamen,"It's up to you to work with them to make it interesting for them to want to pursue engineering. You need to instill the passion for tools and science, as much as they now have for nonsense."
Dean Kamen,"The goal is to create in the culture passion among kids to do something. I think the trouble is our culture does create a passion for kids, but their passion is related to one of two industries: entertainment or sports."
Dean Kamen,"Innovation needs to be nurtured throughout an organization. Management is doing things right, whereas leadership is doing the right things."
Dean Kamen,"I don't know what innovation is, but I can give a guide to rude realities and somewhat serious suggestions about innovation and how to approach it."
Dean Kamen,"One of my biggest fears before we went public was, people would think of this as a toy, ... We think it's much more than that."
Dean Kamen,"We can't live any more in a world which is based on stuff and not ideas. If you want to live with the world of stuff, we're all doomed."
Dean Kamen,"To me, innovations are the wheel, fire, language, movable type. There are not 3 million innovations; there are 3 million inventions."
