author,quote
Soren Kierkegaard,"What our age lacks is not reflection, but passion."
Soren Kierkegaard,Not just in commerce but in the world of ideas too our age is putting on a veritable clearance sale. Everything can be had so dirt cheap that one begins to wonder whether in the end anyone will want to make a bid.
Soren Kierkegaard,During the first period of a man's life the greatest danger is not to take the risk.
Soren Kierkegaard,One can advise comfortably from a safe port.
Soren Kierkegaard,"Adversity draws men together and produces beauty and harmony in life's relationships, just as the cold of winter produces ice-flowers on the window-panes, which vanish with the warmth."
Soren Kierkegaard,Trouble is the common denominator of living. It is the great equalizer.
Soren Kierkegaard,Life can only be understood backwards; but it must be lived forwards.
Soren Kierkegaard,"It seems essential, in relationships and all tasks, that we concentrate only on what is most significant and important."
Krzysztof Kieslowski,"Maybe it is worth investigating the unknown, if only because the very feeling of not knowing is a painful one."
Krzysztof Kieslowski,Interior liberty is universal.
Krzysztof Kieslowski,The films should be influenced by the individual commandments to the same degree that the commandments influence our daily lives
Krzysztof Kieslowski,"The television industry doesn't like to see the compexity of the world. It prefers simple reporting, with simple ideas: this is white, that's black; this is good, that's bad."
Krzysztof Kieslowski,We're always looking at this love through the eyes of the person who is suffering because of this love.
Krzysztof Kieslowski,"In ten phrases, the ten commandments express the essential of life. And these three words-liberty, equality, and fraternity-do just as much. Millions of people have died for those ideals."
Krzysztof Kieslowski,"Do people really want liberty, equality, fraternity? Is it not some manner of speaking?"
Krzysztof Kieslowski,"In believing too much in rationality, our contemporaries have lost something."
Jakaya Kikwete,I will make sure research and development is a top priority in agricultural development.
Jakaya Kikwete,"If we did that we'll go a long way towards poverty alleviation, promoting development and allowing a better life for all, for the people of both countries."
Jakaya Kikwete,We need to conduct a public debate on this issue.
Jakaya Kikwete,My government is going to deal with all forms of corruption. White-collar corruption will be high on the list and we are going to plug all gaps that are being used by corrupt leaders (and) business people.
Craig Kilborn,"They're saying Arnold will get 95% of the vote. At least according to his brother, Jeb Schwarzenegger."
Craig Kilborn,"Arnold Schwarzenegger announced he's running for governor. He's got a great slogan - 'Vote for me, or I'll make 'Kindergarten Cop II'"
Craig Kilborn,"Yesterday Jerry Springer bowed out of the Ohio Senate race. He said, 'If I can't run the most embarrassing campaign in America, then I'm out of here.'"
Craig Kilborn,"Senator Hillary Clinton is attacking President Bush for breaking his campaign promise to cut carbon dioxide emissions, saying a promise made, a promise broken. And then out of habit, she demanded that Bush spend the night on the couch."
Craig Kilborn,A telephone survey says that 51 percent of college students drink until they pass out at least once a month. The other 49 percent didn't answer the phone.
Craig Kilborn,New rumors that Saddam Hussein is planning to flee to a castle in Libya with 10 billion dollars. Now President Bush doesn't know whether to nuke him or give him a tax cut.
Craig Kilborn,"Democrats were quick to point out that President Bush's budget creates a 1 trillion dollar deficit. The White House quickly responded with 'Hey, look over there, it's Saddam Hussein.'"
Craig Kilborn,"In Massachusetts, scientists have created the first human clone. The bad thing is that in thirty years, the clone will still be depressed because the Boston Red Sox will still have not won a World Series."
Craig Kilborn,Did you see the statue topple? Bill Clinton got nostalgic seeing something that big in a beret go down.
Craig Kilborn,"Happy birthday to former First Lady Barbara Bush, who turned seventy-seven this week. Unfortunately, where her granddaughters helped blow out the candles on her cake, it exploded."
Craig Kilborn,George W. Bush even stopped in Pennsylvania to try his hand at the lotto and gave up when he could only think of the numbers 4 and 17.
Jerry Kill,"It is amazing what Allen has done for us this spring, as far as learning our offense. And he is a tremendous athlete -- one of the best on our team."
Jerry Kill,They handed down discipline through the school. It wasn't a major issue. It was more of an administrative issue. I'm glad we don't work that way.
Jerry Kill,"I have kidney cancer. At this point in time, they feel very confident that they got everything. They run tests to make sure it hasn't spread. There has never been an indication from anyone that it has spread."
Harmon Killebrew,"The problems he had were in the outfield. When you first saw him out there, 'How is he ever going to be able to play?' But Tony stayed with it, and became a good outfielder."
Harmon Killebrew,"My father used to play with my brother and me in the yard. Mother would come out and say, You're tearing up the grass; We're not raising grass, Dad would reply. We're raising boys;"
Harmon Killebrew,"I didn't have evil intentions, but I guess I did have power."
Harmon Killebrew,"My father used to play with my brother and me in the yard. Mother would come out and say, You're tearing up the grass; We're not raising grass, Dad would reply. We're raising boys."
Lemmy Kilmister,"One thing I am very glad of is that I went through the sixties. People who didn't really don't know what they missed. We pushed a certain consciousness, a way of life and it was exciting - no AIDS, people weren't dying so much from drug abuse and it was truly a time of freedom and change."
Lemmy Kilmister,"My earliest memory is shouting: at what and for what reason, I don't know. Probably a tantrum; or I may have been rehearsing. I was always an early starter."
Lemmy Kilmister,"My earliest memory is shouting. At what and for what reason, I don't know. Probably a tantrum; or I may have been rehearsing. I was always an early starter."
Lemmy Kilmister,"In my life so far, I have discovered that there are really only two kinds of people: those who are for you, and those who are against you. Learn to recognize them, for they are often and easily mistaken for each other."
Kwame Kilpatrick,"Everybody knew where her house was. Everybody would walk past and point her out, ... She was an amazing individual."
Kwame Kilpatrick,"People got an opportunity to see the lack of depth that he has on any operational or fiscal issue, and that's what I wanted people to see,"
Kwame Kilpatrick,take your souls to the polls and vote. That's the tribute we owe Mother Parks.
Kwame Kilpatrick,"It was a new-school candidate, but it was an old-school campaign, ... We didn't have more money, we had people power."
Kwame Kilpatrick,"Yes, I've made a few mistakes. There's no question about it, ... I am not a perfect man, and there is not a saint running for this office."
Kwame Kilpatrick,"I've been stereotyped my whole life, ... ... It's actually not driven by Detroiters only. It's driven by the media. It's driven by the entire region. The 'us against them,' the 'black and white thing' is getting old."
Kwame Kilpatrick,"And it overshadowed the fact that I have a law degree, that I was leader of the House, that I've written policy, that I'm great at appropriations and grant programs, that I'm able to do things like put together the best emergency operations plan in the country."
Kwame Kilpatrick,"(Former Mayor) Coleman Young said in 1975 that the key to Detroit's future is jobs. In 2005 the key to Detroit's future is still jobs, ... The thing that keeps me up at night is, how do we partner today's kids with tomorrow's jobs?"
Kwame Kilpatrick,"I underestimated the dilapidated, horrific conditions our city was in. ... My biggest failure was not communicating. We have a long way to go, but we've come a mighty long way."
Kwame Kilpatrick,"Jerome is a shining example of what a kid with a dream from Detroit can accomplish with hard work and determination. He has carried his Detroit pride at every level of his career, always looking to give back to the city that gave him so much."
Kwame Kilpatrick,"We made this city better, ... Even in the midst of the worst economy we've seen in 25 years. ... We've continued to move forward."
Kwame Kilpatrick,"We're serious about our mission for the kids of this city, ... this is just the beginning."
Kwame Kilpatrick,"city has a plan, we're focused and ready to put it in action."
Emily Kimbrough,"Remember, we all stumble, every one of us. That's why it's a comfort to go hand in hand."
Emily Kimbrough,That's why it's a comfort to go hand in hand.
Emily Kimbrough,"Remember, we all stumble, every one of us. That's why it's a comfort to go hand-in-hand."
Ralph Kiner,Cadillacs are down at the end of the bat.
Ralph Kiner,All of his saves have come in relief appearances.
Ralph Kiner,"You know what they say about Chicago. If you don't like the weather, wait fifteen minutes."
Ralph Kiner,"If Casey Stengel were alive today, he'd be spinning in his grave."
Ralph Kiner,I think one of the most difficult things for anyone who's played baseball is to accept the fact that maybe the players today are playing just as well as ever.
Ralph Kiner,Darryl Strawberry has been voted to the Hall of Fame five years in a row.
Joe Kines,"I don't know that you enjoy looking at any of this mess. It's fun to look at if you're not involved in it. We just have to find a way to rush the passer, to cover some folks and then find some way to pressure it."
Joe Kines,"He doesn't talk much around anybody. Maybe he does when he's not in the (football) building. What he does say, though, matters. You need to listen when he talks."
Joe Kines,"I thought it was a real solid class. It was a class that met needs. With the package we're playing now (with extra defensive backs), we'll probably load the field with guys who have that kind of ability."
B.B. King,We should be done by September 2006 and won't have a vested interest any longer.
B.B. King,Our passing gave us open looks.
B.B. King,The beautiful thing about learning is nobody can take it away from you.
B.B. King,We all have idols. Play like anyone you care about but try to be yourself while you're doing so.
Ben E. King,"You were able to sing something they related to instantly, because it was part of what you felt. It was part of what you had already traveled through. It's part of the people you were associating with daily. It was all of that."
Ben E. King,"You do your show, gather up your little equipment and we get on the bus. You have your little area, and they have their little area."
Ben E. King,"Yeah. I've been pretty fortunate to travel I guess, all around the place."
Ben E. King,"Yeah. I'm amateurish. I can play enough to write a song, or strum on a little guitar to write out a song. But, I don't play well at all. I wouldn't even attempt for a second to play in public."
Ben E. King,"When we took on the name The Drifters, we became the new Drifters, and signed a contract to be put on salary, which I think was like a hundred dollars a week, a piece, five hundred dollars for all five of us."
Ben E. King,"When I got involved with The Five Crowns who later became The Drifters, and we got this hit record, I still was looking at this as kind of a fun thing."
Ben E. King,"Those things don't happen today. I feel sorry for the kids in the industry today. They have on sunglasses, eat caviar in jet planes, but they'll never know the true feeling that we did."
Ben E. King,"The Phil Spector that I would meet has always been a nice, quiet, little guy who's very serious about his work; obviously you can tell that because each and everything he's ever done has always been charted."
Ben E. King,"The movie is actually from a book by Stephen King called The Body. When they were gonna put it to a motion picture, they found the story was a bit too strong for the title The Body, based on a young kid's movie. It would be too heavy."
Ben E. King,The industry now wants to be in charge of everything.
Ben E. King,"One of the members of the group, I can't remember which one, found out we were making $3 - $5,000 a night. We were getting a hundred dollars a week a piece. Everybody got upset about it."
Ben E. King,"One minute we can be in a small club, the next minute we can be in a coliseum, and the next minute we can be in a small auditorium. It varies, depending on the promoter, the budget, and the travelling distance."
Ben E. King,"Of course, the kids who had never heard of a person called Ben E. King were then aware of the name associated with the song. That gave a tremendous lift to me as an artist."
Ben E. King,Many times I've gone on tours with Paul Anka. He would have someone sitting behind him to keep people from even talking to him. You were almost in a little restricted area there.
Ben E. King,"It would probably take me an hour to two to write it down, get the feel of it, and that's with quite a few changes. It's not really a hard thing for me to do."
Ben E. King,It never dawned on me at any particular time of my life that people are paid tremendous money to sing.
Ben E. King,It doesn't take me long to write songs.
Ben E. King,"In this country, we do a lot of hotel venues, and we do Fairs. We do joint concerts at stadiums with The Four Tops or The Temptations or Natalie Cole."
Ben E. King,"If there's anything about the business that I love and that I'm extremely happy about, is that my career started at that time and that I met some of the greatest entertainers at that time and some are still here."
Ben E. King,I still think my whole career was accidental. I didn't pursue it. I feel like I'm cheating sometimes.
Ben E. King,I never even visualized for a second doing what I'm doing.
Ben E. King,I do a lot of Vegas work and work with the comedians.
Ben E. King,"He was a manager, one of the singers, I guess talent coordinator for the local talent in Harlem. His name was Lover Patterson. He was living right across the street from where my dad had his restaurant. I guess he saw a lot of kids come in, a lot of my buddies."
Ben E. King,"But, to complete a song could take weeks."
Ben E. King,"At that time, we were in charge. We didn't ask. We just did. We just did what was in our heart."
Ben E. King,"And, because there was an honesty about all that was going on. It connected with the people in the street."
Ben E. King,We were doing things with a hundred per cent feeling. It wasn't programmed. It wasn't asked for. It wasn't structured. It was just there. It was very raw. I don't think the industry would allow that to happen again.
Billie Jean King,"Be bold. If you are going to make an error, make a doozy, and don't be afraid to hit the ball."
Billie Jean King,Men still get a lot more opportunity. It is still a big part of the old boy network. They have more companies they can get money from.
Billie Jean King,"It's just really important that we start celebrating our differences. Let's start tolerating first, but then we need to celebrate our differences."
Billie Jean King,It's fun to meet people from throughout the world who you don't have to explain yourself to.
Billie Jean King,"It is very hard to be a female leader. While it is assumed that any man, no matter how tough, has a soft side... and female leader is assumed to be one-dimensional."
Billie Jean King,I would just never out anybody. I think everyone has to find it in their own way and their own time.
Billie Jean King,I was always in the tennis business-from 1968. I was in tournaments and also on World Team Tennis teams as well.
Billie Jean King,I wanted to use sports for social change.
Billie Jean King,I used to be told if I talked about my sexuality in any way that we wouldn't have a tennis tour.
Billie Jean King,"I think younger players probably just think they are who they are-they don't think about coming out. Unless you're number one in the world, nobody cares, usually."
Billie Jean King,I think it's impossible to judge whether another person should come out. You just hope they will on their own time and their own terms.
Billie Jean King,"I like putting money back into what made my life, and tennis has been great to me."
Billie Jean King,"I have a lot to say, and if I'm not No. 1, I can't say it."
Billie Jean King,"Men can have a huge turnover of sponsorship and still survive a lot better than the women. But the women's ratings are better, at least at home in the United States than in the men's tennis."
Billie Jean King,I like entrepreneurial people; I like people who take risks.
Billie Jean King,"When we reach the point where the women athletes are getting their pick of dates just as easily as the men athletes, then we've really and truly arrived. Parity at last!"
Billie Jean King,"There is no life for girls in team sports past Little League. I got into tennis when I realized this, and because I thought golf would be too slow for me, and I was too scared to swim."
Billie Jean King,"That is where the power, opportunity, and choice come from-when you have money. Money equals opportunity. There is no question."
Billie Jean King,"Be bold. If you're going to make an error, make a doozy, and don't be afraid to hit the ball."
Billie Jean King,"Women's sports is still in its infancy. The beginning of women's sports in the United States started in 1972, with the passage of Title 9 for girls to finally get athletic scholarships."
Billie Jean King,"When they take surveys of women in business, of the Fortune 500, the successful women, 80% of them, say they were in sports as a young woman."
Billie Jean King,"They're not put on earth to be martyrs; they have to want to come out. It depends on your culture, where you work, where you live. Each person's circumstances are unique."
Billie Jean King,"Sports teaches you character, it teaches you to play by the rules, it teaches you to know what it feels like to win and lose-it teaches you about life."
Billie Jean King,"Martina's gone with people who don't want to be out, and it drives her crazy because she'd rather be open."
Billie Jean King,"In 1973, women got 59 cents on the dollar; now we are getting 74 cents on the dollar. In the area of finance and business, we are at 68 cents on the dollar."
Billie Jean King,"In 1973, a woman could not get a credit card without her husband or father or a male signing off on it."
Billie Jean King,"If your partner wants to be private, you have to respect that."
Billie Jean King,I would love to be a player today. I had the right personality for it.
Billie Jean King,"I didn't really care if I had a coach that much, me personally, because I was brought up to think for myself."
Billie Jean King,I always wanted to help make tennis a team sport.
Billie Jean King,"When I was outed, it was like, That's done."
Billie Jean King,The old boy network is still very strong and very true. Just look at the stock exchange and how many men and women are there. It is still very much run by men.
Billie Jean King,"Martina and I went through a very bad five years. Everything's very good between us now, but it was a long haul."
Billie Jean King,I love to promote our sport. I love grass-roots tennis. I love coaching. I love all parts of the sport. I love the business side.
Billie Jean King,I always liked co-ed events best so we have two men and two women on each team.
Billie Jean King,"Any therapist will tell you that when you're ready, you will come out. To be outed means you weren't ready."
Billie Jean King,A girl didn't get an athletic scholarship until the fall of 1972 for the very first time.
Billie Jean King,Tennis is a perfect combination of violent action taking place in an atmosphere of total tranquillity.
Billie Jean King,Sports are a microcosm of society.
Billie Jean King,Champions keep playing until they get it right.
Billy King,There's a responsibility [for them to be on the bench].
Billy King,Lee will give us some added offense and experience.
Billy King,"He came in to see the doctors and they looked at him, and he's not there yet, so we'll just talk with his agent and see where we go from there. I think it's three weeks where he could go up and down, not three weeks where he could play in a game. I think he should have optimism, but it's something I'll talk to his agent about and we'll go from there."
Chris King,"Now, I think about getting an education, getting a job and going to work,"
Chris King,These three transactions ... are a lot for any management team to digest. We believe the execution risks have increased dramatically.
Chris King,"We believe that this relationship will benefit the entire AMIS business, providing our business units the ability to design ICs with high gate counts, as well as offering turn-key customers the next-generation, specialized process technology required to produce robust solutions for demanding automotive, medical and industrial applications."
Chris King,"Would I send Chris King to Des Moines or Washington, D.C., and feel secure in his ability to represent me (and his) ability to convey the information and the needs of this community and the ability to interact socially and professionally with our state and federal leaders?"
David King,Shareholders benefit either way. I view it as a low-risk situation.
David King,"The development of NEC's Remote Management and Threat Management services is a direct result of the fundamental need of all businesses to provide a reliable and secure network. We believe that our customers benefit from their relationship with a single solutions provider who not only designs and deploys converged networks, but also manages and secures those networks."
David King,"[First Selectmen David King said the town would be very interested in their ideas to correct the problem, and suggested they contact the Maine Department of Transportation (MDOT) to share their ideas.] It sounds like a logical fix to the problem, ... You have our blessing and our thanks."
David King,"With thousands of SMB customers across verticals including healthcare, education and hospitality, NEC understands the flexibility required to meet individualized needs, as well as the value businesses place on building upon their existing infrastructure. This award demonstrates NEC's commitment to providing all customers with cost effective and efficient solutions designed to meet their growing needs."
David King,"I don't think that one dead swan is a crisis. I think what it meant was we immediately had to step up our surveillance procedures, we had to see that animal movements were restricted, and we had to make sure all of our reactions were done in the proper and reasonably constrained way."
David King,You know who is coming in and who keeps coming back. You can also test different elements of Web advertising.
Florence King,"Any discussion of the problems of being funny in America will not make sense unless we substitute the word wit for humor. Humor inspires sympathetic good-natured laughter and is favored by the ''healing-power'' gang. Wit goes for the jugular, not the jocular, and it's the opposite of football; instead of building character, it tears it down."
Florence King,Golf is tiddlywinks played while standing up and and wearing a hat
Florence King,Golf is an exercise in Scottish pointlessness for people who are no longer able to throw telephone poles at each other
Florence King,Chinks in America's egalitarian armor are not hard to find. Democracy is the fig leaf of elitism.
Florence King,Democracy:  The Crude leading the Crud
Florence King,Animal rights activists gives disillusioned feminists an excuse to go back to being women protecting wee creatures without compromising their radical credentials
Florence King,"In social matters, pointless conventions are not merely the bee sting of etiquette, but the snake bite of moral order."
Florence King,Showing up at school already able to read is like showing up at the undertaker's already embalmed: people start worrying about being put out of their jobs.
Florence King,I'd rather rot on my own floor than be found by a bunch of bingo players in a nursing home.
Florence King,"America is not a democracy, it's an absolute monarchy ruled by King Kid. In a nation of immigrants, the child is automatically more of an American than his parents. Americans regard children as what Mr. Hudson in ''Upstairs, Downstairs'' called ''betters.'' Aping their betters, American adults do their best to turn themselves into children. Puerility exercises droit de seigneur everywhere."
Florence King,"People are so busy dreaming the American Dream, fantasizing about what they could be or have a right to be, that they're all asleep at the switch. Consequently we are living in the Age of Human Error."
Jason King,"For many women, getting ready to go out is a ritual not to be rushed, with a third of women luxuriating for over an hour to prepare for an evening out - and most aren't off to the Oscars."
Jason King,"It wasn't bad, ... I've got all winter to rest up. I'm not really concerned with pitch counts at this point. You just do whatever it takes to win."
Jason King,You've got to take every opportunity you can and capitalize on it. You don't know how many chances you get at doing something like this and get a chance to win a (Calder) Cup.
Ken King,We're activating relationships that otherwise wouldn't have been there.
Ken King,It is going to go toward education funds for my grandchildren and it will subsidize my philanthropy.
