author,quote
Steve Price,He is well-conditioned and a great athlete. We want him to get into the third period and let his conditioning take over.
Charley Pride,"I think they do that not just with the election, but in general."
Charley Pride,It's a way to showcase themselves and get involved in the community.
Charley Pride,"When I came up, there was room for the new and the old. For every new artist, an old one didn't have to be pushed out."
Charley Pride,"What we don't need in country music is divisiveness, public criticism of each other, and some arbitrary judgement of what belongs and what doesn't."
Charley Pride,"What qualifies me to tell people how to act or what to think? I'm Charley Pride, country singer. Period."
Charley Pride,"Until MTV, television had not been a huge influence on music. To compete with MTV, the country music moguls felt they had to appeal to the same young audience and do it the way MTV did."
Charley Pride,There is an intimacy about the Opry Theater that gives an entertainer a special charge.
Charley Pride,The time I spent thinking about how I was better than somebody else or worrying about somebody else's attitude was time I could put to better use.
Charley Pride,The tastes of country music fans are not limited to the narrow range defined by consultants and programmers and record company moguls.
Charley Pride,Singing as a full-time job was not something I had given a lot of thought to and I had no clear notion of the money to be made in it.
Charley Pride,Redd Foxx was the same gruff old codger you saw on television.
Charley Pride,"Performing is an experience, for me, that is as humbling as it is energizing."
Charley Pride,"Once your name becomes well known, politicians come courting."
Charley Pride,No one had ever told me that whites were supposed to sing one kind of music and blacks another-I sang what I liked in the only voice I had.
Charley Pride,"It used to be that if you had a pretty good record, you could stop by a station in Little Rock or Atlanta and let the DJ listen to it. No way something like that can happen now."
Charley Pride,"It isn't reasonable to expect that everyone in the world is a country music fan. Not yet, anyway."
Charley Pride,In 20 years I had sold more records for RCA than any artist except Elvis Presley.
Charley Pride,I've tried to help a lot of young artists get started.
Charley Pride,I think there's enough room in country music for everybody.
Charley Pride,I learned to tune a guitar by ear. That method has served me pretty well.
Charley Pride,"For most entertainers, there is a single experience, one defining moment, when confidence replaces the self-doubt that most of us wrestle with."
Charley Pride,"Fans will praise you, scold you, and offer helpful advice. Fans will also defend you."
Charley Pride,Fans are what make a performer and I've always taken them seriously.
Charley Pride,Chet Atkins... is probably the best guitar player who ever lived.
Charley Pride,A black man singing about a blond girl was potential trouble.
Charley Pride,Any entertainer who tells you that the adoration of fans is not a heady experience probably never had the experience.
Charley Pride,"A fan will grab you and hug you and will not let go. When that happens, you wish it could be that way all over the world."
Charley Pride,"Even now, when I'm asked how I'm doing, I like to reply, 'Pretty good. I've got all my fingers and both eyes."
Charley Pride,"I was always a dreamer, in childhood especially. People thought I was a little strange."
Charley Pride,I grew up not liking my father very much. I never saw him cry. But he must have. Everybody cries.
Yevgeny Primakov,"The question is whether we're ready to undertake responsibility for overcoming the crisis or will again sink in debates, mutual recriminations and half-steps,"
Yevgeny Primakov,"I think that after the election in Kosovo the circumstances for dialogue will be better,"
Yevgeny Primakov,"Quickly passing the budget will strengthen our stance in the talks with international financial organizations,"
Scott Prince,He's very aggressive and he's a forward we had problems with a few weeks ago when we were playing the Cowboys. I suppose they're really going to miss his presence.
Scott Prince,"I think college is possible. I think you have to plan ahead a little bit, and make use of all of the resources available to you."
Scott Prince,I know college is expensive but it can be affordable. It's no surprise that financing college can seem to be a daunting task.
Scott Prince,He (Hodgson) would have been my first choice as well. He led my choices. He's a great bloke and a good friend. I support him 100 percent.
Victoria Principal,"Every year on her birthday, she would pick out a song which she would force me to sing at the top of my lungs with perverted lyrics. And she loved it. I tried to get in touch a few times, but she really wanted to be on her own."
Victoria Principal,"Success doesn't mean that you are healthy, success doesn't mean that you're happy, success doesn't mean that you're rested. Success really doesn't mean that you look good, or feel good, or are good."
Victoria Principal,I believe that how you feel is very important to how you look - that healthy equals beautiful.
Victoria Principal,"Unless we keep this planet healthy, everything else is for naught."
Jeff Probst,"[While not physically as strong, the women realized they had certain other advantages in competing against men stuck together for weeks in the tropics -- including the strategic use of a string bikini.] The women knew they could manipulate them, ... and the men were ready to be manipulated."
Jeff Probst,"[Judd Sergeant â€”] He's just one big opinion. Everything is 'man' this and 'man' that, ... He's a doorman by trade."
Jeff Probst,I finally met someone who could teach me about love.
Jeff Probst,definitely in love. More in love that I was six months ago.
Jeff Probst,"[Rafe Judkins â€”] The Ivy League student from Pittsburgh is very likable, ... It's funny; before the show he had taken a course in Mayan culture."
Jeff Probst,It was a lot of fun because we never had anyone on the show with such a lie to tell and tell it so well.
Jeff Probst,"You'll see many people on their back, on their knees, throwing up, eyes rolling back."
Jeff Probst,"It was a doozy. People were on their knees, on their backs, throwing up and having their eyes rolling back in their heads."
Jeff Probst,"I know the big events, like if a camp burned down from a fire. But in terms of the minutiae from day to day... not much. If somebody's just whining, I won't know about it, because everybody whines. But if there's a legitimate concern that a person may quit tonight at tribal council, then yes, I need to know that. Tribal council lasts anywhere from 45 minutes to an hour and a half."
Jeff Probst,"In a 12-month study using Blue Sun's B20 biodiesel, the National Renewable Energy Laboratory (NREL) found nitrogen oxide (NOx) was reduced by 4 percent compared to conventional diesel."
Jeff Probst,"In a 12-month study using Blue Sun's B20 biodiesel, the National Renewable Energy Laboratory (NREL) found nitrogen oxide (NOx) was reduced by 5 percent compared to conventional diesel."
Jeff Probst,"Think about for a minute what your body goes through out there. On a Friday night, you have a steak and then Saturday morning, you get up and have some eggs and some pancakes. Then Sunday, you're on 'Survivor' and suddenly you have nothing."
Jeff Probst,There's something to be said for embracing who you are.
Jeff Probst,"The thing that surprises me most is, you cannot change who you are."
Jeff Probst,Survivor is like rock 'n' roll - you can do what you want.
Jeff Probst,"Reality is a genre that seems to be here to stay. I don't know how many of the new shows will last, but the more competition you have, the harder that pie is to slice up."
Jeff Probst,"My goal was, and still is, to write first, direct my own stuff whenever possible and control my own creative destiny."
Jeff Probst,"Most people I run into say, I haven't missed an episode. Either you like Survivor or you don't, but if you do, you're a loyal viewer."
Jeff Probst,"I'm not one of these guys who says, Now I'm on a really hot show, better quit soon before I get labeled. That's the most ridiculous notion I'd ever heard."
Jeff Probst,I feel good about the work I do on Survivor and am proud of my contribution.
Jeff Probst,"Everyone wants to talk, you've just got to find a way to get them to talk."
Jeff Probst,Every day I get more and more honest.
Jeff Probst,"In Survivor and Finder's Fee, it is about what you would do if you could get away with it. Survivor is about your own integrity and where you draw your own ethical and moral lines. There are no rules."
Jeff Probst,"They sign up for ... the adventure of a lifetime, ... And that includes the highest highs and the lowest lows."
Romano Prodi,There is nothing to worry about; we are serene.
Romano Prodi,"Finally this electoral story is over. After the court ruling, Italians have no further doubts about our victory. Now we are working for a strong government and to resolve the problems of Italian society."
Romano Prodi,Finally the electoral affair is over. Italians have no more doubts about our victory.
Romano Prodi,"As was obvious, the check hasn't brought anything new. Our victory is confirmed."
Romano Prodi,"As was obvious, the review (of the ballot) hasn't made any difference. The victory is confirmed."
Romano Prodi,"The longer the torment, the sweeter the victory."
Romano Prodi,We will work to deserve the trust that our voters have shown us and to earn the trust of those who have legitimately decided to vote for the other coalition.
Romano Prodi,We'll work for our electors but also to gain the trust of those who legitimately voted for the other coalition.
Romano Prodi,"In his half-hour, he has a beautiful speech with a big screen. In mine, they try to catch the moment when I am asleep or relaxed or badly dressed."
Romano Prodi,"If there exists the slightest risk, then these weapons should be abolished immediately,"
Romano Prodi,I cannot hide from you a certain regret that we did not manage to go further.
Romano Prodi,"The truck will touch the country's problems first hand,"
Romano Prodi,to do everything in their power to stop the suicide bombers.
Romano Prodi,"The situation seems calmer, because I know there's nothing to worry about. We need patience, but in the end, this is democracy."
Romano Prodi,Premier Zhu confirmed that China is committed to overcoming the last obstacles.
Romano Prodi,was a mistake.
Romano Prodi,"There are terrible living conditions and unhappiness, (even) where everybody is Italian."
Romano Prodi,"Enough. It's time to work. I am working calmly for a future government, and that's what we must do."
Romano Prodi,"After what he said about vote-rigging, he should ask for forgiveness."
Romano Prodi,I do not fear a reversal of the results.
Romano Prodi,"Europe's citizens are disenchanted and anxious. They have lost faith in the European institution,"
Romano Prodi,"This will be an expression of European solidarity,"
Romano Prodi,"This is above our every expectation,"
Romano Prodi,We will take important initiatives in the areas of water and energy. I call on others to follow our lead.
Romano Prodi,"A grand coalition is not only extraneous to our program, but it happens when no majority emerges from the elections. In this case, a majority came out."
Romano Prodi,"The government is the same as that formed after the April 1996 elections, ... The core of our programs has not changed."
Romano Prodi,The only solution is early elections.
Romano Prodi,"A move like this, with elections nearing, can cause a sense of anguish and fear, and there is no need for that."
Romano Prodi,We won the elections and we have the right and the duty to govern. We will do so in the service and interests of all the country.
Romano Prodi,The election is finally over. Italians no longer have any doubts about our triumph.
Romano Prodi,"After September 11 the European Union reacted massively and with determination,"
Romano Prodi,"We want to leave behind our dependence on oil,"
Romano Prodi,"It is time to heed the popular will. Time for a speedy, peaceful transition to democracy. Europe stands ready to welcome the new Serbia with open arms,"
Romano Prodi,"Democracy goes on, sometimes slowly, but it does. It is a very important step."
Romano Prodi,The Italians no longer have any doubt about our victory. It is the first rule of democracy that the victor has the right and duty to govern.
Romano Prodi,It's very sad that such things can happen in a mature democracy.
Romano Prodi,"With the pencil and the ballot sheet, the weapons of democracy, we will win."
Romano Prodi,"This would be a very grave violation of a law of state, the law on equal access, which defends democracy by preventing overexposure in the media. Laws of state are made to be observed."
Romano Prodi,I ask you all to keep patient. This delay is incomprehensible.
Romano Prodi,"When you fight so hard and do not reach the goal, we must see this as a defeat for me, a defeat for our campaign. Denmark has spoken -- our people the Danes have spoken -- and I'm very pleased that so many Danes have cast their vote, ... We will continue along our path."
Romano Prodi,This data is worse than what had been given to the European Commission. There's an increase in debt for a second year in a row after there had been such an effort made to lower it.
Romano Prodi,a serious danger that must be met with eyes wide open.
Romano Prodi,We can govern for five years. Of course we'll need cooperation.
Romano Prodi,"We can govern for five years. Of course we'll need cooperation, but last night I said we would work for all Italians, not just some of them."
Romano Prodi,"They won't still believe his lies. They have believed him once, have seen the consequences, and will decide accordingly."
Romano Prodi,Italy's sole commitment will be for reconstruction and aid.
Romano Prodi,"It is a clear sign of commitment to closer relations between the EU and Russia,"
Romano Prodi,It's time that we close this strange comedy and move forward.
Romano Prodi,The game is over. And I'm glad. It's time to recognize our victory so that this strange comedy can end and we can move on like we should.
Romano Prodi,"an attack against a diplomat in such circumstances is an attack against democracy, the founding principle of the European Union."
Romano Prodi,"The Lithuanian voters have made a historic choice over this weekend, one which I am sure is the right one,"
Romano Prodi,This is the final exam for a student that deserves to be failed. In the budget there is little or nothing to stimulate economic development.
Romano Prodi,It?s like a bed sheet. It?s the result of this disastrous electoral law and it should be displayed in all Italian homes.
Romano Prodi,"Today the voters have given a clear message. That the arrogance of the government will not succeed,"
Romano Prodi,"In the darkest days of European history, America stood close by us and today we stand close by America, nothing will ever be the same."
Romano Prodi,They will be present. It was part of the electoral agreement.
Romano Prodi,"are all under attack, and we behave with a joint action because of that."
Romano Prodi,It should not have waited until we were forced to count the dead to take action.
Chris Pronger,"My understanding, they're going to be calling it the same way. I can't really give you an answer until we really get started to see what they're going to do. But what they say and what they do, we'll find out."
Chris Pronger,It's our game we have to worry about. It's always our game.
Chris Pronger,It doesn't matter what happens with the other games and the other teams as long as we keep our destiny in our own hands.
Chris Pronger,We're going back to a building that's obviously going to be electric. I haven't played in Canada in the playoffs. It's going to be a lot of fun.
Chris Pronger,I know I've been constantly watching what I put into my body. I think this process has us on edge because it's not an exact science.
Chris Pronger,"You've got to face some adversity, hopefully, we've learned a lot from today's game. We've got to find our own identity and not look back to '02."
Skip Prosser,"I think the foul trouble with Johnson helped a little bit, but our guys did an excellent job against Thornton. He's an excellent player."
Skip Prosser,We talk a lot of times about executing your way out of trouble instead of shooting your way out of trouble. We had some guys make some outstanding individual plays.
Skip Prosser,"I think it's a role that's fluid, to be determined as practice ensues,"
Skip Prosser,It's up to me to coach him to maximize his talents and to reach his full potential. He's a young man who tries very hard. My goal is to continue to try to coach him to be more productive as he played.
Skip Prosser,"When you get one and they get two shots, it's really hard to win."
Skip Prosser,We're not very happy with our record in the league.
Skip Prosser,They're a great free-throw shooting team. One of our goals was to try to keep them out of the 1 and 1 early. We didn't do that.
Skip Prosser,They beat us handily both times we played this season. They have a Hall of Fame coach and two of the premier players in our conference. They have a stupendous record in this tournament. We hope we honor them by playing to our potential.
Skip Prosser,"There's no question it's a different approach. Any dreams we have of the NCAA Tournament are totally dependent on what we do in Greensboro. We're cognizant of that, and there's no question the approach is 180 degrees different."
Skip Prosser,That's a formula for disaster.
Skip Prosser,He gives the other players courage.
Skip Prosser,"Coach [John] Wooden used seven players at UCLA. Coach [Denny] Crum used to say, 'The more moving parts you have, the greater the chance you have for a breakdown.' I think there's a lot of veracity to that."
Skip Prosser,"Joe Dukes, our freshman, has yet to play a college basketball game, so he'll have to learn on the job. It's very difficult league for on-the-job training."
Skip Prosser,"You guys saw the game, they were guarding him with, like, four guys. They had the Red Army down there on him but our other guys have to make plays as well."
Skip Prosser,"We know Williams is effective, but the other team knows that, too. They had the Red Army down there on him, and our other guys have to make plays as well."
Skip Prosser,"It shows we can beat a quality team. Our ability to play well against N.C. State, hopefully, will give us some confidence going into the Florida State game."
Marcel Proust,We are healed of a suffering only by expressing it to the full.
Marcel Proust,We are healed of a suffering only by experiencing it in full.
Marcel Proust,I had come in time to learn that it was a mistake to smile a friendly smile when somebody made a fool of me.
Marcel Proust,Any mental activity is easy if it need not take reality into account
Marcel Proust,"Time, which changes people, does not alter the image we have retained of them"
Marcel Proust,It is always during a passing state of mind that we make lasting resolutions
Marcel Proust,"The moments of the past do not remain still; they retain in our memory the motion which drew them towards the future, towards a future which has itself become the past, and draw us on in their train."
Marcel Proust,"Our memory is like a shop in the window of which is exposed now one, now another photograph of the same person. And as a rule the most recent exhibit remains for some time the only one to be seen."
Marcel Proust,That translucent alabaster of our memories.
Marcel Proust,A powerful idea communicates some of its power to the man who contradicts it
Marcel Proust,People who are not in love fail to understand how an intelligent man can suffer because of a very ordinary woman. This is like being surprised that anyone should be stricken with cholera because of a creature so insignificant as the comma bacillus.
Marcel Proust,"There can be no piece of mind in love, since the advantage one has secured is never anything but a fresh starting-point for future desires"
Marcel Proust,"Those whose suffering is due to love are, as we say of certain invalids, their own physicians"
Marcel Proust,[The literary figure who looms largest in] False Papers ... perfected a language ... and a vision that gave memory an introspection and aesthetic scope and magnitude no author had conferred on either before. He allowed intimacy itself to become an art form.
Marcel Proust,"In reality, in love there is a permanent suffering which joy neutralizes, renders virtual, delays, but which can at any moment become what it would have become long earlier if one had not obtained what one wanted, atrocious"
Marcel Proust,"Our intellect is not the most subtle, the most powerful, the most appropriate, instrument for revealing the truth. It is life that, little by little, example by example, permits us to see that what is most important to our heart, or to our mind, is learned not by reasoning but through other agencies. Then it is that the intellect, observing their superiority, abdicates its control to them upon reasoned grounds and agrees to become their collaborator and lackey."
Marcel Proust,"Like many intellectuals, he was incapable of saying a simple thing in a simple way"
Marcel Proust,Often it is just lack of imagination that keeps a man from suffering very much.
Marcel Proust,"His hatred of snobs was a derivative of his snobbishness, but made the simpletons (in other words, everyone) believe that he was immune from snobbishness"
Marcel Proust,"It has been said that beauty brings a promise of happiness, but it could be otherwise that the possibility of joy is the beginning of beauty."
Marcel Proust,The regularity of a habit is generally in proportion to its absurdity.
Marcel Proust,The fixity of a habit is generally in direct proportion to its absurdity
Marcel Proust,"Habit is a second nature which prevents us from knowing the first, of which it has neither the cruelties nor the enchantments"
Marcel Proust,"Neurosis has an absolute genius for malingering. There is no illness which it cannot counterfeit perfectly. If it is capable of deceiving the doctor, how should it fail to deceive the patient?"
Marcel Proust,"The opinions which we hold of one another, our relations with friends and kinfolk are in no sense permanent, save in appearance, but are as eternally fluid as the sea itself"
Marcel Proust,A fashionable milieu is one in which everybody's opinion is made up of the opinion of all the others. Has everybody a different opinion? Then it is a literary milieu.
Marcel Proust,"Your soul is a dark forest. But the trees are of a particular species, they are genealogical trees."
Marcel Proust,The world was not created once and for all time for each of us individually. There are added to it in the course of our life things of which we have never had any suspicion.
Marcel Proust,The only real voyage of discovery consists not in seeking new landscapes but in having new eyes.
Marcel Proust,"Our intonations contain our philosophy of life, what each of us is constantly telling himself about things."
Marcel Proust,"It is not because other people are dead that our affection for them grows faint, it is because we ourselves are dying."
Marcel Proust,"Like many intellectuals, he was incapable of saying a simple thing in a simple way."
Marcel Proust,The only paradise is paradise lost.
Marcel Proust,Happiness serves hardly any other purpose than to make unhappiness possible.
Marcel Proust,We don't receive wisdom; we must discover it for ourselves after a journey that no one can take for us or spare us.
Marcel Proust,Love is space and time measured by the heart.
Marcel Proust,We become moral when we are unhappy.
Marcel Proust,A change in the weather is sufficient to recreate the world and ourselves.
Marcel Proust,It is always during a passing state of mind that we make lasting resolutions.
Marcel Proust,"Happiness is beneficial for the body, but it is grief that develops the powers of the mind."
Marcel Proust,Only through art can we emerge from ourselves and know what another person sees.
Marcel Proust,"Words do not change their meanings so drastically in the course of centuries as, in our minds, names do in the course of a year or two."
Marcel Proust,"Those whose suffering is due to love are, as we say of certain invalids, their own physicians."
Marcel Proust,"Habit is a second nature which prevents us from knowing the first, of which it has neither the cruelties nor the enchantments."
Marcel Proust,"The time at our disposal each day is elastic; the passions we feel dilate it, those that inspire us shrink it, and habit fills it."
Marcel Proust,"Time, which changes people, does not alter the image we have retained of them."
Marcel Proust,"The real voyage of discovery consists not in seeking new landscapes, but in having new eyes."
Marcel Proust,A powerful idea communicates some of its strength to him who challenges it.
Marcel Proust,What a profound significance small things assume when the woman we love conceals them from us.
Marcel Proust,"We must never be afraid to go too far, for truth lies beyond."
Marcel Proust,"There is no man, however wise, who has not at some period of his youth said things, or lived in a way the consciousness of which is so unpleasant to him in later life that he would gladly, if he could, expunge it from his memory."
Marcel Proust,In a separation it is the one who is not really in love who says the more tender things.
Marcel Proust,We are healed from suffering only by experiencing it to the full.
Marcel Proust,People wish to learn to swim and at the same time to keep one foot on the ground.
