author,quote
Harold Pinter,"I feel even more strongly now than I ever did about the mendacity and the corruption and the injustice of so many of the actions taken by what are called freedom-loving Western democracies,"
Harold Pinter,Iraq is just a symbol of the attitude of western democracies to the rest of the world.
Harold Pinter,An arbitrary military action inspired by a series of lies upon lies and gross manipulation of the media and therefore of the public.
Peter Piot,"The reality is that the AIDS epidemic continues to outstrip the global and national efforts to contain it,"
Peter Piot,"The global response to AIDS has gained real momentum in the past decade, so much so that for the first time we can hope to get ahead of the epidemic."
Peter Piot,"We are on very thin ice here. AIDS has made a mess of Africa's health care systems, and none of the factors that created the AIDS disaster have gone away. But with bird flu, we could be looking at things getting worse in a matter of months, not decades."
Peter Piot,"AIDS continues to tear apart families and communities, leaving behind 15 million orphans and robbing countries of their future."
Peter Piot,We are facing here a crisis that is unprecedented.
George Pipas,"Our main contention here is that we do expect sales to fall off from these levels that are obviously quite high, and I think it's fair to say you can't maintain a sales rate which for the industry we estimate is going to be a at or near record levels, ... If you analyze this from a macro view, it's clear there is going to be payback from this program in the year ahead."
George Pipas,"Anytime you go from higher sales rates to lower sales rates, you're going to have to make some inventory adjustments, ... And it's clear there's more capacity being aimed at most profitable market in the world -- the North American light truck market. But you could see this coming a mile away. I think we are well positioned."
George Pipas,"I think what has to happen to impact sales is consumers have to come to believe that it (high gas prices) are permanent, not transitory, ... Buying a vehicle is a long-term commitment -- it's not easy to get out of it tomorrow. Gas prices have spiked in some regions in recent years and we haven't seen any significant impact on sales."
George Pipas,We expect sales in September to be lower than what we saw in August.
George Pipas,"sales declines, this year at least, in the traditional S.U.V. segment are becoming the norm, and we expect that to continue to be the case in the near future."
George Pipas,Sales in the short term are going to be more governed by the general economic landscape than currency exchange rates or consumer confidence measures. I'm not even sure 'moderate growth' describes the current economic expansion. Tepid is more like it.
George Pipas,"We weren't disappointed on overall sales, but cars did better and trucks didn't do as well as we thought. I think it's more fuel than anything. When you see these very rapid run ups, people get a little cautious."
George Pipas,"Anytime you go from higher sales rates to lower sales rates, you're going to have to make some inventory adjustments. And it's clear there's more capacity being aimed at most profitable market in the world -- the North American light truck market. But you could see this coming a mile away. I think we are well positioned."
George Pipas,"All our fleet sales are profitable, though daily-rental are the least so. What is Wall Street suggesting, that we stop selling to Hertz, Avis and Alamo? They're customers, and they're not going to fold their tents and go away."
George Pipas,"In many ways, it's running counter to the way the market is taking us."
George Pipas,"We have some owner concerns, more than we want. It became a big enough issue on Power Strokes, we came out with the incentives. We want to keep these owners with Ford."
George Pipas,I think these cars have yet to reach their full potential even at (that) level.
George Pipas,We're convinced this is the right thing to do from a long-term perspective but the withdrawal of this in some months is sometimes painful.
George Pipas,The real story is the improvement in revenue and product mix.
George Pipas,October wasn't a very good month for anybody. It was pretty much weak from the start and showed little improvement as the weeks progressed.
George Pipas,"While February was not a gold medal month, I think we definitely got back on the medals stand due to better-than-expected retail sales."
George Pipas,I would say that February sales are fairly close to our expectation.
George Pipas,"I think the outlook is very cloudy, ... It's difficult for anyone to assess what the impacts of these events, particularly when we were confronted with an economy in a pretty fragile condition."
George Pipas,"We are going to probably produce more cars and trucks in the first quarter than we had planned to before we saw the impact of the zero-percent financing program,"
George Pipas,"I feel good about our prospects, given the cars and crossovers in our lineup."
George Pipas,"Whatever level of incentives you start out at the beginning of model year, it rarely gets less expensive; it generally gets more expensive."
George Pipas,This is the golden age of the consumer. They want more for less and they're getting it.
Scottie Pippen,I wouldn't want to face the Bulls in the playoffs. They could be trouble.
Scottie Pippen,"It [would have] been very difficult. As I said, the rules ... but if the rules were put in place back when Michael Jordan was in his prime -- no hand-checking, the game was more geared toward offense, wanting to promote scoring in the game -- he could have probably got close. He did score 69."
Scottie Pippen,It's hard to put it in perspective right now. I'm starting to feel a little emotional about what's going to happen Friday night. Getting your number put in the rafters is always something that as a kid ... you dream of seeing happen to you.
Scottie Pippen,"I visualize the game. I think about who I am guarding, the things he likes to do."
Scottie Pippen,I've always led by example and I'm not that vocal.
Scottie Pippen,"Davis will give us some toughness inside and Williams has a lot of energy and enthusiasm, ... We got veteran guys who know how to play the game. I think it should make us better."
Luigi Pirandello,"Woman -- for example, look at her case! She turns tantalizing inviting glances on you. You seize her. No sooner does she feel herself in your grasp than she closes her eyes. It is a sign of her mission, the sign by which she says to man: ''Blind yourself, for I am blind.''"
Luigi Pirandello,Our whole knowledge of the world hangs on this very slender thread: the re-gu-la-ri-ty of our experiences
Luigi Pirandello,"Whatever is a reality today, whatever you touch and believe in and that seems real for you today, is going to be - like the reality of yesterday - an illusion tomorrow."
Luigi Pirandello,"It is misery, you know, unspeakable misery for the man who lives alone and who detests sordid, casual affairs; not old enough to do without women, but not young enough to be able to go and look for one without shame!"
Luigi Pirandello,"You too must not count too much on your reality as you feel it today, since like yesterday, it may prove an illusion for you tomorrow."
Luigi Pirandello,"I would love to spend all my time writing to you; I'd love to share with you all that goes through my mind, all that weighs on my heart, all that gives air to my soul; phantoms of art, dreams that would be so beautiful if they could come true."
Luigi Pirandello,The history of mankind is the history of ideas.
Luigi Pirandello,"When you say you are in love with humanity, you are well satisfied with yourself."
Luigi Pirandello,Women are like dreams - they are never the way you would like to have them
Luigi Pirandello,Nature uses human imagination to lift her work of creation to even higher levels.
Luigi Pirandello,In bed my real love has always been the sleep that rescued me by allowing me to dream.
Luigi Pirandello,"Life is full of infinite absurdities, which, strangely enough, do not even need to appear plausible, since they are true"
Luigi Pirandello,"Drama is action, sir, action and not confounded philosophy."
Luigi Pirandello,"When the characters are really alive before their author, the latter does nothing but follow them in their action, in their words, in the situations which they suggest to him."
Jeanine Pirro,I cannot win without your support.
Jeanine Pirro,"This is a short-term remedy, but we need it now. Ordinary New Yorkers are suffering."
Jeanine Pirro,"There are two women running for the United States Senate, ... Between those two women, there is only one who truly wants to be United States senator from New York."
Jeanine Pirro,"Hillary Clinton thinks taxes are the answer to all of our problems, ... Well, she is just plain wrong. Hillary Clinton wants to tax you from the cradle to the grave."
Jeanine Pirro,"I need you and every New Yorker on my side. But most important in this difficult campaign, I need people like you who I can trust."
Jeanine Pirro,It only carries as much weight as his own prestige. ... Other chairmen have their own opinions.
Jeanine Pirro,"I am gratified by Rudy's support, particularly given our shared law enforcement background. I look forward to his being a part of my campaign for Senate."
Jeanine Pirro,"Those people ... never choose to be a part of the criminal justice system, ... I fought for the underdog, for a level playing field, to make sure that those people who were victims, whose lives were forever changed because a criminal choose to change them, were cared for, to give them a voice."
Jeanine Pirro,The potential for growth is enormous.
Jeanine Pirro,"Later, she was asked about earlier gaffes, including an embarrassing 30-second-plus delay in her kickoff speech caused by a missing page of text. Pirro responded, 'I got to tell you, was it my best day? Absolutely not. Am I better than that? Absolutely not (sic).'"
Jeanine Pirro,"Teachers play such an enormous role in forming, not just teaching them, but forming character in our kids. We really have to thank them for what they do. They are really the core that makes our society work."
Jeanine Pirro,"Teachers play such an enormous role in forming, not just teaching them, but forming character in our kids. We really have to thank them for what they do. They are really the core that makes our society work,"
Jeanine Pirro,"What you're talking about here is a cancer and you have to cut it out, ... You can't use Band-Aids."
Jeanine Pirro,"In this age of 'CSI' and forensic medicine it's clear that with good old-fashioned police work ... we can put together a circumstantial case, ... And we can make sure that justice, however delayed, is not denied."
Robert Pirsig,"It is a puzzling thing. The truth knocks on the door and you say, Go away, I'm looking for the truth, and so it goes away. Puzzling."
Robert Pirsig,"It is a puzzling thing. The truth knocks on the door and you say, Go away, I'm looking for the truth, and so it goes away. Puzzling."
Robert Pirsig,"Metaphysics is a restaurant where they give you a thirty thousand page menu, and no food."
Robert Pirsig,"To live for some future goal is shallow.  It's the sides of the mountain that sustain life, not the top."
Robert Pirsig,"The Buddha, the Godhead, resides quite as comfortably in the circuits of a digital computer or the gears of a cycle transmission as he does at the top of a mountain or in the petals of a flower. To think otherwise is to demean the Buddha -- which is to demean oneself."
Robert Pirsig,Right thoughts produce right actions and right actions produce work which will be a material reflection for others to see of the serenity at the center of it all
Robert M. Pirsig,"It is always good policy to tell the truth unless of course you are an exceptionally good liar. Jerome K. Jerome It is a puzzling thing. The truth knocks on the door and you say, go away, I'm looking for the truth. and so it goes away. Puzzling."
Robert M. Pirsig,"The truth knocks on the door and you say, go away, I'm looking for the truth, and it goes away. Puzzling."
Robert M. Pirsig,"It is a puzzling thing. The truth knocks on the door and you say, 'Go away, I'm looking for the truth.' and so it goes away. Puzzling."
Robert M. Pirsig,"Traditional scientific method has always been at the very best, 20 -- 20 hindsight. It's good for seeing where you've been. It's good for testing the truth of what you think you know, but it can't tell you where you ought to go."
Rick Pitino,"You work so hard to get the program to be a Final Four caliber program and then not to make your conference tournament is really slipping. Regardless of how close we've played teams, that wins you no medals."
Rick Pitino,"It's very discouraging to work this hard -- and believe me, the way we shoot the ball, to stay in the game we've got to really, really work hard -- to just keep coming up short. We just made some very inexperienced mistakes down the stretch."
Rick Pitino,We got a good victory. We didn't turn the ball over much [and] we worked very hard at the defensive end.
Rick Pitino,This wasn't a good victory. It was a great victory.
Rick Pitino,That's as well as we've played. It was a great tempo. That's what we're trying to do more than anything else.
Rick Pitino,"On every team, if you have a point guard who thinks pass before shot, you're in trouble. You need a point guard to think pass before shot, and that's what he does."
Rick Pitino,"We're going to have some trouble there because he's much more experienced. He's like what you would expect of Terrance Farley as a senior. He's got good offensive moves in the low post; he's very long, rebounds well. So he's someone we're concerned about, and we have to stay out of foul trouble."
Rick Pitino,"This is a great group of guys and they want to win badly, but we have a little talent deficiency on the backboard. They want to rebound, but every game they get their tails kicked on the glass."
Rick Pitino,They just overpowered us with physical talent. It was disturbing.
Rick Pitino,We have some major injury problems that we haven't let out that need to be taken care of at the end of the year. To take these guys and put them through more problems would be not the right thing to do.
Rick Pitino,His (pain) threshold and his eagerness to play has been unbelievable.
Rick Pitino,He certainly had a good night.
Rick Pitino,It's going to be brutal. You've really got to be on your game every night out. There are going to be some good teams at home come March when they might otherwise be in the (NCAA) tournament. The league is that good.
Rick Pitino,"David was brilliant the whole night. He was smart. He made big defensive plays. He knew when to foul, when to step up. He just played a great overall game."
Rick Pitino,"Even in the pros, I loved to watch March Madness. It brings back so many good memories and it?s a lot of fun to be part of again."
Rick Pitino,"It's very special because I love the young men that I coached,"
Rick Pitino,"I think our young players are learning how to play, but now they have to learn how to win, how to finish a game, and we're not doing it."
Rick Pitino,"I am really not pleased with the improvement that we are making. I think our guys are having a very difficult time putting together 40 minutes of basketball. Yes we are playing a lot of different players. Our fours and fives have to play bigger, they play too small. They have the size to play big, but they don't play big with their intimidation of challenging shots."
Rick Pitino,I'm not pleased with our improvement. All of our guys are having a difficult time playing for 40 minutes.
Rick Pitino,He's not progressing and getting better like you would hope. The main thing is to just try to get him through the season.
Rick Pitino,I just hope he lets the game come to him.
Rick Pitino,We won't lose hope. And we will not get discouraged until the last game is played.
Rick Pitino,"They were all impressed with his honesty. He had a great interview. They called me up and said he blew them away, and I said, 'I told you,' and then he was offered the job."
Rick Pitino,"With this conference, you can't lose at home and expect to win on the road."
Rick Pitino,"Our guys played with tremendous heart, and I'm really proud of them."
Rick Pitino,"I think we showed tremendous guts and heart down the stretch. Getting behind against Richmond was the worst possible scenario on a basketball court. You get behind on a team like that, and it's an uphill battle all the way with the treadmill level on 10."
Rick Pitino,"We needed to win this game, to meet our goals of two out of four on the road and sweeping at home (over the last seven games). Now we've got to do it at West Virginia, at Syracuse first and at Connecticut - a pretty easy task."
Rick Pitino,"Our goal is the same as it was when we left (for this road trip). We had six road games left. We want to win at least two of those and sweep our remaining four games at home. â€¦ We had a golden opportunity that we gave away (at Rutgers), which was one of our best opportunities on the road."
Rick Pitino,"We played a terrific game. We played great. They're just better. They have every player back (from last year) and we don't. We think we have a good grasp on how to play them, but they're just better at what they do than we are at what we do."
Rick Pitino,I was hoping they wouldn't have that type of game they had (Wednesday). I was hoping they'd save that for us. We're probably going to see a different Syracuse team against us because they have great pride. They need the game and we need the game.
Rick Pitino,We're playing like our life is on the line. That's hat makes it fun.
Rick Pitino,"We'll attempt to out-think one another, but once the game is over, we'll go back to being good friends. When he comes to Louisville, I'll have him over for dinner, and when we come to Syracuse, I'm sure he'll have me over to his house."
Rick Pitino,I just hope he lets the game come to him. When he tries to force things he looks about as bad as he can look. He's at his best when he lets the game come to him so I just hope he doesn't try to impress anybody.
Rick Pitino,"This is not Conference USA. That was a finesse, fast-break type league. This is a football league in a basketball league. We let them push us around on the glass. You've got to put pads on and get ready to go."
Rick Pitino,"Don't let that humility and quiet nature fool you, though. It can be there to fool you. Deep down there's that fire that competed on the court. It's in the coaches' box, too. Some of the best coaches of our time, Dean Smith and John Wooden, had that demeanor."
Rick Pitino,The best part about it is that he [Donovan] hasn't changed except growing older and having a family. He's still the same humble person from Providence College that he was in 1987.
Rick Pitino,"I'm not concerned about getting anybody experience anymore. We've got two games before the Big East starts, and we're going to get down to our normal rotation."
Rick Pitino,"They're deep, they're tall, they have great experience, they have a great point guard with an unbelievable assist-to-turnover ratio. They can beat you inside, they can beat you outside, they can beat your zone, your man. They're very powerful and they're tough kids. They're as good as it gets."
Rick Pitino,"We had these same problems last year, except we had great experience. Last year we were able to [win despite] the injuries because it was Conference USA. We could still get wins ... because there are so many programs rebuilding, you could withstand all that. You can't withstand it in the Big East."
Rick Pitino,"Marquette ran their offense, did some good things. But it takes great execution and a big night from someone to make that happen. You never know what's going to happen. You can't give up, you've got to stay in there and fight. You never know, Saturday could be the upset that turns this around."
Rick Pitino,"It's not for entertainment. It's going to be a very intense practice. We're not going to hold back because you are there. We're not going to watch our language, so if that bothers you, don't come."
Rick Pitino,"Over the last few days, his condition has deteriorated. The doctors say it's in his best interest to have the surgery now so he can begin the process of preparing for his return to the court."
Rick Pitino,"He coached a perfect game tonight, offense and defense. It was one of the best coached games I've seen in some time."
Rick Pitino,"They're practicing great. They always practice hard. We lost the Rutgers game by making mental mistakes on defense late in the game in two key situations. Unfortunately, we had the desire and the effort but we have a lot of immaturity and broke down mentally on key wrinkles to the defense."
Rick Pitino,"A man not perfect, but of heart so high, of such heroic rage, That even his hopes became a part of earth's eternal heritage."
Rick Pitino,"The one thing I learned about well-coached teams like this that control the ball is, don't worry about it, their style of play is going to win out. Just be fundamentally sound and don't get anxious and foul. Contain the basketball and rebound and that's what we did."
Rick Pitino,"Even though he is like a son to me, he has been seriously reprimanded. A lot of consequences are going to be paid for this, but it's a lesson for everybody."
Rick Pitino,We made smart plays tonight at the defensive end. (Winning) can help (our confidence) immensely.
Rick Pitino,"What it shows you is that not only are they not afraid of competition, but the name Louisville is certainly not going to intimidate this team one bit."
Rick Pitino,"What did (Noah) say, 'Last time I checked, there was food in the fridge. Noah is a terrific college player, but he's not ready. It's one thing to go to the pros, and another to be ready to play."
Rick Pitino,"He is special to our game. He is needed in our game, because everyone wants to coach someone with 1300 on the SAT. Everyone wants a Grant Hill, unfortunately not everyone can get a Grant Hill. Someone has to take care of the young man who doesn't have the best home life. Bob Huggins is someone who can get them over the hump in life. Many have progressed and moved on because of Bob Huggins."
Rick Pitino,I like this team a lot. This freshman class is really strong. I can't tell you who the best player is. I can't tell you who has the most potential. That's a very good statement to make.
Rick Pitino,"I actually think if you have a strong junior class, that's the best possible scenario. In their senior year, guys who are on the threshold of making it [to the NBA] start getting preoccupied in their thoughts elsewhere more than concerning themselves with the present. The junior class is the perfect age."
Rick Pitino,"The formula I always use for picking teams is whoever has the most  talent in the junior and senior class wins the championships,"
Rick Pitino,"Under the circumstances of what David has had to go through this year, he's had a darn good year. And he's done it under the most trying circumstances you can imagine. His threshold for pain is kind of incredible. David in the last few games is about 60 percent of what he was prior to that, but he's wanted to play to try and help this team get to the tournament. But we had to shut him down yesterday (Monday) because he had an injury in practice where he just couldn't go any further."
Rick Pitino,"Under the circumstances of what he's had to go through this year, he's had a darn good year."
Rick Pitino,"We have no choice but to win on the road if we want to be an NCAA (tournament) team. If we don't win, we don't deserve to be an NCAA team. It's just as simple as that."
Rick Pitino,"We got what we deserved from the first day of practice until right now. We showed remarkable character, we showed remarkable resilience with a lot of injuries but we also showed a lack of talent against great competition."
Rick Pitino,"He's a cancer survivor himself, and he's lost relatives and close friends, like Jim Valvano, to the disease, so I'm not surprised he's gone at this the way he has. He's the captain of this ship, leading the way for the rest of us."
Rick Pitino,"He's got to work on his body, to get stronger for the next level, but he's terrific. He doesn't get rattled; he's seen probably every defense."
Rick Pitino,T-Will did a very good job of passing the basketball. I think he's going to do a lot down the road what (former Cardinal) Francisco Garcia does. That's the best part about his game is his passing.
Rick Pitino,"We played a great basketball game in all phases. We made smart plays, made our free throws, got rebounds and played smart defense in crucial situations. I'm very happy for our guys because they got some rewards for working hard, very hard. You can see by the way we're playing, we're not looking forward to next year. Our time is now, and we're going to keep playing that way."
Rick Pitino,We have a whole new basketball team. It's going to take time to nurture this team. We may have survived a little if we were in Conference USA with this team. But surviving in the Big East is another story. You've got to grow up in a hurry.
Rick Pitino,"Villanova is certainly deserving of its ranking. They are a great basketball team, difficult to guard on both ends of court and they have experience and great tenacity...Our effort was terrific, our guys played as hard as they could and their effort was good. Villanova was just a better basketball team."
Rick Pitino,"He's out of shape, but for the shape he's in, he played great. He hasn't played basketball in three weeks, but under the circumstances, he played awesome."
