author,quote
Charles Payne,"I think these stocks, from a risk-reward point of view, have a lot of upside potential as well as something like an American Express, again, because of the credit risk out there,"
Charles Payne,"The market's at the mercy of sentiment, which is very bad. It's not panic selling, but there's a lack of buyers right now. There's a lot of money on the sidelines."
Charles Payne,We have a changing of the guard in technology. All these cornerstone tech names can't conjure up the magic they once did and I think it's time people started looking for new bellwethers.
Charles Payne,I'm hoping that it's accompanied with encouraging language.
Charles Payne,a real powerful mix for some kind of recovery.
Charles Payne,It would generate some income from an otherwise dead portfolio.
Charles Payne,I hope some of them [reporting results] will say at least things are getting better.
Charles Payne,"What you have in this type of environment is that when rallies fail or even stall, people say it's just time to dump."
Charles Payne,The air of enthusiasm is starting to seep out of the markets and there's a realization that it's going to take a long time to go from recession to expansion.
Charles Payne,"The economically sensitive stocks are doing well. Historically, that's a sign that the economy is improving."
Charles Payne,"While I applaud the resiliency, you can still see via the volume that there is not widespread conviction."
Charles Payne,"While I applaud the resiliency, you can still see via the volume that there is not widespread conviction,"
Christopher Payne,"These new enterprise-class enhancements will empower IT professionals to deliver higher productivity, lower IT management costs, and greater ease of use throughout their organizations. Gaining rapid access to more relevant, up-to-date, and action-oriented search results will enable information workers to make better, faster decisions."
Christopher Payne,"These new enterprise-class enhancementsâ€¦ will empower IT professionals to deliver higher productivity, lower IT management costs, and greater ease of use throughout their organizations. Gaining rapid access to more relevant, up-to-date, and action-oriented search results will enable information workers to make better, faster decisions."
Christopher Payne,"We believe people will benefit from the ability to not just view a page, but to easily act on that data in contextually relevant ways, both online in the search experience and in the applications they are using."
David Payne,"Really, this offers a way to look at truth from a different perspective. If we always look at things from the same view, we can become blasÃ©. But a new perspective can always be invigorating."
David Payne,This is another evolution of CNN.com and our commitment to bring people the latest news at their command.
David Payne,"I have nothing but admiration for everybody on our team tonight,"
David Payne,"Instead of antonyms and analogies, which depend on vocabulary, we want to measure the ability to understand reading passages, so we would ask students to indicate the sentence in a passage where the author presents an argument contrary to his thesis, or find the two sentences that are equivalent."
David Payne,"Instead of antonyms and analogies, which depend on vocabulary, we want to measure the ability to understand reading passages, so we would ask students to indicate the sentence in a passage where the author presents an argument contrary to his thesis, or find the two sentences that are equivalent,"
David Payne,"The revamp is in response to graduate schools' desires for additional information on students' ability in verbal reasoning and quantitative. It's also very much security, and to ensure that the scores we report are valid."
David Payne,"The revamp is in response to graduate schools' desires for additional information on students' ability in verbal reasoning and quantitative, ... It's also very much security, and to ensure that the scores we report are valid."
John Payne,"Usually, poll workers only go to school every third year, but because we have an exceptional circumstance, we required everyone to be there for all 15 classes."
John Payne,My son was the one getting bullied around at that school.
John Payne,"We've never had so many ballots with so many problems,"
John Payne,We've never had so many petitions where there's been problems.
John Payne,"We want to see the city come back, and we're willing to listen to proposals and ideas. We want to work with local and state officials to get the city back on its feet."
Gary Payton,It reminds you of the days Larry Bird and Magic would go at it.
Gary Payton,"It'll be a big loss and that's going to hurt us because he adjusts a lot of (shots) in the game. Hopefully, it's just a couple of games or whatever and he'll come back and be with us."
Gary Payton,"And that's what I'm telling Jason right now, ... The way we play defense, the way we help, he should be great...And it's gonna take time, because he's never done it. And I'm gonna stay on him, I'm gonna stay on him a lot."
Walter Payton,"Dad had pictures of himself everywhere,"
Walter Payton,"Remember, tomorrow is promised to no one."
Walter Payton,"Most important thought, if you love someone, tell him or her, for you never know what tomorrow may have in store."
Octavio Paz,Modern man likes to pretend that his thinking is wide-awake. But this wide-awake thinking has led us into the mazes of a nightmare in which the torture chambers are endlessly repeated in the mirrors of reason.
Octavio Paz,"Writers, you know, are the beggars of Western society."
Octavio Paz,Deserve your dream.
Octavio Paz,"Love is an attempt at penetrating another being, but it can only succeed if the surrender is mutual."
Octavio Paz,Solitude is the profoundest fact of the human condition. Man is the only being who knows he is alone.
Octavio Paz,Technology is not an image of the world but a way of operating on reality. The nihilism of technology lies not only in the fact that it is the most perfect expression of the will to power... but also in the fact that it lacks meaning.
Octavio Paz,"Man, even man debased by the neocapitalism and pseudosocialism of our time, is a marvelous being because he sometimes speaks. Language is the mark, the sign, not of his fall but of his original innocence. Through the Word we may regain the lost kingdom and recover powers we possessed in the far-distant past."
Octavio Paz,"Today we all speak, if not the same tongue, the same universal language. There is no one center, and time has lost its former coherence: East and West, yesterday and tomorrow exist as a confused jumble in each one of us. Different times and different spaces are combined in a here and now that is everywhere at once."
Octavio Paz,The electoral process of July 6 perhaps represents a new era in the history of Mexico.
Octavio Paz,"Literature is the expression of a feeling of deprivation, a recourse against a sense of something missing. But the contrary is also true: language is what makes us human. It is a recourse against the meaningless noise and silence of nature and history."
Octavio Paz,"If we are a metaphor of the universe, the human couple is the metaphor par excellence, the point of intersection of all forces and the seed of all forms. The couple is time recaptured, the return to the time before time."
Octavio Paz,Social criticism begins with grammar and the re-establishing of meanings.
Octavio Paz,"A glass pitcher, a wicker basket, a tunic of coarse cotton cloth. Their beauty is inseparable from their function. Handicrafts belong to a world existing before the separation of the useful and the beautiful."
Octavio Paz,"The North American system only wants to consider the positive aspects of reality. Men and women are subjected from childhood to an inexorable process of adaptation; certain principles, contained in brief formulas are endlessly repeated by the Press, the radio, the churches, and the schools, and by those kindly, sinister beings, the North American mothers and wives. A person imprisoned by these schemes is like a plant in a flowerpot too small for it: he cannot grow or mature."
Octavio Paz,To read a poem is to hear it with our eyes; to hear it is to see it with our ears.
Octavio Paz,"Art is an invention of aesthetics, which in turn is an invention of philosophers... What we call art is a game."
Norman Vincent Peale,Change your thoughts and you change your world.
Norman Vincent Peale,It's always too early to quit.
Norman Vincent Peale,If you have zest and enthusiasm you attract zest and enthusiasm. Life does give back in kind.
Norman Vincent Peale,"Your enthusiasm will be infectious, stimulating and attractive to others. They will love you for it. They will go for you and with you."
Norman Vincent Peale,The trouble with most of us is that we would rather be ruined by praise than saved by criticism.
Norman Vincent Peale,"If you put off everything till you're sure of it, you'll never get anything done."
Norman Vincent Peale,Empty pockets never held anyone back. Only empty heads and empty hearts can do that.
Norman Vincent Peale,A masterful retreat is itself a victory
Norman Vincent Peale,"Understanding can overcome any situation, however mysterious or insurmountable it may appear to be."
Norman Vincent Peale,The ''how'' thinker gets problems solved effectively because he wastes no time with futile ''ifs.''
Norman Vincent Peale,"Four things for success: Work and pray, think and believe."
Norman Vincent Peale,We struggle with the complexities and avoid the simplicities.
Norman Vincent Peale,People become really quite remarkable when they start thinking that they can do things. When they believe in themselves they have the first secret of success.
Norman Vincent Peale,Don't duck the most difficult problems. That just insures that the hardest part will be left when you're most tired. Get the big one done - it's downhill from then on.
Norman Vincent Peale,"Every problem has in it the seeds of its own solution. If you don't have any problems, you don't get any seeds."
Norman Vincent Peale,"When a problem comes along, study it until you are completely knowledgeable. Then find that weak spot, break the problem apart, and the rest will be easy."
Norman Vincent Peale,"Become a possibilitarian. No matter how dark things seem to be or actually are, raise your sights and see possibilities -- always see them, for they're always there."
Norman Vincent Peale,"Watch your manner of speech if you wish to develop a peaceful state of mind. Start each day by affirming peaceful, contented and happy attitudes and your days will tend to be pleasant and successful."
Norman Vincent Peale,Stand up to your obstacles and do something about them. You will find that they haven't half the strength you think they have.
Norman Vincent Peale,"We've all heard that we have to learn from our mistakes, but I think it's more important to learn from successes. If you learn only from your mistakes, you are inclined to learn only errors."
Norman Vincent Peale,Anybody can do just about anything with himself that he really wants to and makes up his mind to do. We are capable of greater things than we realize.
Norman Vincent Peale,Formulate and stamp indelibly on your mind a mental picture of yourself  succeeding. Hold this picture tenaciously. Never permit it to fade. Your mind will seek to develop the picture...Do not build up obstacles in your imagination.
Norman Vincent Peale,"Whenever a negative thought concerning your personal power comes to mind,deliberately voice a positive one to cancel it out."
Norman Vincent Peale,It is of practical value to learn to like yourself. Since you must spend so much time with yourself you might as well get some satisfaction out of the relationship.
Norman Vincent Peale,Know that you yourself are a miracle.
Norman Vincent Peale,"Once we roared like lions for liberty; now we bleat like sheep for security! The solution for America's problem is not in terms of big government, but it is in big men over whom nobody stands in control but God."
Norman Vincent Peale,The person who sends out positive thoughts activates the world around him positively and draws back to himself positive results.
Norman Vincent Peale,Help us to be thankful for this day and every day and treat each one as a preciousgem to be filled to the full with meaning and with love.
Norman Vincent Peale,Formulate and stamp indelibly on your mind a mental picture of yourself succeeding. Hold this picture tenaciously. Never permit it to fade. Your mind will seek to develop the picture...Do not build up obstacles in your imagination.
Norman Vincent Peale,Imagination is the true magic carpet.
Norman Vincent Peale,Throw your heart over the fence and the rest will follow
Norman Vincent Peale,"Joy increases as you give it, and diminishes as you try to keep it for yourself. In giving it, you will accumulate a deposit of joy greater than you ever believed possible."
Norman Vincent Peale,"Our happiness depends on the habit of mind we cultivate. So practice happy thinking every day. Cultivate the merry heart, develop the happiness habit, and life will become a continual feast."
Norman Vincent Peale,"Lots of people limit their possibilities by giving up easily. Never tell yourself this is too much for me. It's no use. I can't go on. If you do you're licked, and by your own thinking too. Keep believing and keep on keeping on."
Norman Vincent Peale,"If you paint in your mind a picture of bright and happy expectations, you put yourself into a condition conducive to your goal."
Norman Vincent Peale,We tend to get what we expect.
Norman Vincent Peale,"The life of inner peace, being harmonious and without stress, is the easiest type of existence."
Norman Vincent Peale,"Problems are to the mind what exercise is to the muscles, they toughen and make strong"
Norman Vincent Peale,I really believe kids want to do well. It's a coach's job to create an environment for them to be successful.
Norman Vincent Peale,"Be interesting, be enthusiastic... and don't talk to much."
Norman Vincent Peale,There is a real magic in enthusiasm. It spells the difference between mediocrity and accomplishment.
Norman Vincent Peale,Enthusiasm releases the drive to carry you over obstacles and adds significance to all you do.
Norman Vincent Peale,Enthusiasm releases the drive to carry you over obstacles and adds significance to all you do
Norman Vincent Peale,"You can have peace of mind, improved health and an ever-increasing flow of energy. Life can be full of joy and satisfaction."
Norman Vincent Peale,"The more you lose yourself in something bigger than yourself, the more energy you will have."
Norman Vincent Peale,You would think that economy would be one of the easiest habits in the world to break but it isn't.
Norman Vincent Peale,Have great hopes and dare to go all out for them. Have great dreams and dare to live them. Have tremendous expectations and believe in them.
Norman Vincent Peale,"Believe you are defeated, believe it long enough, and it is likely to become a fact."
Norman Vincent Peale,"When every physical and mental resources is focused, one's power to solve a problem multiplies tremendously."
Norman Vincent Peale,It is a fact that you project what you are.
Norman Vincent Peale,"Christmas waves a magic wand over this world, and behold, everything is softer and more beautiful."
Norman Vincent Peale,"When you become detached mentally from yourself and concentrate on helping other people with their difficulties, you will be able to cope with your own more effectively. Somehow, the act of self-giving is a personal power-releasing factor."
Norman Vincent Peale,"Never say anything to hurt anyone. Moreover... refrain from double talk, from shrewd and canny remarks that are designed to advance our interests at someone's disadvantage. We are to turn our back upon evil, and in every way possible, do good, help people and bring blessings into their lives."
Norman Vincent Peale,"First thing every morning before you arise say out loud, ''I believe,'' three times."
Norman Vincent Peale,"Believe you are defeated, believe it long enough, and it is likely to become a fact"
Norman Vincent Peale,Don't take tomorrow to bed with you.
Norman Vincent Peale,"Promises are like crying babies in a theater, they should be carried out at once."
Norman Vincent Peale,When you pray for anyone you tend to modify your personal attitude toward him. You lift the relationship thereby to a higher level. The best in the other person begins to flow out toward you as your best flows toward him. In the meeting of the best in each a higher unity of understanding is established.
Norman Vincent Peale,"Any fact facing us is not as important as our attitude toward it, for that determines our success or failure. The way you think about a fact may defeat you before you ever do anything about it. You are overcome by the fact because you think you are."
Norman Vincent Peale,"Any fact facing us is not as important as our attitude toward it, for that determines our success or failure"
Norman Vincent Peale,When you pray for anyone you tend to modify your personal attitude toward him.
Norman Vincent Peale,Getting people to like you is merely the other side of liking them.
Norman Vincent Peale,Live your life and forget your age.
Norman Vincent Peale,"Age-based retirement arbitrarily severs productive persons from their livelihood, squanders their talents, scars their health, strains an already overburdened Social Security system, and drives many elderly people into poverty and despair. Ageism is as odious as racism and sexism."
Norman Vincent Peale,Life's blows cannot break a person whose spirit is warmed at the fire of enthusiasm
Norman Vincent Peale,"Cushion the painful effects of hard blows by keeping the enthusiasm going strong, even if doing so requires struggle."
Norman Vincent Peale,"Part of the happiness of life consists not in fighting battles, but in avoiding them. A masterly retreat is in itself a victory."
Norman Vincent Peale,"Action is a great restorer and builder of confidence. Inaction is not only the result, but the cause, of fear. Perhaps the action you take will be successful; perhaps different action or adjustments will have to follow. But any action is better than no action at all."
Norman Vincent Peale,"Repetition of the same thought or physical action develops into a habit which, repeated frequently enough, becomes an automatic reflex."
Norman Vincent Peale,You will soon break the bow if you keep it always stretched.
Norman Vincent Peale,Believe in yourself! Have faith in your abilities! Without a humble but reasonable confidence in your own powers you cannot be successful or happy.
Harry Pearce,"We worked in good faith to resolve this issue with Motorola and we are very pleased with the successful outcome, ... The Board selected Mike as we believe he is the best candidate to assume the role of president and CEO and we have every confidence in him. We look forward to a great future together."
Harry Pearce,We worked in good faith to resolve this issue with Motorola and we are very pleased with the successful outcome.
Harry Pearce,We would like to take cars out of the environmental debate.
Harry Pearce,We have absolutely not delivered on our commitment with respect to (U.S.) market share.
Harry Pearce,"We needed stability, to be very transparent in our commitment to the future of the company. It was very important in my judgment that we not prolong the process. It had to be a high-quality search but we had to move quickly."
Bruce Pearl,"We deserved victory. It wasn't like we had to get hit in the mouth to start playing. We were ready to play, and we had to play well."
Bruce Pearl,"These guys, all year long, played every game trying to prove that they were better than what they had been playing. ... And we have to recapture that now."
Bruce Pearl,"How big was Bradshaw? Dane makes a couple of 3s. And playing with foul trouble, and once again doesn't have a turnover. That's like four or five games in a row. He doesn't turn the ball over. Just super-solid."
Bruce Pearl,Absolutely. There's a different set of rules for him than anybody else on the team.
Bruce Pearl,"You weren't recruited at that high major level, you don't travel the way (power conferences) travel, you're not on television as much."
Bruce Pearl,"I can't worry about what their tournament record was in the past. To me, that doesn't have a lot to do with this team."
Bruce Pearl,We will win more championships during my time here. We've won championships in the past. This one is going to be significant and it's going to be special because it was so unexpected and accomplished with a lot of obstacles and a lot to overcome. That said that's about all the reflecting I'm going to do on it because we have a lot of basketball to play.
Bruce Pearl,"He plays so hard and plays with guts and passion, and he's the kind of guy you'd like to have on your team, but hate to play against. I think it's a combination of respect, admiration and good fun."
Bruce Pearl,"I just think the opportunity to be on the road to the Final Four, to have the opportunity to be there for one shining moment, those are all the things we've got to push. We've got to try to get our identity back and playing a team out of conference that's not played us for the second or third time will be a positive. Ready or not, here it comes."
Bruce Pearl,I've been talking to this team all year about seeding. A good seed gives you a better opportunity to advance.
Bruce Pearl,"I think back in the fall if you'd given me an opportunity to come into this Monday morning press conference as SEC East champions having just lost to Arkansas on Saturday and asked if I'd have taken it, I think I probably would have taken it, so I'm absolutely positively not going to beat my team up today because they don't deserve it."
Bruce Pearl,I told every kid I'm recruiting to make sure they're watching (last night) on CBS. Phillip wears the same color shirt as I do. We're on the same team.
Bruce Pearl,"I am very disappointed in these young men. Our players need to take their responsibility for being a role model seriously, and if they don't act responsibly they won't be playing at Tennessee."
Bruce Pearl,"We'll be back. I'm very, very proud of these young men. I can't tell you how many people have written or called and said how much they enjoyed this basketball team. This Tennessee basketball team will go down as one of the all-time best, and this was the group that got it started."
Bruce Pearl,"Lofton did more than just get back on track. Lofton was the man. He got ready to play. He had that look in him, and Florida saw that look. National television and everybody saw that look."
Bruce Pearl,"March Madness has begun and we are very pleased to have won and advanced. I know this would have been hard for you (the media) to have not characterized it as an upset if we gotten beat, but we beat a very good basketball team. We played well. It was all we could do to win."
Bruce Pearl,"A big part of March madness is that there are going to be upsets. If Winthrop looks at the No. 2 seeds, they would be thankful they're playing Tennessee instead of some other two-seed."
Bruce Pearl,I've worked my whole life to get to a place like Tennessee.
Bruce Pearl,"They're the kind of team that could make some noise in the NCAA Tournament. We were playing for a (league) championship today, but they were playing for the (NCAA) tournament. They didn't play harder than we did -- nobody does -- but they played hard enough. I thought they wore us down with their offensive execution."
Bruce Pearl,We're going to be in close games all the time down the stretch. We're not going to run anybody off the floor.
Bruce Pearl,"I wasn't calling them out. I just remember some of coach Mears' teams, and the great games with Kentucky."
Bruce Pearl,"It was a fun, locker room moment."
Bruce Pearl,At least this buys us some time where people are not going to say it's just a football conference.
Bruce Pearl,"Fatigue may be a factor, but I don't want to make excuses. We're capable of defending better."
Bruce Pearl,We desperately want to win. We've tasted enough failure at Tennessee.
Bruce Pearl,"That's when we can separate and get on a run. Chris Lofton is a great example. I can't believe how open he got. I can't believe he made those shots. Had I called timeout, I couldn't have given him a better look."
Bruce Pearl,"I'm not at all unhappy with our fans or upset with the students. I shared their enthusiasm. OK, but we did it this one time. Let's not do it again."
Bruce Pearl,We played with great passion and great energy in the second half.
Bruce Pearl,"In the second half, Arkansas clearly was fresher. We did not have the energy to speed things up. Their size and athleticism made a difference. We struggled with our interior defense, and got dominated under the boards. It is hard to win when the numbers come out this way."
Bruce Pearl,"In the second half, Arkansas clearly was fresher. We did not have the energy to speed things up. We did not turn Arkansas over a lot. It takes energy to create offense or defense, and we needed more energy."
Bruce Pearl,"I was worried about him - so much emotion and so much going into one shot. If they would have won the game, it would have gotten them a little more recognition and they'd be happier, but it doesn't take away from what a great team, what a great program and what a coach he is. But I understand. I'm numb sitting here myself."
Bruce Pearl,He was extremely distraught after the game. I worried about him. So much emotion. So much going into that one shot. But I understand. I'm numb sitting here myself.
Bruce Pearl,"At this time, we are dealing with discipline internally."
